lemma,pos,sense_source,sense_target,semantic_relationship
liin,noun,"kindel marsruut, millel toimub pidev liiklus kahe koha vahel","maa-, vee- või õhutee, mida mööda toimub korrapärane liiklus kahe koha vahel",exact
liin,noun,"juhe, mida mööda miski liigub, näiteks elekter","kestvalt kasutatav edastusrada kahe või mitme punkti vahel (nt elektri-, side- või tootmisliin)",exact
liitma,verb,"ühendama, osadest kokku panema","millelegi juurde panema, lisama, üheks tervikuks koondama",exact
liitma,verb,matemaatikas: ühte arvu teise võrra suuremaks tegema,"summat leidma, kokku arvutama",exact
liitrine,adjective,"selline, mille sisse mahub üks liiter",mahuga üks liiter,exact
liitrine,adjective,"selline, kuhu mahub teatud arv liitreid",mahuga teatav arv liitreid,exact
liiv,noun,"looduslik aine, mis katab maad näiteks rannas ja kõrbes","looduslik peeneteraline (kollakas) aine, mis katab maad nt randades ja kõrbetes",exact
limonaad,noun,magus mullidega jook,magus gaseeritud karastusjook,exact
linn,noun,"koht, kus on palju elamuid, poode ja teisi hooneid","suur tihedalt asustatud ja hrl kompaktse hoonestusega asula, mis on ümbruskonna majandus- ja kultuurielu keskus",exact
linn,noun,kesklinn,"kesklinn, eriti vastandatuna äärelinnale, kodule, töökohale",exact
lint,noun,lai ja õhuke pael,lai õhuke pael (mitmesuguseks otstarbeks),exact
lipp,noun,"(pika) pulga külge kinnitatud riidest ese, mille peal on muster ja värvid, mis esindavad mingit riiki või organisatsiooni","riigi, rahvuse, organisatsiooni vm ühenduse, kõrge ametiisiku vms sümboliks olev hrl varda külge kinnitatud kindla kuju, pikkuse ja laiuse suhte, värvide ning kujundi(te)ga riidetükk",exact
lipp,noun,"pulga otsa kinnitatud riidest ese, mida kasutatakse mingi signaali andmiseks","leppelise või suvalise värvuse, kuju ja suurusega riidetükk tähisena või signaliseerimisvahendina",exact
lisa,noun,"miski, mis täiendab või suurendab millegi kogust või hulka","täiendus olemasolevale, see, mis suurendab juba olemasolevat kogust, määra või hulka",exact
lisa,noun,raamatu või dokumendi täiendav osa,"dokumendi või teose täiendav osa (nt kaardid ja skeemid väljaande lõpus, kleebistena või eraldi kaasandena)",exact
lisama,verb,midagi millelegi juurde panema,(mingit ainet või täiendavat osa) juurde panema,exact
lisama,verb,midagi täienduseks kirjutama või ütlema,täiendavalt midagi ütlema või kirjas väljendama,exact
lisama,verb,midagi suurendama,"(omaduse vms määra, hulga kohta:) suurendama",exact
loeng,noun,"suuline ettekanne, mille eesmärk on kuulajaid harida",hrl kindla kestusega õpetav või teavet andev suuline ettekanne,exact
lokkis,adjective,"juuste kohta: mitte sirged, laine moodi",laines või ruljalt kõveras,exact
loll,adjective,väga rumal,rumal ja taipamatu,exact
loll,adjective,väga rumal inimene,selline inimene,exact
loodus,noun,"kõik, mis on maailmas olemas ja pole inimese loodud, näiteks metsad, mäed ja mered koos neis leiduvaga","meid ümbritsev maailm, eriti taimed, loomad ja maastik (vastandatuna inimese loodule)",exact
looduslik,adjective,loodusega seotud,"loodusega seotud, looduses esinev, loodusest tulenev või pärinev",exact
loom,noun,"iga elav olend, kes liigutab ja tunneb, aga pole inimene, lind, kala ega putukas","elusolend, kes toitub taimedest vm organismidest ning on (vähemalt mõnes arengujärgus) võimeline liikuma",narrower
loom,noun,"iga elav olend, kes liigutab ja tunneb, ka inimene, lind, kala ja putukas","elusolend, kes toitub taimedest vm organismidest ning on (vähemalt mõnes arengujärgus) võimeline liikuma",narrower
loomulik,adjective,sündides kaasa saadud,"loodusest seatud, looduslikest teguritest johtuv",broader
loomulik,adjective,"asja või nähtuse olemusse kuuluv, normaalne","(asja, nähtuse) olemusse kuuluv, sellest lähtuv või johtuv",broader
lootma,verb,"soovima, et miski toimuks","midagi soovima, selle täideminekut uskuma ja ootama",exact
lootma,verb,"kelleltki abi või toetust ootama, selle saamisega arvestama","kelleltki või millestki abi, tuge uskuma ja ootama",exact
loterii,noun,"mäng, kus sa ostad pileti, mille peal on numbrid, ja kui sinu numbrid valitakse, siis sa võidad raha","õnnemäng, kus esemelise või rahalise võidu annab ostetud loosi või pileti numbri kokkulangemine võidunumbriga",exact
luba,noun,kelleltki saadud suuline või kirjalik nõusolek millegi tegemiseks,kelleltki saadud suuline või kirjalik nõusolek millekski,exact
luba,noun,juhiluba,juhiluba,exact
lubama,verb,millekski nõusolekut andma,"millegi tegemiseks või toimumiseks nõusolekut, luba andma",exact
lubama,verb,millekski lootust andma,"millegi kohta lubadust andma, kinnitama, et miski toimub",exact
lubama,verb,midagi võimaldama,vajalike eelduste või piisava ressursi olemasolul võimaldama,exact
lugeja,noun,"keegi, kes midagi loeb","raamatuid, teatud ajalehte vms regulaarselt lugev inimene",exact
lugema,verb,mingit teksti vaatama ja sellest aru saama,kirjalikku teksti sõnahaaval jälgima ja sõnu ning lauseid tõlgendades selle tähendust tajuma,exact
lugema,verb,arve järjekorras nimetama,"arve järjekorras nimetama või millegi hulka, kogust arvuliselt loendama",exact
lugu,noun,"jutt millegi kohta, mis on päriselt toimunud või välja mõeldud",juhtunud asi või omavahel seotud sündmuste kogum (ka suulises või kirjalikus esituses),exact
lugu,noun,laul või muu muusikaline pala,laul vm muusikapala,exact
lugu,noun,"olukord, asjaolud, asjade seis","olukord, asjade seis",exact
lugupeetud,adjective,"sõna, mida kasutame, kui pöördume kellegi poole viisakalt, näiteks avalikul üritusel või kirjas (lühend lp)",(pöördumissõnana),exact
luik,noun,"suur lind, kellel on pikk kael ja kes elab vees",suur pikakaelaline hrl valge sulestikuga veelind,exact
lumine,adjective,lumega kaetud,"lumega kaetud, lumekihi all või lumega koos olev",exact
lumine,adjective,"selline, kus sajab palju lund","selline, kus (rohkelt) lund sajab ja lumikate on püsiv",exact
läbi,adposition,ühelt poolt sisse ja teiselt poolt välja,"millegi ühest küljest sisse ja teisest välja, ühelt poolt teisele poole",exact
läbi,adposition,(algusest) lõpuni,"millegi algusest lõpuni, kogu ulatuses",narrower
läbi,adposition,kogu teatud perioodi jooksul,"millegi algusest lõpuni, kogu ulatuses",narrower
läbi,adposition,ajaliselt mööda või möödas,ajaliselt mööda või möödas,exact
läbi,adposition,katki,"osutab millegi terviklikkuse katkestamisele, katki minemisele, kulumisele",exact
läbi astuma,verb,korraks kuskil käima,"möödaminnes kuskil käima, kuskil korraks põgusalt viibima",exact
läbi käima,verb,"suhtlema, kokku puutuma","kellegagi suhtlema, aeg-ajalt kokku puutuma",exact
läbi käima,verb,mingis kohas käima,"kuhugi korraks sisse astuma, kuskil möödaminnes, ajutiselt viibima või eksisteerima",exact
läbi laskma,verb,mitte takistama millestki läbi liikumist,läbi- või möödapääsemist võimaldama,exact
läbi otsima,verb,millegi leidmiseks kedagi või midagi põhjalikult uurima,"(seaduslikul alusel) mingit kohta põhjalikult uurima, lootuses midagi või kedagi leida",exact
läbi saama,verb,"kui inimesed <b>saavad</b> omavahel <b>läbi</b>, siis nad on sõbralikes suhetes","kellegagi suhtlemises sobima, (tülitsemata) toime tulema",exact
läbi saama,verb,"kui sa saad näiteks eksamil läbi, siis sa saad selle tehtud",midagi edukalt sooritama,exact
läbi saama,verb,lõppema,"lõppema, lõpuni jõudma",exact
läbi vaatama,verb,"tähelepanelikult, kontrollides vaatama või uurima","midagi (otsivalt, põhjalikult) algusest lõpuni, kogu ulatuses silmitsema, uurima, lehitsema vm",broader
läbi vaatama,verb,"tähelepanelikult, kontrollides vaatama või uurima","arstlikku läbivaatust tegema, tervislikku seisundit uurima",broader
läbima,verb,millestki läbi minema,"kuskilt, millestki läbi minema (liikudes või paiknedes)",exact
läbimõõt,noun,"sirge joon ringi või muu ümmarguse objekti ühelt küljelt teise küljeni, mis läbib selle keskmist punkti","lõik, mis ühendab ringi või kera pinna kahte punkti, läbides ühtlasi ka keskpunkti",exact
läbipaistev,adjective,"selline, millest läbi vaadates on näha, mis on teisel pool","(aine või eseme kohta:) selline, millest läbi vaadates on näha, mis on teisel pool",exact
lähedalt,adverb,(kellestki või millestki) lühikese vahemaa kauguselt,(kellestki või millestki) lühikese vahemaa tagant,exact
lähedalt,adverb,"inimeste vahel olevate suhete kohta: vahetult, palju",lähedaste sugulus- vm tihedate sidemete kaudu,exact
lähedane,adjective,"selline, et on kellegagi heades või tihedates suhetes","(kellegagi tihedates suhetes või suguluses oleva inimese või sooja, südamest tuleva suhte kohta)",narrower
lähedane,adjective,"inimene, kellega on tihedad suhted (eriti sugulane)","(kellegagi tihedates suhetes või suguluses oleva inimese või sooja, südamest tuleva suhte kohta)",narrower
lähedus,noun,lähim ümbrus,lähem ümbrus,exact
lähedus,noun,lähedal olek,lähedal- või lähedane-olek,exact
lähim,adjective,"selline, mis on kõige lähemal",lühima vahemaa taga asuv,exact
lääs,noun,"ilmakaar, kuhu päike loojub","ilmakaar, kuhu loojub päike (põhjast 90° vastupäeva)",exact
lõhe,noun,"teatud roosa lihaga kala, kes elab meredes ja jõgedes",jõgedes kudev maitsva roosa lihaga põhjapoolsete merede siirdekala,broader
lõhe,noun,kitsas piklik tühi koht milleski,"hrl suurem, sügavam pragu milleski (nt pinnases, nahal)",broader
lõhe,noun,suur erinevus kahe rühma vahel,"(ühiskonna kohta:) teatavate inimrühmade vahel olev lahknevus, neid lahutav erinevus",broader
lõhkuma,verb,midagi katki või tükkideks tegema,pikuti pooleks või tükkideks lööma (kirve vm terariistaga),narrower
lõhkuma,verb,kahjustama,pikuti pooleks või tükkideks lööma (kirve vm terariistaga),narrower
lõhn,noun,"aine omadus, mida sa tunned nina kaudu","paljude ainete omadus, mida tunneb nina kaudu (haistmisaistinguna)",exact
lõhnaõli,noun,"vedelik, mida sa oma kehale paned, et sa hästi lõhnaks","hrl lilledest ja vürtsidest saadud eeterlikest õlidest ja lisaainetest valmistatud lõhnav vedelik, mida kasutatakse keha lõhnastamiseks",exact
lõik,noun,lõigatud (õhuke) tükk,mingist toiduainest lõigatud lapik tükk või sektorina eraldatud osa,exact
lõik,noun,millegi (eraldatud) osa,mõtteliselt või tegelikult eraldatud osa,exact
lõik,noun,"teksti osa, mis algab uuelt realt ja sisaldab tavaliselt mitut lauset",taandreaga algav tekstiosa (kuni järgmise taandreani),exact
lõikama,verb,"noa, kääride või muu terava esemega midagi osadeks või katki tegema","millestki lõike, tükke eraldama (terariistaga), nii midagi (vajalikku vormi andes) lühemaks, osadeks tegema",narrower
lõikama,verb,kääridega midagi lühemaks tegema,"millestki lõike, tükke eraldama (terariistaga), nii midagi (vajalikku vormi andes) lühemaks, osadeks tegema",narrower
lõpetama,verb,midagi valmis tegema,midagi valmis või lõpuni tegema,exact
lõplik,adjective,"püsiv, kehtima jääv, mitte enam muutuv","kehtima jääv, mitte enam muudetav või parandatav",exact
lõpp,noun,"aeg, kui miski läbi saab, enam edasi ei kesta","ajaline või ruumiline piir, mis katkestab millegi kestmise või ulatuse, kus miski saab läbi või otsa",narrower
lõpp,noun,"mingi sündmuse, perioodi või tegevuse viimane osa","ajaline või ruumiline piir, mis katkestab millegi kestmise või ulatuse, kus miski saab läbi või otsa",narrower
lõpp,noun,"koht, kus miski lõpeb, enam ei jätku","ajaline või ruumiline piir, mis katkestab millegi kestmise või ulatuse, kus miski saab läbi või otsa",narrower
lõpuks,adverb,kaua kestnud tegevuse või olukorra järel,eelnenu järel või lõpus,exact
lõug,noun,"näo alumine osa, mis asub suu all","näo liikuv alaosa, eriti selle etteulatuv ots",exact
lõug,noun,"enamasti loomade kohta: üks näo kahest luust, mille küljes on hambad","üks kahest suud raamivast teineteise vastu käivast pea osast, kuhu kinnituvad nt hambad (loomadel, inimesel)",exact
lõuna,noun,"ilmakaar, kust päike paistab keskpäeval","ilmakaar, kust päike paistab keskpäeval",exact
lõuna,noun,"päeva keskmine osa, keskpäev","päeva keskmine osa, hrl umbes kell 12",exact
lõuna,noun,"toit, mida süüakse päeva keskel",sel ajal toimuv (päeva peamine) söögikord,exact
lõvi,noun,"suur kassi moodi loom, kellel on kollane karv ja kes elab peamiselt Aafrikas","peamiselt Aafrika savannides ja poolkõrbetes elav suur pruunikaskollane kaslane, kelle isastel isenditel on vägev lakk",exact
löök,noun,"see, kui keegi kasutab oma kätt, jalga või mingit eset, et teist inimest või asja jõuga tabada",kiire (jõuline) käeliigutus (ka koos esemega) millegi vastu või selline liigutus muu kehaosaga,exact
löök,noun,"õnnetus, kaotus","(raske kaotuse, hingelise vapustuse, kahjustava asjaolu vms kohta)",exact
löök,noun,"liigutus, mida süda teeb, et panna kehas veri liikuma","südametukse, pulsilöök",exact
lööma,verb,kellegi või millegi pihta lööki andma,"hrl kätt, jalga või mingit eset kiiresti ja jõuga millegi vastu liigutama",exact
lööma,verb,"sõna, mida kasutatakse välgu kohta",(äkilise valgusnähtuse kohta),exact
lööve,noun,"punased täpid, mis mingi haiguse pärast nahale tekivad","allergia või teatud haiguste korral nahale tekkivad kublad, väikesed laigud, villikesed vms",exact
lülitama,verb,mingit masinat või seadet nupu või muu asja abil tööle või seisma panema,elektriahela elemente ühendama või lahutama,exact
maa,noun,kuiv maa (vastandina merele ja teistele veekogudele),maakera kuiv pindmine osa (vastandina veekogudele),exact
maa,noun,"igasugune piirkond, mis asub väljaspool linna",igasugune piirkond väljaspool linna,exact
maa,noun,riik (või teatud piirkond),riik või selle osa,exact
maa,noun,distants millegi või kellegi vahel,ruumiline vahemaa,exact
maaala,noun,mingi osa maast,mingi piiritletud osa maismaast,exact
maailm,noun,Maa koos kõikide riikide ja inimestega,maakera koos kõige sellel leiduvaga,exact
maailm,noun,"kõik inimesed, kes tegelevad sama asjaga või kellel on samad põhimõtted","ühesuguste poliitiliste, kultuuriliste vm tingimuste või samasuguste tõekspidamiste alusel moodustuv ühiskond ja selle inimesed",exact
maal,noun,värvide ja pintsliga joonistatud pilt,"(lõuendile vm) maalitud pilt, värvidega loodud kahemõõtmeline kunstiteos",exact
maanduma,verb,õhust alla maapinnale tulema,"(õhu-, kosmosesõidukite kohta:) maapinnale (vahel ka mujale) või mõne taevakeha pinnale laskuma",exact
maantee,noun,"lai tee, kus sõidavad autod, bussid ja teised mootoriga sõidukid (lühend mnt)","suurem, sõidukitele sobiv liiklustee väljapool linnu ja aleveid",exact
maapind,noun,maad kattev pind,"maakera tahke pealispind, maismaa pind",exact
maasikas,noun,"pehme punane mari, mille pinnal on seemned ja mis kasvab aias või metsas",selle söödav vili,exact
maasikas,noun,"taim, mille küljes need marjad kasvavad",punaste magusate viljadega looduslikult kasvav või aedades kasvatatav madal rohttaim,exact
maast,adverb,"maa pealt, põrandalt või muult pinnalt","maapinnalt, põrandalt vm aluspinnalt",exact
maastik,noun,"kõik, mida sa mingil (eriti looduslikul) maa-alal näed","maa-alal olevate looduselementide (pinnavormide, taimkatte) kogum",exact
maastik,noun,mingi olukorra või tegevuse põhilised jooned,(mingi tegevusvaldkonna kohta),exact
madal,adjective,ümbrusest suhteliselt vähe ülespoole ulatuv,"väikese kõrgusega, püstsuunas lühike, suhteliselt vähe ülespoole ulatuv",exact
madal,adjective,millegi arvu või määra kohta: väike,"(hrl arvuliselt väljendatava määra, koguse, astme vm kohta:) väike, tavalisest või keskmisest väiksem",exact
madal,adjective,"halb, vilets","tasemelt, arenguastmelt (tublisti) alla normaalse",exact
madal,adjective,positsioonilt kellegagi võrreldes allpool olev,"(seisuse, positsiooni kohta:) alamatesse ühiskonnakihtidesse kuuluv, hierarhias (tublisti) allpool olev",exact
madal,adjective,hääle kohta: jäme,"(heli, hääle kohta:) tumedalt, mahedalt kõlav, väikese võnkesagedusega",exact
madalale,adverb,"maapinnale suhteliselt lähedale, allapoole",maapinnale suhteliselt lähedale,exact
madrats,noun,"voodi osa, mille peal sa magad",voodis küljealuseks olev pehme täidisega riidekott,exact
madrus,noun,"laeva meeskonna liige, kes teeb lihtsamaid töid",lihtsaid laevatöid tegev ja vahis seisev laeva meeskonna liige,exact
madu,noun,"pika kehaga loom, kellel ei ole jalgu","loogeldes liikuv pika jalgadeta kehaga soomuseline roomaja (nt rästik, boa, kobra)",exact
magama,verb,"suletud silmadega puhkama, nagu sa seda öösel teed","uneseisundis olema, mitte ärkvel olema",exact
magu,noun,"elund, kuhu toit liigub pärast söömist","söögitorule (või neelule) järgnev elund, kus toit lõplikult peenestub ja algab seedimine",exact
magus,adjective,"suhkru maitsega, suhkrut sisaldav","suhkru, siirupi, mee vms aine maitsega, sellise ainega maitsestatud, seda sisaldav",exact
magus,adjective,meeldiv,millegi poolest väga meeldiv või millekski eriti sobiv,exact
maha,adverb,"maa peale, põrandale või muule pinnale","maapinnale, põrandale vm aluspinnale",exact
maha,adverb,"alla, vähemaks","hulgalt, määralt vähemaks",exact
maha jätma,verb,millestki loobuma,midagi tegemast loobuma,exact
maha jätma,verb,mitte kaasa võtma,"(kuskilt lahkumisega seoses:) midagi või kedagi kuhugi paika jätma, midagi või kedagi mitte kaasa võtma",exact
maha kirjutama,verb,kuskilt või kellegi tööst salaja vastuseid enda töösse kirjutama,"salaja kuskilt vaadates vastust, lahendust vms kirjutama",exact
maha kirjutama,verb,kuskilt mingit teksti endale üles kirjutama,"kuskilt mingit teksti vms ära, ümber kirjutama",exact
maha laskma,verb,kedagi püssi või püstoliga tapma,tulirelvast tulistades kedagi surmama,exact
maha minema,verb,sõidukist väljuma,liiklusvahendist väljuma,exact
maha murdma,verb,loomade kohta: tapma,(kiskja kohta:) saaklooma tapma,exact
maha tõmbama,verb,"joont peale tõmbama sõnadele või lausetele, mis on valed või ei sobi",kirjapandut läbi kriipsutama,exact
maha võtma,verb,eemaldama,"millegi küljest, otsast vms ära võtma",exact
mahl,noun,"vedelik, mida saab enamasti puuviljadest, marjadest või köögiviljadest","puuviljadest, marjadest või köögiviljadest välja pressitud või aurutatud (lahjendatud) vedelik joogina",exact
maht,noun,"see, kui palju ainet mingisse anumasse või ruumi mahub",mahutavus (ruumala- või mahuühikutes),exact
maht,noun,millegi (sisu) suurus või hulk,"(millegi sisu kohta:) suurus, hulk vms",exact
mahtuma,verb,"kui keegi või miski kuhugi <b>mahub</b>, siis on seal selle inimese või asja jaoks piisavalt ruumi","suuruselt, mõõtmetelt, koguselt kuhugi paigutatav olema",exact
maikelluke,noun,"lill, millel on palju valgeid õisi ja tugev lõhn",hästi lõhnavate valgete kellukjate õitega kevadlill,exact
maine,noun,"levinud hinnang kellegi või millegi kohta, (hea või halb) kuulsus","üldiselt levinud (hea) hinnang kellegi (või millegi) kohta, kellegi (hea) nimi",exact
mainima,verb,midagi ütlema või nimetades esile tooma,"põgusalt ütlema või teatama, lühidalt millelegi osutama",exact
maitse,noun,"aine (söögi või joogi) omadus, mida sa suus tunned","toidu, joogi vm aine omadus, mida väljendab süljes lahustunud aineosade toimel suus tekkinud aisting",exact
maitse,noun,"võime hinnata, kas miski on hea või halb, näiteks moe, kirjanduse või kunsti vallas","esteetiliste väärtushinnangute kogum, sellel rajanev arusaam ilust vms",narrower
maitse,noun,"teatud asjad, mis sulle meeldivad, näiteks muusika, riiete või kunsti vallas","esteetiliste väärtushinnangute kogum, sellel rajanev arusaam ilust vms",narrower
maitsma,verb,mingi toidu või joogi maitset proovima,toitu või jooki selle maitse proovimiseks suhu võtma,exact
maitsma,verb,hea või meeldiva maitsega olema,"(toidu, joogi kohta:) maitselt meelepärane olema",exact
maja,noun,"hoone, kus inimesed elavad või töötavad","hoone inimestele elamiseks, töötamiseks, nende teenindamiseks vms",exact
maja,noun,teatud asutus koos vastava hoonega,"(restorani vms asutuse, selle töötajate kohta)",broader
maja,noun,teatud asutus koos vastava hoonega,mõne asutuse või hoone nime(tuse) osana,broader
majandus,noun,"süsteem, kuidas mingi riik oma raha kulutab ning asju toodab, ostab ja müüb","ühiskonnaelu valdkond, mis hõlmab kaupade ja teenuste tootmist, ostmist, müüki ja tarbimist",exact
majanduslik,adjective,majandusega seotud,"majandusega seotud, sellesse puutuv või seda käsitlev",exact
majanduslik,adjective,(isiku seisukohast) rahaline,"(isiku, ettevõtte vms seisukohast:) varadega, rahaga seotud",exact
maks,noun,"raha, mis läheb riigile näiteks sinu teenitud tulult või ostetud asja hinnast","seadusega määratud rahasumma, mille asutused või ettevõtjad peavad maksma ettenähtud tähtpäevadel riigi või kohaliku eelarve tuludesse",exact
maks,noun,"kõhus asuv pruun elund, mis puhastab verd","kõhuõõnes asetsev punakaspruun elund, mis mõjutab organismi ainevahetust, seedimist ja vereloomet (inimesel kõhuõõne ülaosas paremal pool)",exact
maks,noun,loomade vastav elund toiduna,loomade vastav elund toiduna,exact
maksma,verb,millegi eest raha andma,"tehtud töö, saadud kauba või teenuste, liikmeks oleku vm eest raha (harvemini midagi muud) andma",exact
maksma,verb,"mingit hinda omama, teatud rahasummat väärt olema","(ostmisel, müümisel, teenusena) mingi hinnaga olema, teatud rahasummat väärt olema",exact
maksma,verb,"kui midagi <b>ei maksa</b> teha, siis pole otstarbekas, vajalik või hea seda teha","osutab tegevusele, mida ei ole (harvemini on) otstarbekas, mõttekas või vajalik teha",exact
male,noun,"kahe inimese lauamäng, kus mängijal on 16 musta või valget nuppu, mida saab spetsiaalsel alusel eri viisil liigutada","kahe isiku sportlik lauamäng, milles kumbki mängija liigutab 16 malendit kindlatele mängureeglitele vastavalt 64 heleda ja tumeda ruuduga laual",exact
mandariin,noun,"ümmargune oranž puuvili, mis on väiksem kui apelsin","mahlakas ja aromaatne (väike) oranž puuvili, mandariinipuu vili",exact
mander,noun,"üks kuuest suurest maa-alast maailmas, mida ümbritseb vesi. Mandrid on Euraasia, Aafrika, Põhja-Ameerika, Lõuna-Ameerika, Austraalia ja Antarktis","suur terviklik maismaaosa, mida ümbritsevad ookeanid ja mered",exact
mander,noun,mander vastandina saarele,maismaa (vastandina saarele),exact
mari,noun,"taime väike vili, millel on seemned sees, näiteks mustsõstar","taime või puu väike, ühe või mitme seemnega söödav vili (nt maasikal, kirsil, pihlakal)",exact
masin,noun,"liikuvate osadega seade, mille eesmärk on teha inimese tööd kergemaks","seade või seadmete kogum, mille tööosad talitlevad kooskõlas, et sooritada energia, tööobjektide või informatsiooni muundamiseks vajalikke liikumisi",exact
masin,noun,auto (või mootorratas),auto või mootorratas,exact
mask,noun,"ese, mida sa kannad näo ees, et nägu varjata või kaitsta","osalt või üleni nägu kattev ese, mis teeb selle kandja kellegi näoliseks või mittetuntavaks",broader
mask,noun,"ese, mida sa kannad näo ees, et nägu varjata või kaitsta","marlist vm materjalist nina- ja suukate, mis kaitseb pisikute või saastuse eest",broader
mask,noun,"ainete kiht, mille inimesed lühikeseks ajaks näole määrivad, et nahk pärast parem välja näeks",(iluhoolduses:) nahale või juustele lühikeseks ajaks määritav ainete kiht,exact
mass,noun,"hulk ainet, millel pole kindlat kuju, vormi",aine või ainete segu vormitu kogum,exact
mass,noun,"kaal, raskus","mingit füüsikalist keha moodustava aine hulk, määratuna inertsi või kehale mõjuva raskusjõu kaudu",exact
materiaalne,adjective,"rahaga, varaga seotud","rahaliste vahenditega, varadega seotud",exact
materiaalne,adjective,füüsilise maailmaga seotud,"ainest koosnev, meeltega tajutavalt, reaalselt eksisteeriv",exact
matma,verb,surnukeha hauda panema ja mullaga katma,"surnut (või tema säilmeid) hrl vastava kombetalituse saatel hauda panema, mulla vm pinnasega katma",exact
medal,noun,"enamasti ümmargune metallist ese, mille saab teatud saavutuste eest, näiteks spordivõistlustel","lame, hrl ümmargune (vääris)metallist märk autasuna saavutuste vm eest või mingi sündmuse mälestuseks",exact
meel,noun,"võime, mille abil su keha ümbritseva maailma kohta infot saab","teatud aistingute vastuvõtmise ja eristamise võime (nt kuulmine, nägemine, haistmine)",exact
meel,noun,"meeleolu, tuju","meeleolu, emotsionaalne seisund",exact
meel,noun,"arvamus, seisukoht",mälu,exact
meeldima,verb,"kellegi arvates ilus, hea või tore olema","kellegi meelest ilus, hea või tore olema, kelleski sümpaatiat, heameelt või rahulolu esile kutsuma",exact
meelega,adverb,"nii, et on kavatsetud või ette planeeritud, mitte juhuslikult","kindla kavatsusega, mitte kogemata",exact
meeleolu,noun,emotsionaalne seisund,"muutlik emotsionaalne seisund, mis annab värvingu inimese elamustele ja tegevusele",exact
meelest,adposition,kellegi arvates,"kellegi arvates, kellegi arust",exact
meelitama,verb,"kellelegi midagi head lubama või pakkuma, et ta teeks seda, mida sina soovid","meeldivate sõnade, lubaduste või mingi nipi abil kedagi mõjutama, et ta käituks või teeks nii, nagu mõjutaja soovib",exact
meelitama,verb,"sel viisil sulle mõjuma, et sa tahad kuhugi minna või midagi teha","ahvatlevana ligi tõmbama, kutsuvalt mõjuma",exact
meenutama,verb,"meelde tuletama, mõttesse tooma",(enda või kellegi teise) mälus mingit teadmist või mälupilti uuesti esile kutsuma,exact
meenutama,verb,millegi poolest sarnane olema,millegi poolest sarnane olema,exact
