lemma,sense_source,sense_target,semantic_relationship,pos
alacsony," (minőségét tekintve) a kívánt mértéket el nem érő, ill. annál kisebb fokú, mértékű"," <Vmilyen mértékkel mért folyamatról, helyzetről, állapotról szólva:> kis mértékű, kisebb fokú",broader,adjective
alacsony," társadalmi, anyagi v. műveltségi tekintetben hátrányos, kevésbé megbecsült, kedvezőtlen <helyzet, sors stb.>"," Anyagi tekintetben szűkös, szegényes <társadalmi helyzet>",broader,adjective
alacsony," alsóbb rendű, alárendelt helyzetű"," Alacsony néposztály, népréteg: szűkös anyagi körülmények közt, kezdetlegesebb műveltségi fokon élő n., n.",exact,adjective
alacsony," társadalmi, anyagi v. műveltségi tekintetben hátrányos, kevésbé megbecsült, kedvezőtlen <helyzet, sors stb.>", Alacsony származás: <osztálytársadalomban> az uralkodó osztálytól megvetett társadalmi rétegből való sz.,exact,adjective
alacsony," ilyen helyzetű, sorsú <személy, csoport>", Ilyen származású <személy>,exact,adjective
alacsony, <rangsorban> alsóbb szinten álló, Ilyen rangú <személy>,exact,adjective
alacsony," (erkölcsileg) megvetendő, hitvány, alantas <cselekedet, magatartás, érzés stb.>"," Finomabb erkölcsi érzék híján való, nemesebb dolgok iránt érzéketlen <lelkület>",broader,adjective
alacsony, ilyen <személy>," Aljas, alávaló, becstelen <személy>",exact,adjective
alacsony," közönséges, alantas <dolog>"," Erkölcsileg emelkedett, nemesen érző és gondolkodó emberhez nem méltó, megvetendő <cselekvés, érzés>",exact,adjective
alul," függőleges irányban lent, alacsonyan, a földhöz közelebbi részen, ill. vminek a lent levő, (leg)alsó végén, szélén"," <Függőleges helyzetű tárgyon v. ilyen módon rendezett tárgyak együttesében:> a földhöz közelebbi végén v. ahhoz közel, a feljebb levő részekkel szemben",exact,adverb
alul," függőleges irányban lent, alacsonyan, a földhöz közelebbi részen, ill. vminek a lent levő, (leg)alsó végén, szélén"," <Írott, nyomtatott szövegben v. ábrázolásban:> a lap végén v. ahhoz közel",related,adverb
alul," társadalmi, anyagi v. műveltségi tekintetben kedvezőtlen(ebb) helyzetben", Alul van: más valaki fölébe kerekedett,broader,adverb
alul," <fejlődési sorban, értékrendben, rangsorban stb.:> a (leg)alsó szinten"," <Bizonyos elv szerint rendezett sorban, együttesben:> a fő helytől legtávolabb",related,adverb
alul," társadalmi, anyagi v. műveltségi tekintetben kedvezőtlen(ebb) helyzetben", Alulról emelkedett fel: alacsonyabb társadalmi helyzetből jutott magasabb körbe,broader,adverb
alul," függőleges irányban lent, alacsonyan, a földhöz közelebbi részen, ill. vminek a lent levő, (leg)alsó végén, szélén"," Alulra: alul (1, a) levő helyre. Alulra tedd a nagyobb könyveket!",related,adverb
alul," (vkinél, vminél) alacsony(abb)an levő helyre", A névszóban v. névmásban kifejezett személyhez v. dologhoz viszonyítva alacsonyabban,exact,conjunction
alul," a szokásosnál, a kelleténél, az elvárhatónál kisebb mértékben, fokban, ill. alacsonyabb szinten"," Vmin alul; vmely szintet, fokot el nem érve",broader,conjunction
alul," a szokásosnál, a kelleténél, az elvárhatónál kisebb mértékben, fokban, ill. alacsonyabb szinten"," <Mennyiséggel, összeggel kapcs.:> az -n ragos névszóval kifejezett mennyiségnél kisebb összegben, mértékben",broader,conjunction
alul," a szokásosnál, a kelleténél, az elvárhatónál kisebb mértékben, fokban, ill. alacsonyabb szinten"," <Meghatározott v. szokott értéket, képességet, eredményt jelentő szóval kapcs.:> annál kisebb mértékben, fokban",broader,conjunction
amoda," arra a másik helyre, abba a másik irányba, ill. az előbbivel ellentétes helyre v. irányba"," <Az oda szóval szemben mint annak hangsúlyozott, helyesbítő v. ellentétes párja:> tőlem, a beszélőtől távolabb eső másik helyre v. irányban",exact,demonstrative adverb
amoda," <az ide hsz-val együtt:> a szóban forgó dolog ellenére, ill. azt figyelmen kívül hagyva", <Az emide v. ide határozószóval szembeállítva:> a távolabbinak jelzett helyre v. irányban; oda,exact,demonstrative adverb
amoda, amott, <Rendsz. más határozóval együtt:> amott,exact,demonstrative adverb
ángy, <megszólításként is:> a testvérbáty felesége <az öcs szempontjából>," Általában közeli, idősebb férfirokon felesége <vmely rokonához való családi viszonyában; 1. személyű birtokos személyraggal megszólításként is>.",related,noun
ángy, <megszólításként is:> a testvérbáty felesége <az öcs szempontjából>, A testvérbátya felesége <az öccshöz való családi kapcsolatában>,exact,noun
ángy, <megszólításként is:> vkinek (magánál) idősebb sógornője," Tág. ért. sógornő, sógorasszony",exact,noun
ángy," <megszólításként is:> idősebb asszonyrokon, kül. nagybácsi felesége"," Idősebb rokon, kül. nagybácsi felesége <fiatalabb rokonához való kapcsolatát tekintve>",broader,noun
ángy," <megszólításként is:> idősebb asszonyrokon, kül. nagybácsi felesége"," Idősebb, közeli rokon asszony <fiatalabb rokonához való kapcsolatát tekintve>.",broader,noun
ántiját, bosszúság v. csodálkozás kif-ére az Antikrisztusát szó használata helyett, <Enyhe bosszúság kifejezésére.>,broader,interjection
árnyékol," árnyékba von, sötétbe borít vmit", Árnyékba (1) borít vmit,related,verb
árnyékol," árnyékba von, sötétbe borít vmit"," Árnyékba von, erős fény elől takar, véd vmit",exact,verb
árnyékol," <rajzot, festményt> sűrű vonalkázással, satírozással, ill. sötétebb színezéssel térhatásúvá tesz<syn>árnyékoz"," <Rajzot, képet, ill. azon vmely árnyékos, homályos részt> sűrűbb vonalazással v. sötétebb festékkel jelölve kidolgoz; árnyal",exact,verb
árnyékol," villamos v. elektromágneses hatásoktól, káros sugárzástól véd, szigetel vmit"," <Híradástechnikai készüléket> egyes alkatrészek (pl. tekercsek) egymásra való zavaró hatásától vagy külső elektromágneses terek hatásától fémlemezek, fémdobozok, árnyékoló serlegek alkalmazásával vmilyen mértékben mentesít",exact,verb
árnyékol," árnyékba von, sötétbe borít vmit"," <Lámpa burája, ernyője> bizonyos irányban megszünteti v. csökkenti a fény sugárzását",broader,verb
árnyékol, <ökölvívó> árnyékbokszolást végez, <Edzését végző ökölvívó> az ütéseket ellenfél és segédeszköz nélkül gyakorolja.,exact,verb
ásványvíz," az átlagosnál több oldott vegyi anyagot tartalmazó, ill. ilyen anyaggal dúsított (gyógyhatású forrás)víz"," Az a forrásvíz, amelyet többnyire magas hőfoka, gáztartalma, ill. szénsavban, sókban való gazdagsága, gyakran pedig e tulajdonságok összessége különböztet meg a közönséges ivóvíztől és tesz rendsz. gyógyhatásúvá",broader,noun
ásványvíz," az átlagosnál több oldott vegyi anyagot tartalmazó, ill. ilyen anyaggal dúsított (gyógyhatású forrás)víz"," Közönséges ivóvíz, amelyet szénsavval v. gyógyító hatású ásványi anyaggal telítenek",broader,noun
ásványvíz," az átlagosnál több oldott vegyi anyagot tartalmazó, ill. ilyen anyaggal dúsított (gyógyhatású forrás)víz"," Ez mint palackozott v. kimért üdítő hatású ital, fogyasztási cikk",broader,noun
atom," az anyagot alkotó kémiai elemek vegyi úton tovább nem osztható legkisebb alkotórésze, melynek kémiai tulajdonságai megegyeznek az eleméivel"," Az anyagot alkotó kémiai elem(ek) legkisebb, magból s elektronokból álló része, melyben az elem minden i és kémiai tulajdonsága még megtalálható",exact,noun
atom, ilyen mennyiségű," <Vmely elemből> annyi, amennyi abból egy atomot alkot",exact,noun
atom," radioaktív anyag, ill. atomenergia, atomerő", Atomenergia,broader,noun
atom," apró, parányi rész, kis darab"," Vminek igen kis része, vmiből igen kicsi mennyiség",exact,noun
atom," atombomba, atomfegyver, atomháború"," Atombomba, atomfegyver",exact,noun
áttelefonál, telefonon átszól vhova v. vkinek, Áttelefonál vhova: vmely nem nagyon távoli helyre telefonál,exact,verb
áttelefonál, így áthív vkit," Áttelefonál vkit: telefonon áthív vkit kül. azért, hogy rendelkezzék vele v. felvilágosítást, tájékoztatást kérjen tőle",exact,verb
bír," <súlyt, terhe(lés)t> szilárdsága, ill. ereje révén képes tartani, mozgatni v. vinni, elbír, megbír vmit"," Van ereje ahhoz, hogy vmely terhet tartson, viseljen, hordjon, v. vmit elviseljen, kiálljon, vmit (el)végezzen.",related,verb
bír," <súlyt, terhe(lés)t> szilárdsága, ill. ereje révén képes tartani, mozgatni v. vinni, elbír, megbír vmit"," <Súlyt, terhet> tartani v. vinni képes",exact,verb
bír," <huzamosabb ideig tartó, ill. a szokásosnál nagyobb fizikai, anyagi, lelki stb. megterhelést> győz vmivel"," Nem bírja vminek a súlyát, terhét: nem képes hordozni, elviselni vmit",broader,verb
bír," <huzamosabb ideig tartó, ill. a szokásosnál nagyobb fizikai, anyagi, lelki stb. megterhelést> győz vmivel"," Képes elviselni, kiállani, elszenvedni vmit; kibír, elbír vmit",narrower,verb
bír," <élőlény (szervezetének vmely része) kedvezőtlen, ártalmas körülményt> képes fiziológiai károsodás nélkül elviselni"," sokat tud inni anélkül, hogy megártana neki; jó ivó",broader,verb
bír," ereje, képessége van, tud <(el)végezni, (meg)tenni vmit>"," Képessége, ereje van <vmit végezni v. fizetni>; képes rá, győzi",exact,verb
bír," <huzamosabb ideig tartó, ill. a szokásosnál nagyobb fizikai, anyagi, lelki stb. megterhelést> győz vmivel"," Bírja vmivel; vmit bír vmivel: vmiből elege van neki ahhoz, hogy vmely cselekvést, erőfeszítést végezni, folytatni tudjon",related,verb
bír," <használati tárgy (anyaga v. alkatrésze)> ép, használható állapotban marad, nem megy tönkre"," Még bírja (egy darabig): még használható, még tart egy darabig",exact,verb
bír," <élőlény> életben van, ill. tartható"," Nem sokáig bírja már: hamarosan meg fog halni, <állat> el fog pusztulni.",exact,verb
bír," kellő ereje, hatalma van ahhoz, hogy megfékezzen, féken tartson v. legyűrjön, ill. irányítson v. vmire kényszerítsen vkit, vmit"," Kellő ereje, hatalma van ahhoz, hogy vkit, vmit megfékezzen, féken tartson, vele megbirkózzék, v. vkit rávegyen vmire.",related,verb
bír," kellő ereje, hatalma van ahhoz, hogy megfékezzen, féken tartson v. legyűrjön, ill. irányítson v. vmire kényszerítsen vkit, vmit"," Bír vkivel, vmivel: meg tud fékezni, kordában tud tartani vkit, vmit",exact,verb
bír," <feladattal, teendővel stb.> képes megbirkózni, el tudja végezni, boldogul vele"," <Feladattal, teendővel> meg tud küzdeni; el tudja végezni",exact,verb
bír," arra késztet vkit v. vmit, hogy (meg)tegyen vmit, rávesz, rábír vkit v. vmit vmire"," Vkit vmire bír: vkit arra késztet, hogy tegyen vmit; rávesz, rábír, rábeszél vkit vmire",exact,verb
bír," hatalmában tart, ural vmit, es. vkit"," Vkit, vmit vmely módon hatalmában, birtokában tart, birtokol.",exact,verb
bír," <vki (vmely) test(rész)ét> képes megfelelően használni, irányítani"," Bírja: <vmely testrészét> tudja használni, mozgatni",exact,verb
bír," jó anyagi körülmények között él, tehetős"," (Jól) bírja magát: a) jó erőben van. | b) jó anyagi körülmények között él, tehetős",narrower,verb
bír," <vmely (idegen) nyelvet, ill. nyelvváltozatot> (jól) tud, ért és használ"," <Vmely nyelvet> jól, folyékonyan beszél",exact,verb
bír," (tulajdonosként) rendelkezik vmivel, birtokában van vminek, van vmije", Birtokában tart; birtokol vmit,exact,verb
bír," hatalmában tart, ural vmit, es. vkit"," Bír vkit, vmit: uralkodik vki, vmi fölött; parancsol neki",exact,verb
bír, <kül. férfi> szerelmeseként v. hitveseként magáénak tudhat vkit," <Nőt> magáénak tudhat, házasságban él vele, szerelmére számíthat",exact,verb
bír, <kül. férfi> szerelmeseként v. hitveseként magáénak tudhat vkit," Vkit nőül, hitvesül v. férjül bír: házasságban él vele",related,verb
bír," <vmely (óhajtott, kívánt) dolgot> magáénak mondhat, rendelkezik vele"," <Vmely óhajtott, kívánt dolog> tulajdonának mondhat",exact,verb
bír," (tulajdonosként) rendelkezik vmivel, birtokában van vminek, van vmije", Bír vmely titkot: be van avatva vmely titokba,broader,verb
bír," (tulajdonosként) rendelkezik vmivel, birtokában van vminek, van vmije"," Birtoka, vagyona van vhol",related,verb
bír," <vmely (óhajtott, kívánt) dolgot> magáénak mondhat, rendelkezik vele", Bír vmivel: vmivel mint (anyagi v. szellemi) tulajdonával rendelkezik,exact,verb
bír," <vmely sajátsággal, képességgel, ill. tudással, ismerettel stb.> rendelkezik"," Vmivel bír: vmely sajátsága, képessége van",exact,verb
birétum," <katolikus papok liturgikus viseletében:> a papi rangnak megfelelő színű, gerezdszerűen tagolt, kemény bélésre feszített, három- v. négysarkú fejfedő"," <Katolikusoknál> a papoknak főleg szertartások alkalmával viselt különféle színű sapkája, amelynek három v. négy ága a tetején összefut",exact,noun
bocsát," előidézi v. elősegíti, hogy vhova, kül. vmely lenti, benti helyre jusson vmi, ritk. vki"," Vhova bocsát vmit: eszközli, hogy vmi vhova, kül. lejjebb levő helyre jusson, kerüljön, hatoljon, vhova ereszt, leereszt vmit",exact,verb
bocsát," (vmilyen céllal) vhova enged, ereszt v. küld vkit, vmit", <újonnan elkészült v. egy ideig nem használt vízi járművet> a partról v. vmely építményről a vízbe csúsztat,broader,verb
bocsát," <hegyes v. apró tárgyat> vkibe, vmibe behatolni késztet"," <Apró v. hegyes tárgyat> vkibe, vmibe behatolni késztet",exact,verb
bocsát," <egy geometriai pontból kiindulva vmely egyenesre v. síkra (merőleges) egyenest> húz, rajzol", Merőlegest bocsát az alapra: vmely kívül eső pontból merőlegest szerkeszt v. húz az alapra.,exact,verb
bocsát," (Ki)enged, (ki)ereszt (magából vmit)"," Vmit bocsát (magából): engedi, hogy vmi kinőjön, kijöjjön, kiáradjon belőle; ereszt, kiereszt",exact,verb
bocsát," Hagyja, hogy vhova, vmire, vmibe jusson vmi"," Vkit vhova bocsát: engedi, hogy vki vhova menjen; ereszti vhova",broader,verb
bocsát," (vmilyen céllal) vhova enged, ereszt v. küld vkit, vmit"," elereszti (hosszabb) útra, rendsz. útravalóval felszerelve",broader,verb
bocsát," (vmilyen céllal) vhova enged, ereszt v. küld vkit, vmit"," engedi, hogy távozzék, menjen, ahova akar, v. ahova mennie kell",broader,verb
bocsát," (vmilyen céllal) vhova enged, ereszt v. küld vkit, vmit"," Szabadon bocsát vkit: börtönből, fogságból kiengedi",broader,verb
bocsát," (vmilyen céllal) vhova enged, ereszt v. küld vkit, vmit"," Szabadon enged, elenged, elereszt",broader,verb
bocsát," abba a helyzetbe enged v. hoz vkit, vmit, hogy a határozóban megjelölt tevékenység, folyamat (meg)történjék, végbemenjen rajta"," Vkit vmire bocsát: engedi, hogy vki vmely tevékenységet, gyak. vmely hivatalos ténykedést elvégezzen",broader,verb
bocsát," abba a helyzetbe enged v. hoz vkit, vmit, hogy a határozóban megjelölt tevékenység, folyamat (meg)történjék, végbemenjen rajta"," Vmibe, vmire, vmi alá bocsát vmit: engedi, hogy vmely, a határozóban megjelölt tevékenység, folyamat megtörténjék vele, végbemenjen rajta",broader,verb
bocsát," abba a helyzetbe enged v. hoz vkit, vmit, hogy a határozóban megjelölt tevékenység, folyamat (meg)történjék, végbemenjen rajta", elzálogosítja,broader,verb
bocsát," abba a helyzetbe enged v. hoz vkit, vmit, hogy a határozóban megjelölt tevékenység, folyamat (meg)történjék, végbemenjen rajta"," megengedi, hogy szabadon vegyenek, zsákmányoljanak belőle",broader,verb
bocsát," abba a helyzetbe enged v. hoz vkit, vmit, hogy a határozóban megjelölt tevékenység, folyamat (meg)történjék, végbemenjen rajta"," átadja, megengedi, hogy osztozkodjanak vmin",broader,verb
bocsát," abba a helyzetbe enged v. hoz vkit, vmit, hogy a határozóban megjelölt tevékenység, folyamat (meg)történjék, végbemenjen rajta"," megengedi, hogy vki szabadon, tetszése szerint rendelkezzék vmivel, vkivel; átadja, átengedi",broader,verb
bocsát," abba a helyzetbe enged v. hoz vkit, vmit, hogy a határozóban megjelölt tevékenység, folyamat (meg)történjék, végbemenjen rajta", alkalmat ad megbírálására,broader,verb
bocsát," abba a helyzetbe enged v. hoz vkit, vmit, hogy a határozóban megjelölt tevékenység, folyamat (meg)történjék, végbemenjen rajta"," engedélyezi, elrendeli, hogy szavazással döntsenek róla; megindítja a szavazást, a döntést a szavazás eredményére bízza",broader,verb
bokázó," a bokák megfelelő ütemre való összeütéséből álló, a magyar táncokra jellemző <táncmotívum, tánclépés>, ill. ilyen tánclépést, motívumot tartalmazó <tánc>"," Bokázó tánc: a magyar táncnak egy figurája, amelyben a férfiak bokájukat összeütögetik, a nők sarkukat felkapva apró keresztlépéseket tesznek",exact,adjective
bokázó," a bokák megfelelő ütemre való összeütéséből álló, a magyar táncokra jellemző táncmotívum, tánclépés, ill. ilyen tánclépést, motívumot tartalmazó tánc", Bokázó tánc,exact,noun
bokázó," ilyen táncmotívumnak megfelelő zenei fordulat, ill. ilyen zenei fordulatot tartalmazó zenemű", A bokázó táncmozdulatnak megfelelő zenei motívum <a múlt század magyaros zenéjében>.,exact,noun
bolha," emlősökön és madarakon élősködő, 1–8 milliméter nagyságú, oldalirányban lapított testű, nagyokat ugró szárnyatlan vérszívó rovar"," Az emberi testen, valamint kutyán és macskán élősködő, szárnyatlan, nagyokat ugró, apró, barna, vérszívó rovar; csípése kellemetlen viszketést okoz (Pulex irritans)",exact,noun
bolha, az ilyen rovarok fajait magában foglaló rend nevezéktani elnevezéseként," Bolhák: melegvérű állatokon élősködő szárnyatlan rovarok rendje, melyre jellemző, hogy egyedeinek hátsó lábpárja ugró szervvé, szája pedig szúró-szívó szervvé alakult át (Aphaniptera).",exact,noun
bolha," tollszárból készült, nyomásra magasra pattanó játékszer"," Mindkét végén többször behasított madártoll v. csavarszerűen összegöngyölt papírlap mint gyermekjátékszer, mely ha ujjheggyel kemény felülethez nyomják, magasra pattan.",exact,noun
bolha," kisebb méretű, egyik végén meghegyezett fapecket röptető csoportos ügyességi játék, ill. ennek eszköze"," Pasztilla alakú és nagyságú celluloid lapocska, mint gyermekjátékszer, melyet egyik végén egy kissé lenyomva tovább lehet ugratni.",exact,noun
bolha," ütés, csapás", Az emberi testet érő csípős labdaütés,broader,noun
bombázó, bombák ledobására való <harci repülőeszköz>," Olyan, aki, ami bombáz (1–4) vmit, vkiket",narrower,adjective
bombázó, bombák ledobására való harci repülőeszköz, Bombázó repülőgép,exact,noun
borzasztó," iszonyatot, rémületet, félelmet keltő, ill. szenvedést, gyötrelmet okozó"," Borzadást, rémületet keltő; borzalmas",exact,adjective
borzasztó," nagyon nagy (mértékű, fokú), óriási"," Rendkívül nagy, igen nagy; óriási",broader,adjective
borzasztó," nagyon nagy (mértékű, fokú), óriási"," (határozóraggal határozószó-szerűen) Borzasztóan: rendkívüli mértékben, igen-igen nagyon",broader,adjective
borzasztó," irtó, rendkívül","  <Fokozás kifejezésére, melléknév, határozatlan számnév és határozó előtt, rendsz. érzelmileg színezett beszédben.> Nagyon-nagyon, igen-igen, rendkívül; szörnyen; szörnyű, rettentő",exact,particle
borzasztó," <megbotránkozás, bosszúság kif-ére is:> kellemetlen, felháborító, kétségbeejtő(en rossz) <jelenség, helyzet stb.>", <Megbotránkozás kifejezésére.>,exact,adjective
boszorkánymester," <a népi hiedelemben és a középkori, kora újkori (vallásos) felfogásban:> boszorkánynak tartott, titokzatos erőket megidéző, varázsló képességekkel rendelkező férfi"," <A babona szerint> férfi boszorkány, aki titokzatos földalatti erőket tud felidézni",broader,noun
boszorkánymester," <a népi hiedelemben és a középkori, kora újkori (vallásos) felfogásban:> boszorkánynak tartott, titokzatos erőket megidéző, varázsló képességekkel rendelkező férfi"," <A babona szerint> varázsló, varázslással foglalkozó férfi",broader,noun
boszorkánymester, (vmely tevékenységben) szemfényvesztő ügyességű művész," Bűvész, szemfényvesztő",related,noun
bosszúálló," vmely bosszút végrehajtó, ill. bosszúállásra kész, képes v. arra hajló <személy, csoport>"," Olyan <személy v. csoport>, akinek, amelynek olyan a természete, hogy sérelmét – nem felejtve – igyekszik erős eszközökkel megtorolni",exact,adjective
bosszúálló," bosszúállásra indító, késztető <érzelem, indulat>", Ilyen személyre jellemző,narrower,adjective
bosszúálló," megtorlásra, bosszúállásra irányuló <terv, tevékenység stb.>"," Bosszúállással kapcs., erre irányuló",narrower,adjective
bosszúálló," megtorlás, bosszúállás, ill. büntetés végrehajtásának eszközéül szolgáló <kéz, fegyver, törvény>"," A bosszú végrehajtására alkalmas, haszn. <eszköz>",exact,adjective
bosszúálló," vmely megtorló tettet, tevékenységet végrehajtó személy", Bosszúálló személy.,exact,noun
bronzszín," a bronz színéhez hasonló, (fényes) barnásvörös szín, ill. vmely dolog ilyen színe"," A bronzéhoz hasonló, fényes, meleg barna szín",exact,noun
bronzszín," bronzszínű <árnyalat>, ill. ilyen színű <dolog>", Bronzszínű,exact,adjective
bugyi," <a 19. század elejétől a 20. század első feléig:> hosszú, bő v. buggyos, ill. <a 20. század második felétől:> testre simuló, a comb felső részéig v. a fölé érő nadrágféle női v. gyermekalsóneműbugyogó", Női v. gyermek- (alsó)nadrág.,exact,noun
bujakór," nemi érintkezéssel terjedő fertőző betegség, kül. a Treponema pallidum nevű baktérium okozta vérbaj, szifilisz"," Szifilisz, vérbaj",exact,noun
bulvár," <nagyobb városban:> rendsz. vmely városrészt ív alakban körülölelő széles, hosszabb körút, ill. (vmely központi térből kiinduló) hosszú, egyenes, gyakr. fákkal szegélyezett sugárút", Körút,broader,noun
bulvár," <nagyobb városban:> rendsz. vmely városrészt ív alakban körülölelő széles, hosszabb körút, ill. (vmely központi térből kiinduló) hosszú, egyenes, gyakr. fákkal szegélyezett sugárút"," Széles, fásított nagyvárosi út.",broader,noun
bumm," robbanás, lövés, mennydörgés erős, tompa hangjának utánzására"," <Robbanás hangjának, ágyúszónak utánzására.>",exact,interjection
bumm," esés, üt(köz)és (hangjának) érzékeltetésére", <Erős ütés v. ütődés tompa hangjának utánzására.>,broader,interjection
bumm," esés, üt(köz)és (hangjának) érzékeltetésére", <Esés tompa hangjának utánzására.>,broader,interjection
burgonyabogár," az amerikai kontinensről Európába a 19. században behurcolt, jellegzetesen domború testű, barnássárga színű, a burgonya zöld részeit pusztító levélbogár, amelynek szárnyfedőin öt-öt hosszanti fekete sáv húzódik végig, ill. e bogarak faja<tr>Leptinotarsa decemlineata</tr>kolorádóbogárkrumplibogár"," Erősen domború hátú, sárga v. vörösessárga színű, tíz hosszanti fekete sávval tarkázott, különösen a burgonyában nagy kárt tevő bogár (Leptinotarsa decemlineata); kolorádóbogár.",exact,noun
bürokrácia," az államnak mint intézményrendszernek a közigazgatás, államigazgatás feladatait ellátó, hierarchikus felépítésű, szigorúan szabályozott, bürokraták által működtetett része, ritk. az ebben dolgozó hivatalnokok összessége, ill. olyan hatalmi berendezkedés, amelyben a hatalom ezen a területen összpontosul", Az állam v. közületek igazgatási szerveinek hálózata; hivatali gépezet. Igénybe vették a bürokrácia egész szervezetét.,exact,noun
bürokrácia," az államigazgatás vmely területéhez v. vmely egyéb szervezethez, szakterülethez tartozó hivatali gépezet(ben), apparátus(ban dolgozók összessége)"," Az állami és közületi tisztviselők összessége; hivatalnoki kar, intézmény",exact,noun
bürokrácia," formaságok és merev szabályok szerint, rendsz. feleslegesen nagy apparátussal történő, túlzottan mechanikus(, az ügyfelekkel szemben közömbös, személytelen) ügyintézés(i), igazgatás(i mód, rend)"," A hivatali szervek károsan túltengő hatalma, uralkodó szerepe, és ennek egészségtelen hatása az államgépezet működésére; hivatal(nok)uralom",broader,noun
bürokrácia," formaságok és merev szabályok szerint, rendsz. feleslegesen nagy apparátussal történő, túlzottan mechanikus(, az ügyfelekkel szemben közömbös, személytelen) ügyintézés(i), igazgatás(i mód, rend)"," <Vmely hivatalban, intézményben, szervezetben> olyan igazgatási rendszer, amelyben az ügyintézők v. irányítók vélt kiváltságos helyzetükbe gőgösen elzárkózva, lélektelenül, a külsőségekhez, a törvénynek csak betűihez ragaszkodva, az élettől idegenül és a nép igényeitől elszakadva intézik az ügyeket; bürokratizmus.",broader,noun
