lemma,pos,sense_source,sense_target,semantic_relationship
wild,adjective,"II.15/|\In toep. waarbij het hoofdaccent gelegd wordt op het feit dat iem. in zijn gedragingen of levenswijze afwijkt van wat correct of toelaatbaar geacht wordt: niet of niet voldoende beantwoordend aan wat volgens sociale, maatschappelijke of moreel/religieus-ethische regels verwacht of verlangd wordt; niet of niet genoegzaam geleid of bepaald door wat sociaal, maatschappelijk enz. gezien, vereischt wordt; niet of niet voldoende in overeenstemming met de sociale, maatschappelijke enz. normen; met het fatsoen in strijd, onfatsoenlijk; ongeregeld, regelloos. Steeds van pers., hun levens(wijze) of gedrag.","afwijkend van wat normaal, gangbaar of gebruikelijk is",exact
wild,adjective,"II.16/|\In toep. waarbij het hoofdaccent gelegd wordt op het feit dat bij bep. zaken, handelingen, gebeurtenissen e.d. elke interne logica, elk zinnig patroon of fundament, elke vorm van voorafgaande overweging ontbreekt: geheel door willekeur bepaald of gekenmerkt; waarin of waarbij elk logisch plan ontbreekt; waarin weinig of geen zinvol patroon of zinvolle ordening te herkennen valt. Inz. ter karakteriseering van iemands handelen, en dan te omschrijven als: elken vorm van doelgerichtheid missend; zonder eenig overleg, in geenen deele weloverwogen; onbezonnen, ondoordacht; ook wel: impulsief, onbesuisd.","zonder ordelijke vorm, schikking, structuur of verband; ongeordend; wanordelijk; in de war; chaotisch",exact
wild,adjective,"II.17/|\In aansl. bij de vorige bet., in toep. op bep. uitingen, mededeelingen, vragen, gissingen e.d.: niet steunend op eenige concrete realiteit; zonder dat er eenige aanwijzing of aanleiding voor is; ontbloot van elken grond; ""zoomaar""; ongefundeerd, ongegrond.","niet steunend op enige kennis, waarheid of werkelijkheid; waarin men de verbeelding de vrije loop laat; ongebreideld; onbeteugeld; van geruchten ook: zomaar geuit; ongefundeerd; ongegrond",exact
wild,adjective,"II.18.a/|\(Bnw.) Van pers. (hun aard of karakter), of van bep. (gepersonifieerde) zaken: heftig of woest tekeer gaand; woest; heftig, fel; onstuimig.",niet rustig; snel en hard; ruig,exact
wild,adjective,"18./|\In toep. waarbij inz. groote kracht, felheid, heftigheid e.d. aangegeven wordt. De grens met de bet. 15) is niet steeds even duidelijk.",heftig in beweging of snel stromend; woest; onstuimig,exact
blessure,noun,")/|\Verwonding, wond, kwetsuur.","verwonding of kwetsuur die vaak ontstaat tijdens het beoefenen van een sport, maar ook veroorzaakt kan zijn door een ongeval of ongeluk",exact
pijn,noun,"1/|\Als algemeene benaming van eene reeks van boomen, die behooren tot de familie der Naaldboomen of Kegeldragenden en te zamen het geslacht Pinus vormen; pijnboom.",oude benaming voor een kegeldragende naaldboom van het geslacht [i]Pinus[/i]; pijnboom; den,exact
pijn,noun,"4/|\Een toestand van lichamelijk lijden, waarbij men in eenig deel van het lichaam smart gevoelt; lichamelijke smart, eene smartelijke aandoening.","onaangenaam tot ondraaglijk lichamelijk gevoel dat dof, zeurend of stekend kan zijn en plaatselijk of overal  in het lichaam kan voorkomen; lichamelijk lijden; zeer",exact
pijn,noun,"5/|\Toestand waarin men pijn gevoelt, iets onaangenaams ondergaat.",gevoel van lijden dat betrekking heeft op de geest of de emotie; geestelijk lijden; psychische pijn; leed; smart; verdriet,exact
luttel,adjective,"A.1/|\Klein, gering, in maat, hoeveelheid of aantal; weinig.",klein qua omvang; niet omvangrijk; gering,narrower
luttel,adjective,"A.1/|\Klein, gering, in maat, hoeveelheid of aantal; weinig.",klein qua aantal; gering; weinig; enkel,narrower
luttel,adjective,A.2/|\Van geringe beteekenis.,onbeduidend; onbetekenend; onbelangrijk; klein,exact
luttel,adjective,"B.1/|\In geringe mate, weinig.",klein qua omvang; niet omvangrijk; gering,exact
luttel,adjective,"B.1/|\In geringe mate, weinig.",klein qua aantal; gering; weinig; enkel,exact
toss,noun,"1)/|\Term in sommige soorten van sport, zooals voetbal, cricket, tennis: het werpen van kruis of munt, of een loting op een andere wijze (b.v. door een racket om zijn lengteas te draaien), om uit te maken wie van de tegenstanders het recht van keuze zal hebben en (of) zal beginnen; (soms) opgooi.","loting voor aanvang van een wedstrijd, bijvoorbeeld het opgooien en opvangen van een munt, bedoeld om uit te maken wie van de partijen het recht van keuze zal hebben en/of zal beginnen, of een loting op een andere wijze (bv. door een racket om zijn lengteas te draaien), (soms) opgooi; kop of munt, kruis of munt",exact
gebouw,noun,"II.1/|\Eigenlijk. Iets dat gebouwd is, een bouwwerk, voor zooverre het tot woning of samenkomst of tot verschillende andere maatschappelijke verrichtingen of doeleinden dient. Veelal met het bijdenkbeeld, dat het geheel eene tamelijke grootte of uitgestrektheid heeft en meer of min in kunstvorm is opgetrokken.","bouwwerk dat aan de buitenkant bestaat uit muren en een dak en dat wordt gebruikt voor een of meer doeleinden waarvoor bij voorkeur een besloten ruimte geschikt is, zoals bewoning, opslag, uiteenlopende vormen van arbeid, eredienst en culturele activiteiten",exact
gebouw,noun,"II.1/|\Eigenlijk. Iets dat gebouwd is, een bouwwerk, voor zooverre het tot woning of samenkomst of tot verschillende andere maatschappelijke verrichtingen of doeleinden dient. Veelal met het bijdenkbeeld, dat het geheel eene tamelijke grootte of uitgestrektheid heeft en meer of min in kunstvorm is opgetrokken.","bouwwerk zoals een flatgebouw, een kantoortoren, een fabriek of een openbaar gebouw dat zich door zijn omvang, hoogte of belang onderscheidt van meer bescheiden bouwsels zoals huizen",broader
gebouw,noun,"II.2/|\Figuurlijk, in toepassing op verschillende onstoffelijke zaken, die, als een kunstmatig samenstel van verschillende onderdeelen, met een min of meer kunstig opgetrokken gebouw worden vergeleken. Altijd zóó dat de gedachte aan de eigenlijke beteekenis van het woord levendig blijft, en dus veelal met nadere uitwerking der vergelijking door bijvoeging van andere uitdrukkingen, die op een eigenlijk gebouw toepasselijk zijn.","groot geheel van samenhangende ideeën, gebruiken of maatregelen die samen een soort ideëel bouwwerk vormen",exact
restaurant,noun,"3/|\Gelegenheid waar men, tegen betaling, warme en koude spijzen alsmede dranken kan nuttigen en waar personeel aan tafel bedient; onderscheiden van eethuis, dat meestal kleiner en beperkter, en cafetaria, dat meestal goedkooper, minder exclusief van opzet is.","horecabedrijf waar men een maaltijd kan gebruiken, in de regel een verzorgde maaltijd die uit meerdere gangen kan bestaan",exact
restaurant,noun,3.a/|\Als zelfstandig complex.,gebouw waarin een restaurant is ondergebracht,exact
restaurant,noun,3.b/|\Als onderdeel van een grooter complex.,"eetzaal van een restaurant, als onderscheiden ruimte van de keuken en eventueel de bar en het salon",exact
restaurant,noun,3.b/|\Als onderdeel van een grooter complex.,"ruimte bij een bedrijf of een instelling waar de personeelsleden of andere betrokkenen, meestal tegen betaling, een bereide maaltijd kunnen gebruiken",broader
medium,noun,"1.a/|\(Natuurk.) Stof waarin verschijnselen als licht- en warmtestraling, trillingen, electrische stroom zich voortplanten.",materie waar bepaalde golven doorheen kunnen lopen; middenstof,exact
medium,noun,"1.a/|\(Natuurk.) Stof waarin verschijnselen als licht- en warmtestraling, trillingen, electrische stroom zich voortplanten.","tot aan de theorie van Einstein hypothetisch aangenomen, niet-waarneembare stof in de ruimte waardoor kometen en licht zich zouden bewegen; ether",broader
medium,noun,"1.b/|\(Biochemie) Vloeistof waarin cellen, bacteriën e.d. zich snel kunnen voortplanten; incubatievloeistof.",stof waarop of waarin micro-organismen (zoals bacteriën en schimmels) kunnen groeien en zich kunnen vermeerderen; kweekmedium; kweekmiddel; voedingsbodem of injectievloeistof,exact
medium,noun,"2/|\(Gramm.) Categorie van werkwoordsvervoeging in b.v. het idg. en gr., die het midden houdt tusschen het activum en het passivum, en waarbij het onderwerp dat de handeling verricht tevens het belanghebbend voorwerp is.","grammaticale werkwoordsvorm naast actief (lijdende vorm) en passief (bedrijvende vorm), zoals voorkomt in het Oudgrieks en Latijn, die uitdrukt dat het werkwoord op een bijzonder manier betrekking heeft op het subject (het onderwerp); betrokken vorm; middel",exact
medium,noun,5/|\Bemiddelend element; hulpmiddel; instrument in versch. toep.,middel om twee zaken te koppelen; verbindend element,exact
medium,noun,5.a/|\In het alg.: middel dat aangewend wordt om iets te bewerkstelligen of iets te bereiken.,middel om twee zaken te koppelen; verbindend element,exact
medium,noun,"5.c/|\Middel om informatie, kennis e.d. over te brengen; inz. in toep. op de taal als communicatiemiddel.","middel om informatie over te brengen, soms bedoeld voor een breed publiek; communicatiemiddel; communicatiekanaal; soms ook: massacommunicatiemiddel",exact
medium,noun,"6/|\(Spiritisme en parapsychol.) In het spiritisme: iem. die optreedt als tusschenpersoon tusschen de aardsche wereld en de wereld van de geesten van overledenen, waarbij de ziel van dien persoon tijdelijk het lichaam verlaat om plaats te maken voor den geest uit het hiernamaals. In de parapsychol.: paranormaal begaafd persoon.",iemand die door bijzondere kracht zou kunnen communiceren met doden of dieren of die door bijzondere krachten voorspellingen kan doen of juist in het verleden kan kijken; paranormaal begaafd persoon die kan communiceren met het spirituele; tussenpersoon tussen het aardse en het niet-aardse,exact
medium,noun,"7/|\Massamedium; massacommunicatiemiddel; vaak in mv. media in toep. op televisie, radio en pers.","communicatiekanaal om actualiteiten en andere informatie openbaar te maken voor een groot publiek (bv. krant, radio, televisie en nieuwswebsites); communicatiemiddel voor de massacommunicatie van actualiteiten en andere informatie; massamedium voor actuele informatie; communicatiemiddel voor nieuws; nieuwskanaal; nieuwsmedium",exact
aard,noun,"1/|\Van planten en dieren. Wezen, natuur, natuurlijke eigenschappen.",geheel van al of niet aangeboren eigenschappen van een persoon of dier; natuur; wezen; karakter; inborst,exact
aard,noun,"II/|\Met betrekking tot zaken (bij concreta thans minder gewoon): wezen, bepalende hoedanigheid of gesteldheid.",geheel van kenmerkende eigenschappen van een zaak; soort,exact
meester,noun,"2/|\Iemand die aan het hoofd van eene school staat (verg. lat. ludi magister), schoolmeester; daarna ook onderwijzer van de jeugd in 't algemeen. Thans niet meer als titel, maar in de dagelijksche spreektaal nog gewoon.",onderwijzer,exact
meester,noun,"3/|\In vrijer gebruik: iemand die anderen leert, leermeester.",leermeester; leraar,exact
meester,noun,"4/|\Als vertaling van lat. magister, een graad die door de universiteiten werd verleend en die de bevoegdheid gaf tot het onderwijzen aan hoogescholen; in sommige gevallen was magister synoniem met doctor. Thans bestaat die titel niet meer, maar in het gewone leven wordt een doctor in de rechtswetenschap nog altijd meester in de rechten genoemd.",titel van iemand die een volledige rechtenopleiding heeft afgerond aan een wetenschappelijke universiteit in Nederland of België; afkorting: mr.; volledige titel: meester in de rechten; ook: iemand met de titel van meester in de rechten,exact
meester,noun,"6/|\In toepassing op iemand die in eenig vak van wetenschap of kunst door zijne groote bekwaamheid een voorbeeld is voor anderen, die dan zijne leerlingen heeten ook zonder rechtstreeks door hem te zijn onderwezen.","iemand die zeer goed is in een bepaald vakgebied, met name in een tak van kunst of wetenschap",exact
meester,noun,"9/|\Bij de gilden: iemand die door het maken van een proefstuk, meesterstuk genoemd, de bevoegdheid had verkregen om zelfstandig zijn ambacht uit te oefenen.","bij de vroegere gilden: iemand die door het maken van een proefstuk, meesterstuk genoemd, de bevoegdheid had verkregen om zelfstandig zijn ambacht uit te oefenen; later nog in samenstellingen voor: erkend, gediplomeerd, zelfstandig gevestigd vakman",exact
meester,noun,"10/|\Iemand die anderen in zijn dienst heeft, hetzij als knecht, bediende, beambte, dienstbode enz.","man die anderen in dienst heeft als bediende, knecht, dienstbode; vroeger ook: eigenaar van slaven",exact
meester,noun,"10/|\Iemand die anderen in zijn dienst heeft, hetzij als knecht, bediende, beambte, dienstbode enz.",iemand die de leiding heeft over iemand of iets; iemand die belast is met het beheer of de uitvoering van iets; iemand die belast is met het toezicht op iets; hoofd; opziener,exact
meester,noun,13/|\Als naam voor ieder die heerschappij voert over anderen.,man die heerschappij voert over anderen; man die macht heeft over iemand of iets; heerser,exact
meester,noun,"-/|\Ook van de eigenaars van huisdieren, die den mensch dienen, als paarden, honden enz",eigenaar van een huisdier,exact
diner,noun,"—/|\Middagmaal, hoofdmaaltijd, inzonderheid: fijn of feestelijk middagmaal, feestmaal.","uitgebreide avondmaaltijd die verdeeld is in gangen en genuttigd wordt met meerdere mensen aan een of meer gedekte tafels, vaak met een feestelijk of officieel karakter",exact
diner,noun,"—/|\Middagmaal, hoofdmaaltijd, inzonderheid: fijn of feestelijk middagmaal, feestmaal.","het eten dat, de gerechten die men tijdens een diner eet; het voedsel bij een diner",broader
avondeten,noun,1/|\Datgene wat men 's avonds eet.,voedsel of gerecht dat men als avondmaaltijd eet,exact
avondeten,noun,2/|\De handeling van voor het naar bed gaan iets te eten.,"handeling van het eten 's avonds, meestal op of omstreeks een geregeld tijdstip; avondmaaltijd",exact
opdrijven,verb,A.I.1/|\In 't algemeen. Door aanwending van kracht doen omhooggaan. Ook figuurlijk.,groter doen worden; doen vermeerderen; doen toenemen; vergroten,broader
opdrijven,verb,A.I.1/|\In 't algemeen. Door aanwending van kracht doen omhooggaan. Ook figuurlijk.,"het vermogen of de snelheid van een motor of een motorvoertuig vergroten, meestal door cilinders met grotere inhoud te plaatsen; opvoeren",broader
opdrijven,verb,"A.III/|\Op in de bet. II, D, 2, b). In eene bepaalde richting drijven.","tamme dieren, zoals vee en paarden, onder dwang begeleiden naar een stal, naar een weiland e.d.",broader
opdrijven,verb,"B.I/|\Op in de bet. II, D, 1, a). Drijvende naar boven gaan, opstijgen.",naar boven stuwen; opstuwen,exact
opdrijven,verb,B.I.1.a/|\Van in eene vloeistof ondergedompelde zaken die lichter zijn dan deze. Naar de oppervlakte komen. Verg. BOVENDRIJVEN.,naar boven stuwen; opstuwen,related
opdrijven,verb,"B.II.2/|\Door den stroom, den wind enz. in eene bepaalde richting gedreven worden.",naar boven stuwen; opstuwen,related
musicus,noun,"1)/|\Het Latijnsche woord musicus, in de 17de E. nog alleen voorkomende bij geleerden, en vooral in toepassing op kunstenaars in de oudheid; tegen het einde der 18de E. gaandeweg in de gewone taal ingevoerd als een edeler woord dan muzikant, dat minder aanzienlijk werd. Beoefenaar van de muziek, toonkunstenaar; thans ook wel gebruikt om het woord muziekmeester te vermijden.",iemand die musiceert voor zijn beroep of uit liefhebberij,exact
kwaad,adjective,"A.1/|\Van slechte hoedanigheid, samenstelling, makelij enz.; in slechten staat; niet zoodanig als 't behoort. In vrij gebruik weinig meer gebezigd.","slecht in een of ander opzicht, hetzij ongunstig, hetzij negatief of onaangenaam voor de persoon die het overkomt",exact
kwaad,adjective,"A.5/|\Slecht ten opzichte van —, strijdende tegen de zedeleer of eenige andere leer of wet.",slecht in moreel opzicht; ook: met slechte bedoelingen,exact
kwaad,adjective,"A.8/|\Kwaadaardig, boosaardig, lastig of gevaarlijk om mee om te gaan.",boosaardig en gevaarlijk,exact
kwaad,adjective,"A.9/|\Boos, vertoornd, verstoord, ontstemd.","in een slechte stemming verkerend, waarin men anderen verwijten maakt; boos",exact
kwaad,adjective,"A.15/|\Moeilijk, lastig, bezwaarlijk; ook: gevaarlijk.",moeite kostend; moeilijk; lastig,exact
kwaad,adjective,"A.15/|\Moeilijk, lastig, bezwaarlijk; ook: gevaarlijk.",blijk gevend van boosheid,exact
kwaad,adjective,"B.1/|\Anders dan 't behoort, op een verkeerde, slechte manier; ook: zeer gebrekkig, zeer onvolkomen, enz.","slecht in een of ander opzicht, hetzij ongunstig, hetzij negatief of onaangenaam voor de persoon die het overkomt",exact
kwaad,adjective,"B.2/|\Slecht ten opzichte van de zedeleer of een andere wet, zedeloos, onzedelijk, op ongeoorloofde, afkeurenswaardige wijze, enz.",slecht in moreel opzicht; ook: met slechte bedoelingen,exact
kwaad,adjective,"B.4/|\Hinderlijk, gevaarlijk enz. Zie b.v. kwaadzot bij de Samenst.",boosaardig en gevaarlijk,exact
kwaad,adjective,B.5/|\Moeilijk.,moeite kostend; moeilijk; lastig,exact
kwaad,noun,"I/|\In toepassing op iets dat verkeerd is, niet deugt, afkeuring verdient enz.","iets of alles wat in strijd is met de moraal of een andere leer of wet; iets of alles wat zondig, afkeurenswaardig, ongeoorloofd of verkeerd is",exact
kwaad,noun,"II/|\In toepassing op iets dat in 't algemeen nadeelig is, of ten nadeele strekt van een bepaalde persoon of zaak; soms met bijgedachte aan de onder I) genoemde beteekenis.","iets wat slecht, nadelig of schadelijk is, zonder dat men daarbij denkt aan het morele; iets slechts; schade of nadeel; soms ook: onheil; ongeluk",exact
os,noun,"1/|\Mannelijk rund dat gesneden is. Eertijds ook: rund in 't algemeen (verg. KIL.: ”os, bos, proprie bos castratus”, en de samenst. ossenmarkt, ossenvleesch), soms ook: stier (verg. Teuthon.: ”eyn oss, trio; oss dye gelubt is, semibos”).",gecastreerde stier,exact
informatie,noun,"B/|\Inlichting, naricht. Abstract en concreet (met mv.).","alles wat aan inlichtingen, berichten, mededelingen of kennisoverdracht verstrekt of ingewonnen wordt om iemands kennis over iets of iemand te vermeerderen; geheel van inlichtingen en berichten over een bepaald onderwerp",exact
kamer,noun,"I/|\Een der afzonderlijke afgesloten ruimten of besloten afdeelingen (vertrekken) in of van een huis, een gebouw.","vertrek in een huis of ander gebouw, dat voor wonen, slapen, werken of een ander doel is ingericht en in de regel kleiner is dan een zaal",exact
kamer,noun,I.2/|\Een der vertrekken in of van een woonhuis.,vertrek in een woning waarin men overdag en 's avonds leeft; woonkamer; leefkamer,broader
kamer,noun,I.2/|\Een der vertrekken in of van een woonhuis.,"vertrek dat iemand huurt of verhuurt om in te wonen of te slapen, bijvoorbeeld een studentenkamer of hotelkamer; huurkamer",broader
kamer,noun,"I.3/|\Een huurkamer; mv. kamers, een stel huurkamers; voor een student, een vrijgezel, een alleenstaande vrouw enz.; in huis bij neringdoenden, in een pension, of elders.","vertrek dat iemand huurt of verhuurt om in te wonen of te slapen, bijvoorbeeld een studentenkamer of hotelkamer; huurkamer",exact
kamer,noun,"II.2/|\De vergaderkamer, de zittingzaal van het een of ander college.",kamer van een parlement; parlementaire kamer,exact
kamer,noun,"II.2.b/|\Bij overdracht. De personen die in de genoemde, of aangeduide, of uit het verband blijkende kamer vergaderen, zitting houden, hun bureau of hun kantoor hebben enz.; besturend of regeerend; rechtsprekend; administratief enz. college.","instantie die in een vergaderkamer of zittingzaal bijeenkomt, bijvoorbeeld een gerechtsorgaan of een bestuursorgaan",exact
kamer,noun,"III.1.d/|\Als benaming voor besloten ruimten, natuurlijke holten in het dierlijk lichaam, in plantendeelen enz.","holte in een lichaamsdeel, bijvoorbeeld een hartkamer, oogkamer of hersenholte",exact
pels,noun,"1/|\De dichtbehaarde huid van verschillende dieren, inzonderheid van roof- en knaagdieren, en van schapen; de harige vacht dezer dieren. Deze bet. is waarschijnlijk niet de oudste, maar in lateren tijd afgeleid uit de bet. 2 of 3).","dichtbehaarde huid van dieren, vooral van roofdieren en knaagdieren, die het dier beschermt tegen kou en soms ook tegen warmte; harige vacht van dieren; dichtbehaarde dierenhuid",exact
pels,noun,"2/|\Het met behoud van de haren toebereide vel van zulke dieren, dat gebezigd wordt tot voering of versiering van kleedingstukken, tot dek- of voetenkleeden, enz. Zie de samenst. en verg. Bont (Dl. III, kol. 373).","bewerkte dichtbehaarde dierenhuid, gebruikt in bijvoorbeeld kledingstukken",exact
pels,noun,3/|\Een van dierenhuiden gemaakt of met pelswerk gevoerd of bedekt kleedingstuk. In verschillende tijden in verschillende toepassingen.,"kledingstuk, meestal een jas of een sjaal die met bont van een pels gevoerd of omzoomd is of die van een pels gemaakt is; kledingstuk met pels gevoerd",exact
kas,noun,"V/|\Benaming voor een met glas gedekt gebouwtje of gebouw, thans dikwijls een zeer groot gebouw, voor het bewaren of onderhouden van planten uit een warmer klimaat; voor het broeien of trekken en kweeken van planten, bloemen en vruchten. Men onderscheidt koude, gematigde (of getemperde) en warme kassen; verg. voorts de samenst. broei-, kweek-, run-, stook-, trek-, vuur-, zonnekas enz., en zie voor enkele bijzonderheden ook bij de aanhalingen hieronder.","gebouw voor bloemen of planten dat vaak van glas gemaakt is, zodat de ruimte warm blijft; beschermende ruimte voor gewas",exact
kas,noun,I/|\Beschuttend omhulsel.,"beschermende ombouw, bijvoorbeeld bij een horloge, orgel of wiel; omhullende buitenkant",exact
kas,noun,VI.D.2.b/|\De holte waarin de oogbol zich beweegt; oogkas; oogholte.,holte waar zich het oog in bevindt; oogkas,exact
kas,noun,"3/|\Hetgeen er in de geldkas is, het geld dat (er in) voorhanden is; de geldvoorraad; de voorhanden of beschikbare geldmiddelen (van een persoon, een kantoor, eene vereeniging, eene onderneming enz.).",geld dat een organisatie ter beschikking heeft; geldkas; geldvoorraad; soms ook: geldvoorraad met een specifiek oormerk; fonds,exact
vlekken,verb,I/|\Als bedr. ww.,vlekken maken,exact
vlekken,verb,II/|\Als onz. ww.,vlekken krijgen,exact
vlekken,verb,"II.6/|\In litterair, impressionistisch taalgebruik: zich als een vlek, als of met vlekken (ook licht- of kleurplekken) afteekenen of vertoonen.",door een groot kleurcontrast afsteken tegenover zijn omgeving,related
zege,noun,")/|\Overwinning, victorie, triomf.","het in zijn voordeel beslissen van een strijd, oorspronkelijk een gewapende strijd, in de oorlog, maar vervolgens ook in allerlei andere toepassingen waarbij van strijd, wedijver of competitie sprake is, zoals in de sport, de politiek, het recht of in moreel en geestelijk opzicht; gunstige uitslag, goed resultaat in een strijd, competitie e.d.; het zegevieren, het overwinnen; overwinning; triomf; victorie",exact
zege,noun,").a/|\(Eig.) Overwinning op den vijand, behaald in een strijd, een slag, een gevecht, een oorlog.","overwinning in de gewapende strijd, in de oorlog, in een gewapend conflict",exact
zege,noun,").b.α/|\In het alg. in diverse contexten, b.v. in politieken strijd, machtsstrijd, wedstrijd, liefdesstrijd, twist wegens verschil in opvattingen enz.","overwinning in de sport, hetzij in een afzonderlijke wedstrijd, hetzij in een reeks van wedstrijden, een competie of een toernooi; ook wel: overwinning in een spel, zoals bij poker of klaverjassen",broader
zege,noun,").b.α/|\In het alg. in diverse contexten, b.v. in politieken strijd, machtsstrijd, wedstrijd, liefdesstrijd, twist wegens verschil in opvattingen enz.","overwinning in de politiek, meestal bij een verkiezing, soms ook bij een stemming in het parlement; ook: overwinning van personen, instellingen of een stroming in de politiek door het aanwenden van politieke invloed",broader
zege,noun,").b.α/|\In het alg. in diverse contexten, b.v. in politieken strijd, machtsstrijd, wedstrijd, liefdesstrijd, twist wegens verschil in opvattingen enz.","overwinning in het recht; overwinning die in de rechtzaal behaald wordt, doordat de rechter iemand of een organisatie in het gelijk stelt bij een juridisch geschil",broader
zege,noun,").b.α/|\In het alg. in diverse contexten, b.v. in politieken strijd, machtsstrijd, wedstrijd, liefdesstrijd, twist wegens verschil in opvattingen enz.","overwinning in een zangwedstrijd, bij het songfestval",broader
zege,noun,").b.β/|\In geestelijken, moreelen of religieuzen context: overwinning behaald op het zondige, de ondeugd, de bekoringen e.d.",overwinning in moreel of geestelijk opzicht,exact
lijst,noun,"1/|\Een, meestal vooruitspringende, rand, aangebracht aan een onderdeel van een gebouw, aan een meubel of aan een ander voorwerp.","meestal vooruitspringende rand aan een gebouw, meubel of een ander voorwerp",exact
lijst,noun,"2/|\Een rand van hout of een andere stof rondom en ter afsluiting van een schilderij, een plaat, een spiegel enz. Ook in fig. verband (zie voor 't fig. gebruik beneden onder 10))).","kader van hout of een andere stof om een schilderij, spiegel, foto, kaart, e.d. in te vatten; omlijsting",exact
lijst,noun,"11/|\Een geschreven of gedrukte opsomming van personen of zaken, in den regel onder elkaar geplaatst. De vorm liste in oude zuidnederl. geschriften is wellicht aan fr. invloed toe te schrijven.","opsomming van onder elkaar geplaatste items, zoals persoonsnamen, zaaknamen, cijfers, woorden of andere gegevens; ook: een dergelijke opsomming die iemand in gedachten heeft, zonder dat die opgeschreven of gedrukt is",exact
lijst,noun,"11/|\Een geschreven of gedrukte opsomming van personen of zaken, in den regel onder elkaar geplaatst. De vorm liste in oude zuidnederl. geschriften is wellicht aan fr. invloed toe te schrijven.",lijst van kandidaten bij een verkiezing en met name bij een politieke verkiezing; verkiezingslijst,broader
