lemma,pos,sense_source,sense_target,semantic_relationship
roos,noun,"1/|\De bekende schoone bloem van het plantengeslacht Rosa, behoorende tot de familie der Rosaceae.",bloem van een roos uit het geslacht Rosa; bloem van een roos,exact
roos,noun,"2/|\Als naam voor het gewas, de plant, waar de onder 1) genoemde bloem aan groeit.","bloeiende plant uit het geslacht Rosa, met een bloem die al sinds mensenheugenis geliefd is om haar schoonheid en een stengel met doornen",exact
roos,noun,"4/|\Als naam voor andere planten. — B. v. als volksnaam (in Zeeland: Tholen, Land van Hulst) voor de Klaproos, Papaver rhoeas L. (HEUKELS 174 [1907]).",min of meer op een roos lijkende plant of bloem,exact
roos,noun,10/|\Blos of roode kleur; inzonderheid in het mv. rozen.,"rode kleur, met name op de wangen; blos",exact
roos,noun,"12/|\Een voorwerp, of een figuur op een voorwerp, oppervlak enz., dat een roos voorstelt.",afbeelding van een roos,exact
roos,noun,12.a/|\Een nagemaakte roos van papier of een andere stof.,"nagemaakte roos, bijvoorbeeld van papier of plastic",exact
roos,noun,"14.a/|\Een plaatselijke ontsteking van de huid, waarbij deze een roode kleur aanneemt, dikwijls met koorts gepaard gaande; erysipelas.",rode huiduitslag,exact
roos,noun,"15/|\Zekere ziekte in het haar, waarbij de hoofdhuid witte schilfers loslaat.",vorm van eczeem op het hoofd waarbij de hoofdhuid witte schilfers loslaat; hoofdroos; pityriasis capitis,exact
roos,noun,"15/|\Zekere ziekte in het haar, waarbij de hoofdhuid witte schilfers loslaat.",hoeveelheid schilfers als gevolg van de aandoening [i]roos[/i].,exact
roos,noun,21/|\Ronde plek in het midden van een schietschijf (bij boogschutters).,"ronde plek in het midden van een schietschijf, bijvoorbeeld bij het boogschieten, het dartsspel of in een schietkraam, die het hoogste aantal punten oplevert als ze geraakt wordt",exact
roos,noun,21/|\Ronde plek in het midden van een schietschijf (bij boogschutters).,"voltreffer in een andere sport, bijvoorbeeld voetbal; doelpunt; goal",related
abstract,noun,"1)/|\Trekker aan een toets van een orgel, die een ventiel opent.",fijn houten latje aan een toets in een orgel dat de beweging overbrengt van de toets naar het ventiel in de windlade,exact
abstract,adjective,"A.2/|\Van begrippen. Door afleiding verkregen; losgemaakt van de bijzondere vormen of samenhangen waarin hetgeen het begrip uitdrukt in de werkelijkheid voorkomt; een voorstelling noemend, die op zichzelf niet van stoffelijken aard is; niet concreet; afgetrokken.","bestaande in de geest als een begrip, gedachte of idee, maar geen fysieke vorm of concreet bestaan hebbend; niet concreet; conceptueel",exact
abstract,adjective,"A.2/|\Van begrippen. Door afleiding verkregen; losgemaakt van de bijzondere vormen of samenhangen waarin hetgeen het begrip uitdrukt in de werkelijkheid voorkomt; een voorstelling noemend, die op zichzelf niet van stoffelijken aard is; niet concreet; afgetrokken.","iets noemend wat over het algemeen niet zintuiglijk waarneembaar is; een abstract begrip noemend, bijvoorbeeld een gebeurtenis, eigenschap of toestand",exact
abstract,adjective,"A.2/|\Van begrippen. Door afleiding verkregen; losgemaakt van de bijzondere vormen of samenhangen waarin hetgeen het begrip uitdrukt in de werkelijkheid voorkomt; een voorstelling noemend, die op zichzelf niet van stoffelijken aard is; niet concreet; afgetrokken.",gebruik makend van niet-concrete begrippen; niet door concrete voorbeelden verhelderd of niet in concrete situaties gerealiseerd; theoretisch; soms ook: moeilijk te begrijpen; vaag,exact
abstract,adjective,A.3/|\Van personen of kunsten. Zich bezighoudend met afgeleide begrippen of niet tot de zintuigelijke werkelijkheid behoorende voorstellingen.,"niet verwijzend naar iets buiten de kunst of het kunstwerk; waarbij men er niet naar streeft om de zichtbare realiteit weer te geven, maar waarbij vormen, lijnen en kleuren (en in de muziek ook ritmes e.d) voor zich spreken; non-figuratief",exact
abstract,adjective,A.3/|\Van personen of kunsten. Zich bezighoudend met afgeleide begrippen of niet tot de zintuigelijke werkelijkheid behoorende voorstellingen.,abstracte kunst makend,exact
recapituleren,verb,"1)/|\Kort en duidelijk samenvatten, samenvattend herhalen.",dat wat in het voorafgaande uiteengezet of gebeurd is kort en duidelijk samenvatten,exact
kramp,noun,"1)/|\Overeenkomstige of verwante vormen zijn o.a. os. krampo, mnd. nnd. krampe; ohd. krampfo, mhd. nhd. krampf; meng. crampe, neng. cramp. Het woord is o.a. verwant met Krimpen, het ohd. bnw. krampf ”gekromd”, en waarschijnlijk ook met Krom. Een ziekelijke, onwillekeurige samentrekking van een of meer spieren, die korter of langer tijd duren of zich snel herhalen kan, en soms met pijn gepaard gaat; Convulsio, Spasmus, Tetanus.","onwillekeurige, pijnlijke samentrekking van een of meer spieren; krampachtige spiersamentrekking",exact
kramp,noun,—/|\Fig.,emotie of reactie die plotseling en in alle hevigheid optreedt en iemand als het ware doet verkrampen; heftige gemoedsaandoening,exact
kramp,noun,"1)/|\Overeenkomstig of verwant zijn o.a. os. krampo, mnd. krampe; ohd. krampf, mhd. nhd. krampe; uit het Germ. is fr. crampon ontleend. Hetzelfde woord als Kramp (I) of althans ten nauwste er aan verwant, en hoogerop aan Kram. Haak. Thans nog in Z.-Nederl. bekend.",tandje van een ritssluiting,related
vork,noun,"I.1/|\In den landb.: als alg. ben. voor een werktuig met een langen steel en aan het ondereinde daarvan twee of drie, soms ook vier (inz. ijzeren) tanden, voor verscheidene doeleinden in gebruik zooals o.a. het keeren, spreiden, opsteken van hooi, het laden van hooi op schooven, het opsteken en verspreiden van mest, het uitsteken van gewassen enz.; soms ook specifieker voor één van derg. werktuigen en dan hetz. als: gaffel, hooivork (met twee, soms ook drie tanden) of greep, riek, mestvork (met drie tanden); in engeren zin soms ook wel uitsl. in toep. niet op het geheele werktuig, maar alleen op het onderste gedeelte met de tanden. Gewest. zeer verbreid, m.n. in het W. en N.-O. van het taalgebied.",landbouwwerktuig dat bestaat uit een lange houten steel met daarop een constructie met twee of drie ijzeren tanden dat vooral gebruikt wordt om hooi of mest mee op te prikken; hooivork; mestvork,exact
vork,noun,"I.4/|\Stuk keuken- of eetgerei bestaande uit een steel met aan het ondereinde daarvan twee, drie of vier tanden. Aan het zaakgebr. zijn verscheidene cultuurhist. facetten verbonden die hier bezwaarlijk alle uiteengezet kunnen worden; men zie daarvoor verder b.v. SCHOTEL, O.-Holl. Huisg. 311-357 [1868] en W.P. Kunst [1959].",voorwerp dat bestaat uit een steel met daaraan twee of meer tanden en dat vooral gebruikt wordt om er eten mee op te prikken en in de mond te stoppen; stuk eetgerei,exact
vork,noun,I.5/|\(Meton.) Elk der twee of drie puntige uitsteeksels (vermoedelijk van een werktuig als onder 1) vermeld); tand. Alleen in de aangehaalde oudere wdb.,elk der beide takken van een op een vork lijkende zaak; ook: ruimte tussen de tanden van een vork; ruimte tussen de beiden uiteinden van een op een vork lijkend voorwerp,exact
vork,noun,"II/|\Bij verg. en oneig. in toep. op voorwerpen, werktuigen of onderdeelen daarvan die door hun vorm (Y, V, U e.d.) aan een tweetandige vork als vermeld onder I) doen denken.","iets wat door zijn vorm aan een tweetandige vork doet denken, bv. een gevorkte tak, de gaffel van een zeilboot, een stemvork, een Y-splitsing of een grafiek met de vorm van een Y",exact
vork,noun,"II.10.e/|\In de alg. taal thans zeer gebruikelijk ter aanduiding van de fietsvork, het bekende onderdeel aan het fietsframe dat zich vanuit een kort (schuin-)verticaal stanggedeelte vertakt in twee lange (eenigszins gebogen) armen waartusschen het wiel is opgehangen.",deel van het frame van een fiets waarin het wiel wordt opgehangen,exact
zekeren,verb,"1/|\(Bedr.) Behoeden, beschermen tegen, vrijwaren voor wat schade of nadeel kan teweegbrengen. In de aanh. in religieus opzicht. Slechts eenmaal aangetroffen.","iets beveiligen, bijvoorbeeld tegen vernieling, fraude of waardeverlies",exact
breuk,noun,"A.1.a/|\Eig., abstr. Het breken van iets, hetzij de samenhang geheel of slechts gedeeltelijk verbroken wordt. Zeldzaam.","het breken van iets, waarbij de samenhang geheel of slechts gedeeltelijk verbroken wordt; het breken",exact
breuk,noun,"A.1.b/|\Bij overdr., concr. De zichtbare scheiding of opening in of op een gebroken voorwerp; reet, spleet, scheur.",zichtbare scheiding of opening in of op een gebroken voorwerp; barst; gat; spleet; scheur,exact
breuk,noun,"A.1.c/|\In de delfstofkunde en de metaalbewerking. Het oppervlak waarlangs eene delfstof, een stuk metaal in tweeën gescheiden is.",oppervlak waarlangs een mineraal of een stuk metaal gebroken is,exact
breuk,noun,"A.3/|\Met betrekking tot het dierlijk lichaam, t.w. het gebeente. Verbreking van den samenhang van een der beenderen, ten gevolge van een val, slag, stoot enz.; lat. fractura. Buiten de samenstelling beenbreuk niet zeer gebruikelijk.",verbreking van de samenhang van een bot; botbreuk,exact
breuk,noun,"A.4/|\Verplaatsing, uitzakking van een ingewand, meestal uit de buikholte, door eene natuurlijke of tegennatuurlijke opening (uitstulping) in den buikwand heen, tot onder de algemeene lichaamsbekleedselen (huid enz.) of in eene naburige holte; bij overdracht ook: het uitgezakte gedeelte van het ingewand; lat. hernia. Aldus genoemd, omdat men voorheen meende, dat de wand der holte, waarin het ingewand besloten lag, brak of scheurde; zie bij BREKEN, I, A, 1, a, β en b, β), en verg. de in ouderen tijd meest gebruikelijke benamingen scheursel of gescheurdheid. Hoewel dit later onjuist is gebleken, is toch breuk in de algemeene taal nog steeds de gewone benaming gebleven (verg. boven, 3).","uitstulping van een inwendig orgaan of van weefsel uit de lichaamsholte waarin het besloten lag, bijvoorbeeld een liesbreuk of navelbreuk; hernia",exact
breuk,noun,"B/|\Breken, I, B, 1, f). In de rekenkunde. Eig.: eene grootheid, bestaande uit één of meer evenmatige deelen waarin men zich voorstelt dat een of meer geheelen verdeeld zijn; gewoonlijk, bij overdracht: de uitdrukking of voorstelling van zulk eene grootheid door middel van ten minste twee getallen: den noemer, aanwijzende in hoeveel deelen het geheel verdeeld is, en den teller, aanwijzende hoeveel van die deelen genomen worden. In de stelkunde: eene onuitgevoerde deeling van twee algebraïsche getallen. Voorheen veelal gebroken genoemd (zie BREKEN, t. a. p.; STEVIN, Gedacht. 7¹, 9; COCK V. ENCH., Cyferk. 162 [1645]; KINCKHUYSEN, Algebra 17 e.v.); soms ook gebrook (COCK V. ENCH., Cyferk. 141 [1645], COCK V. ENCH., Cyferk. 144 [1645]). Vertaling van lat. fractio.",getal dat een gedeelte van een eenheid voorstelt en bestaat uit een teller en een noemer,exact
breuk,noun,"F/|\Breken, II, A, 9). Het afbreken der betrekkingen tusschen personen die door banden van liefde, vriendschap, eensgezindheid enz. vereenigd waren; verwijdering, scheiding, klove. Wellicht naar nhd. bruch. Bij uitbreiding ook met betrekking tot partijen, denkbeelden enz.","het verbreken van betrekkingen tussen personen die door banden van liefde, vriendschap, eensgezindheid enz. verenigd waren; scheiding of relatiebreuk",exact
dreggen,verb,B.1/|\Het anker laten slepen; doordreggen.,de bodem van een water met een dreg afzoeken naar drenkelingen of gezonken voorwerpen,related
dreggen,verb,B.2/|\Met eene dreg visschen.,iets door dreggen boven water halen,narrower
sluimer,noun,"1/|\Slaap, thans bepaaldelijk lichte of zachte slaap. In N.-Ndl. alleen in litteraire taal.",slaap; in het bijzonder: lichte of zachte slaap,exact
bot,noun,1/|\Eigenlijk.,"knop van boom, struik of bloem; plantenknop",exact
bot,noun,")/|\Zekere visch, behoorende tot de familie der platvisschen en tot het geslacht der schollen, van boven bruin met roestkleurige vlekken (Pleuronectes flesus); langs onze kust (in de zoogenaamde lekken), in de Zuiderzee en in de benedenrivieren met netten — aan het strand ook met een achter een wagen vastgemaakt sleepnet — gevangen, of met eene vork of prik gestoken (zie beneden, de Samenst.). In West-Vlaanderen onderscheidt men den but, fr. flet, picaud, lat. platessa flesus van de plaat of pladijs, fr. plie fransche, carrelet (DE BO [1873]).","platvis uit de familie van de schollen, die zijn kleur aan de bodem kan aanpassen en die in zout, brak en zoet water leeft, ook aan de kusten bij de Lage Landen",exact
bot,noun,1/|\Als voorwerpsnaam.,"platvis uit de familie van de schollen, die zijn kleur aan de bodem kan aanpassen en die in zout, brak en zoet water leeft, ook aan de kusten bij de Lage Landen",exact
bot,noun,2/|\Als stofnaam.,"platvis met een fijne structuur en een weinig uitgesproken smaak, die in zijn geheel of als filet bereid wordt; bot als consumptievis",exact
bot,noun,"1)/|\Een woord voor: Been, knook, schonk van dieren of menschen, dat eerst in het jongere Mnl. eene enkele maal voorkomt. Vergelijkt men de beteekenissen van Bonk (I) met Bonken en die van Stomp (znw. en bnw.) met Stompen, dan valt er nauwelijks te twijfelen of dit woord bot is eenerzijds verwant met het bnw. Bot (X), anderzijds met het ww. Botten (I); zie verder die woorden. De oorspronkelijke beteekenis kan dus niet veel anders zijn dan: stomp, afgeknot ding. Het woord is in verschillende gewesten bekend, maar schijnt toch vooral in de Noordelijke en Oostelijke gewesten thuis te hooren (zie HALBERTSMA 469, MOLEMA 37 b (op Bieterke), Arch. v. Ned. taalk. 1, 254; maar toch ook HOEUFFT, Bred. T.; SCHUERM.,Bijv. [1883]; RUTTEN [1890]; Loquela 5, 66 [1885] en Loquela 5, 81 [1885]); van de onderstaande aanhalingen zijn de oudste ook uit die streken afkomstig, en HALMA en MARIN noemen het eveneens Geldersch. Ook thans geldt het in de beschaafde Hollandsche spreektaal, inzonderheid in toepassing op menschen, nog als plat.","meestal inwendig, hard lichaamsdeel van mens of dier dat ervoor dient om het lichaam in vorm te houden en vitale delen te beschermen",exact
bot,adjective,"I.1/|\Eigenlijk. Van snijdende werktuigen. Stomp, sleeuw, niet scherp.",stomp; niet scherp,exact
bot,adjective,"I.2.a/|\Van personen. Dom, stomp, onbevattelijk; het tegenovergestelde van schrander, geestig, scherpzinnig, snedig, geslepen enz. Thans minder dan voorheen, alleen in zeer ongunstigen, minachtenden zin gebruikelijk.",op een lompe manier kortaf; onbeleefd,broader
bot,adjective,"-/|\Dikwijls ook met betrekking tot gedrag en uiterlijk: Plomp, onbehouwen, boersch, onbeleefd, onbeschoft. Thans in Vlaanderen nog zeer gewoon. ",op een lompe manier kortaf; onbeleefd,exact
bot,adjective,"I.2.b/|\Bij overdracht. Van uitingen, handelingen, meeningen, eigenschappen enz. Blijk gevende van onverstand, onwetendheid, plompheid.",ongenuanceerd; kort door de bocht; dom op een lompe manier,exact
bot,adjective,"II/|\Bijw. (van wijze). — A) Op eene wijze die blijk geeft van domheid, onverstand, onhandigheid, plompheid.",op een lompe manier kortaf; onbeleefd,related
eten,verb,"A.1/|\Als spijs tot zich nemen; tot zijn spijs hebben, zich voeden met.",iets als voedsel tot zich nemen; iets opeten; iets nuttigen,exact
eten,verb,"A.4/|\Door het gebruiken van spijs verkrijgen, zich door het gebruiken van spijs op den hals halen.",zich door te [i]eten[/i] op de hals halen; door te [i]eten[/i] krijgen; te veel eten,exact
eten,verb,B/|\Onz. — 1) Spijs tot zich nemen.,iets als voedsel tot zich nemen; iets opeten; iets nuttigen,exact
eten,verb,B.2/|\Een of den maaltijd gebruiken; inzonderheid en thans vrijwel uitsluitend: het middagmaal gebruiken.,een maaltijd gebruiken,exact
eten,noun,"1/|\Iets dat geschikt of bestemd is om gegeten te worden, spijs, voedsel. In de spreektaal het gewone woord.",dat wat iemand eet; voedsel; spijs; eetwaar,exact
eten,noun,"3/|\Middagmaal. Voornamelijk in verbindingen met voorzetsels, veelal in oude 3ten-naam valsvormen.",de handeling of activiteit van het eten zoals die dagelijks op geregelde tijden plaatsvindt; maaltijd,broader
bestek,noun,")/|\Lepel(s), mes(sen) en vork(en); couvert.",eetgerei,exact
bestek,noun,"2/|\Een bepaald punt, dat gesteld is b.v. als doel, als grenspunt enz. (verg. ook onder 4).",vooraf vastgestelde doelstelling; reikwijdte,exact
bestek,noun,"7/|\Schets, plan van eenig bouwwerk.",technische omschrijving van een uit te voeren bouwwerk,related
bestek,noun,"8/|\Beschrijving van de deelen van een bouwwerk (ook van een schip), volgens welke het moet worden uitgevoerd.",technische omschrijving van een uit te voeren bouwwerk,exact
bestek,noun,"10/|\Plan, inzonderheid wat betreft den omvang eener onderneming of wijze van doen.",vooraf vastgestelde doelstelling; reikwijdte,broader
bestek,noun,12/|\Bepaling van de gegevens waaruit blijkt op welke plaats in zee een schip zich op een bepaald oogenblik bevindt.,positiebepaling; meer bepaald: positiebepaling op zee; ook wel: positie op zee,exact
midden,noun,1/|\Het middelste gedeelte of punt van een stoffelijk of onstoffelijk voorwerp.,"deel of punt tussen twee of meer uitersten, en van elk van die uitersten even ver, of ongeveer even ver, verwijderd; ook: elke plaats tussen twee of meer personen of zaken in; centraal gelegen punt",exact
midden,noun,2/|\Het tijdstip of de tijdruimte halverwege een bepaald bestek.,tijdstip of de tijdruimte halverwege een bepaald bestek,exact
midden,noun,"4/|\Omgeving, kring van personen of zaken; t.w. als vertaling van fr. milieu in dien zin. Alleen in Z.-N.",groep personen die beschouwd wordt als een min of meer besloten geheel; gezelschap; kring; milieu; omgeving,exact
midden,noun,6/|\Eene zaak die tusschen twee andere in ligt.,"standpunt, koers, handelwijze of denkwijze tussen twee uitersten in; gematigd standpunt; ook: gematigde koers, handelwijze of denkwijze",broader
midden,noun,"6.b/|\Datgene wat tusschen twee uitersten ligt, t.w. in toepassing op eene handel- of denkwijze waarbij de uitersten worden vermeden. Inzonderheid is in de 19de E. in gebruik gekomen het juiste midden, fr. le juste milieu.","standpunt, koers, handelwijze of denkwijze tussen twee uitersten in; gematigd standpunt; ook: gematigde koers, handelwijze of denkwijze",exact
stouwen,verb,"A.3/|\Stoppen, bergen, t.w. in een ruimte of op een bepaalde plaats.","goederen, bagage of spullen zodanig in een schip, voertuig of ruimte bergen, dat alles goed blijft liggen, goed verdeeld is en zo min mogelijk ruimte inneemt; ook: iets ergens in stoppen of stapelen in het algemeen",exact
stouwen,verb,"A.4/|\Inzonderheid: een lading zoodanig in een schip of voertuig bergen, dat deze vast ligt, goed verdeeld is en zoo min mogelijk ruimte inneemt.","goederen, bagage of spullen zodanig in een schip, voertuig of ruimte bergen, dat alles goed blijft liggen, goed verdeeld is en zo min mogelijk ruimte inneemt; ook: iets ergens in stoppen of stapelen in het algemeen",narrower
stouwen,verb,"A.6/|\Van een persoon: als ”lading” innemen, bergen, t.w. eten of drank.",eten en drank in grote hoeveelheden en vaak ook in hoog tempo naar binnen werken,exact
geweldig,adjective,"I.C/|\Geweld in de bet. II, B). Hevig, heftig, onstuimig.",zich met veel geweld of kracht latende voelen; hevig,exact
geweldig,adjective,"I.D/|\Geweld in de bet. II, C). Geraas makend, luidruchtig; van geluiden in de natuur of door menschen voortgebracht.",zeer luid; hard,exact
geweldig,adjective,"I.F/|\Door wederkeerigen invloed van de verschillende onder A — E vermelde begrippen heeft geweldig ook den algemeenen zin gekregen van: Groot, sterk, krachtig, gewichtig in zijne soort.",buitengewoon groot of sterk; enorm,broader
geweldig,adjective,"I.F/|\Door wederkeerigen invloed van de verschillende onder A — E vermelde begrippen heeft geweldig ook den algemeenen zin gekregen van: Groot, sterk, krachtig, gewichtig in zijne soort.",buitengewoon goed of leuk; fantastisch; schitterend,broader
geweldig,adjective,"I.F/|\Door wederkeerigen invloed van de verschillende onder A — E vermelde begrippen heeft geweldig ook den algemeenen zin gekregen van: Groot, sterk, krachtig, gewichtig in zijne soort.",in hoge mate; erg; zeer,broader
geweldig,adjective,"II.2/|\Van graad. In een hoogen graad, in eene hooge mate, zeer, uiterst; in de jongere taal alleen in gemeenzamen stijl.",in hoge mate; erg; zeer,exact
hit,noun,")/|\Succesnummer, m.n. in de popmuziek.",succesnummer in de popmuziek; succesvol lied,exact
hit,noun,1/|\Paard van de eene of andere kleine soort (de eigenlijke hitten worden nu veelal pony's genoemd).,klein paardje; pony,exact
dank,noun,"2/|\Erkentelijkheid, erkentenis.",erkentelijkheid jegens iemand van wie men iets goeds ondervonden heeft; dankbaarheid,exact
dank,noun,3/|\Betuiging van erkentelijkheid.,erkentelijkheid jegens iemand van wie men iets goeds ondervonden heeft; dankbaarheid,narrower
dank,noun,4/|\Bewijs van erkentelijkheid; vergelding; belooning.,erkentelijkheid jegens iemand van wie men iets goeds ondervonden heeft; dankbaarheid,narrower
dank,noun,5/|\Aanspraak op erkentelijkheid.,erkentelijkheid jegens iemand van wie men iets goeds ondervonden heeft; dankbaarheid,related
school,noun,1/|\Inrichting waar onderwijs wordt gegeven.,"instelling waar onderwijs verstrekt wordt, meestal een instelling waar aan jongeren basisonderwijs of middelbaar onderwijs wordt gegeven",exact
school,noun,1.b/|\Het gebouw of lokaal waarin de inrichting gevestigd is.,gebouw waar een school gehuisvest is,exact
school,noun,"3/|\Geheel van personen die in een wetenschap of kunst het werk van een voorganger in diens geest voortzetten of die een overeenkomst in werkwijze of opvattingen vertoonen, die op oorzakelijken samenhang berust.","groep mensen, meestal kunstenaars of wetenschapslui, die samen dezelfde doctrine huldigen, zich beroepen op een gemeenschappelijke leermeester of op dezelfde wijze werken",exact
school,noun,")/|\Aaneengesloten menigte van dieren (thans niet van huisdieren) en ook wel van menschen; troep, zwerm, schaar.",grote groep samen zwemmende vissen of andere zeedieren van dezelfde soort,exact
weg,noun,"1/|\Relatief smalle strook grond, zich in een landschap over een min of meer aanzienlijken afstand uitstrekkende, gebruikt en meestal ook geschikt gemaakt om zich van de eene plaats, buurt, stad e.d. naar de andere te begeven; verbinding door eenig landschap ten behoeve van het verkeer tusschen twee of meer plaatsen, buurten, steden e.d., meestal verhard, geplaveid of op een andere wijze van een hard dek voorzien. In eenige gevallen (zie b.v. de aanh. uit COMENIUS bij a), eenige aanh. bij b, eerste alinea, en vgl. ook de bet. 8, e)) wordt weg gezien in oppositie met pad, en fungeert het woord als de specifieke ben. voor de grootere verbinding tusschen twee plaatsen, waarover uitsl. met wagens of rijtuigen gereden mag worden.","strook grond van zekere, vaak aanzienlijke lengte die men gebruikt voor verkeer van personen en voertuigen en die men daartoe meestal effent en voorziet van een harde bovenlaag",exact
weg,noun,"3/|\Route die, traject dat iets of iem. volgt, moet of kan volgen, om op zeker punt, op een bep. plaats enz. aan te komen; route, traject, passage waarlangs men een bep. punt, een bep. plaats enz. bereikt of kan bereiken; gelegenheid of mogelijkheid om zich ergens naartoe te bewegen of om een bep. punt te bereiken.",route die iemand of iets volgt of moet volgen om ergens te komen; traject waarlangs men zeker punt of een bepaalde plaats bereikt of kan bereiken,exact
weg,noun,4.b/|\De lijn die een zich door de ruimte voortbewegend lichaam beschrijft; baan.,"traject, lijn beschreven door wat zich door de lucht, door de ruimte of door een ruimte beweegt tussen een beginpunt en een eindpunt; vliegroute; ook ter aanduiding van een vast traject door de lucht of ruimte en zoveel als: baan",exact
weg,noun,4.b.α/|\Baan van een hemellichaam; ook wel: omloop.,"traject, lijn beschreven door wat zich door de lucht, door de ruimte of door een ruimte beweegt tussen een beginpunt en een eindpunt; vliegroute; ook ter aanduiding van een vast traject door de lucht of ruimte en zoveel als: baan",narrower
weg,noun,"4.b.β/|\De baan van een projectiel, of vallend voorwerp.","traject, lijn beschreven door wat zich door de lucht, door de ruimte of door een ruimte beweegt tussen een beginpunt en een eindpunt; vliegroute; ook ter aanduiding van een vast traject door de lucht of ruimte en zoveel als: baan",narrower
weg,noun,"8.a.2°/|\Gezegd van pers., ook wel van zaken, ter aanduiding van de richting waarin iets of iem. zich ontwikkelt. Steeds gevolgd door (om of, in Vl.-België ook wel van) te + inf.: zoo handelen, zich zoo ontwikkelen, zoodanige zaken meemaken of ondergaan, dat het doel of resultaat dat in den beknopten bijzin genoemd wordt, (snel) dichterbij komt; (goed) vooruitgaan in een bep. proces; (flink) vorderen op den weg naar zeker doel of resultaat.","samenstel van handelingen, stappen, stadia, voorgesteld als een weg waarover iemand zich verplaatst",related
weg,noun,"8.a.3°/|\In aansl. bij de vorige alinea, hier echter zonder beknopten bijzin en in een constr. waarin aan weg steeds een bep. voorafgaat; de nadruk ligt bij derg. gebr. dan ook eerder op de manier waarop iets of iem. zich ontwikkelt, dan op het doel of resultaat van die ontwikkeling zelf. Van pers.: zoo handelen als de bep. voor weg aanduidt, om zeker doel of resultaat te bereiken; van zaken (t.w. bep. gebeurtenissen): zich ontwikkelen op de wijze zooals door de bep. bij weg aangegeven wordt.","samenstel van handelingen, stappen, stadia, voorgesteld als een weg waarover iemand zich verplaatst",related
weg,noun,"9/|\(In een specifieke toep. van de vorige bet., vrijwel steeds in fig. verband, een enkelen keer echter ook in geheel fig. gebr.) In toep. m. betr. t. het leven of de levenswijze.",wijze waarop men leeft in zedelijk of moreel opzicht; wijze van gedrag; levenswijze; levenswandel,exact
