lemma,pos,sense_source,sense_target,semantic_relationship
spoor,noun,"6/|\Stel van doorgaans twee rijen metalen staven, waarover rij- en voertuigen op wielen geleid worden. Gewoonlijk in toepassing op de staven met liggers, tusschenruimte enz.","weg, strook met een stel van doorgaans twee rijen metalen staven of rails waarover voertuigen op wielen geleid worden, zoals treinen en trams; eveneens in toepassing op de metalen staven zelf, al dan niet met inbegrip van de dwarsliggers daaronder",exact
spoor,noun,7/|\Spoorweg. Zie ook bij SPOOR (III).,netwerk van spoorwegen; spoorwegnetwerk,narrower
spoor,noun,"8/|\Spoortrein, trein. Zie ook bij SPOOR (III). Sommige plaatsen laten ook een opvatting in de bet. 7) toe.",spoortrein; trein,exact
wit,adjective,"I.1/|\De kleur hebbend van het ten volle teruggekaatst licht, die in de natuur eigen is aan sneeuw of melk.",de kleur hebbend van ten volle teruggekaatst licht; de lichtste kleur hebbend,exact
wit,adjective,I.1.a.β/|\(Meton.) Van personen: in het wit gekleed.,in het wit (gekleed); met witte kleren; in witte kleren; met witte accessoires; in het wit gehuld,exact
wit,adjective,"I.2/|\(Bij uitbr.) De kleur hebbend die wit (1) benadert, inz. in toep. op allerlei bleeke schakeeringen van geel en grijs of grauw, veelal gebruikt i.t.t. donkere variëteiten van dezelfde soort.",zeer licht (gekleurd); zeer licht van kleur; licht van tint,exact
wit,adjective,"I.2.a/|\Van de haren of van den drager ervan: grijs, grijswit.",met een witte vacht; met witte haren; met witte veren; met lichtgekleurde haren; met een lichtgekleurde vacht,exact
wit,adjective,I.3/|\Van de menschelijke huid: blank. Inz. in positieven zin als beantwoordend aan het klassieke schoonheidsideaal.,met inwoners met een van nature blanke huidskleur; vooral bedoeld voor mensen met een van nature blanke huidskleur; vervaardigd of uitgevoerd door mensen met een van nature blanke huidskleur; bestaand uit mensen met een van nature blanke huidskleur,related
wit,adjective,I.4/|\Van het Kaukasische menschenras: van nature een blanke huidskleur hebbend.,met inwoners met een van nature blanke huidskleur; vooral bedoeld voor mensen met een van nature blanke huidskleur; vervaardigd of uitgevoerd door mensen met een van nature blanke huidskleur; bestaand uit mensen met een van nature blanke huidskleur,exact
wit,adjective,I.4/|\Van het Kaukasische menschenras: van nature een blanke huidskleur hebbend.,met inwoners met een van nature blanke huidskleur; vooral bedoeld voor mensen met een van nature blanke huidskleur; vervaardigd of uitgevoerd door mensen met een van nature blanke huidskleur; bestaand uit mensen met een van nature blanke huidskleur,related
wit,adjective,I.5/|\Van het gezicht of van personen m. betr. t. het gezicht: tijdelijk met een bleeke kleur als gevolg van een plotselinge gemoedsaandoening of van ziekte.,bleek; met een bleek gezicht; met een bleek gelaat; zeer bleek,exact
wit,adjective,"IV.19/|\In geestelijken zin: zuiver, rein, onbevlekt, edel, verheven. Inz. als epitheton van deugd. Veroud.",goed; zuiver; onschuldig,exact
wit,adjective,"IV.20/|\Helder, onverduisterd in schijn of glans, transparant. Inz. van het daglicht. Veroud.",duidelijk; verklarend; doorzichtig; zichtbaar,narrower
wit,noun,"I/|\De witte (I, 1) kleur.",kleur van ten volle teruggekaatst licht; de lichtste kleur,broader
wit,noun,"I/|\De witte (I, 1) kleur.",lichte kleur,exact
wit,noun,"I.1/|\De witte (I, 1) kleur in het alg.; steeds genoemd in uitdr., zegsw. enz. i.t.t. zwart.",lichte kleur,exact
wit,noun,"I.1/|\De witte (I, 1) kleur in het alg.; steeds genoemd in uitdr., zegsw. enz. i.t.t. zwart.",kleur van ten volle teruggekaatst licht; de lichtste kleur,broader
wit,noun,I.2/|\Blankheid (van het gelaat). Veroud.,mensen met een van nature blanke huidskleur,exact
wit,noun,"I.3/|\Witte (I, 1, a) kleeding.",witte kleren; witte kleding,exact
wit,noun,I.3.b/|\Witte bekleeding.,lichtgekleurde stof die wordt gebruikt om iets wit te maken of stof die van zichzelf al wit of lichtgekleurd is,exact
wit,noun,"I.6.b/|\(Meton.) Met het wit (6, a) aangebrachte spatie(s) tusschen woorden en regels.",wit of lichtgekleurd gedeelte ergens van,related
wit,noun,I.7/|\(Meton.) Degene die in het dam- of schaakspel met de witte schijven of stukken speelt. Steeds zonder lidw.,"iemand die met de witte stukken speelt bij het schaken, het dammen of het bordspel go",exact
wit,noun,"II.8/|\Het witte (I) deel van het ei, in onderscheid met den dooier.",wit of lichtgekleurd gedeelte ergens van,related
wit,noun,II.9/|\Het witte (I) deel van den oogbol.,wit of lichtgekleurd gedeelte ergens van,related
wit,noun,II.12/|\Wittebrood.,witbrood; wit brood,exact
algemeen,adjective,"I.1.a/|\In betrekking tot het aantal personen, die aan iets deel hebben; t.w. aan eene handeling, ervaring, gewaarwording, gezindheid, hoedanigheid, toestand enz. Het tegenovergestelde van bijzonder.","van, bij of voor alle mensen, hetzij alle mensen zonder uitzondering, hetzij alle of de meeste personen binnen een bepaalde groep",exact
algemeen,adjective,"I.1.a.α.1°/|\Van handelingen, gewoonten enz. In veelvuldig gebruik zijn; bij de meesten in zwang of aan de meesten eigen zijn.",overal en/of veel voorkomend; wijdverspreid; wijdverbreid,exact
algemeen,adjective,"I.1.c/|\In betrekking tot den aard of het karakter van iets; t.w. van beschouwingen, gezegden, bedoelingen, begrippen, onderwerpen waarover men spreekt of schrijft, enz. Het geheel der zaak betreffende of daarover handelende, zich over alles uitstrekkende, zonder de bijzonderheden in aanmerking te nemen. Het tegenovergestelde zoowel van bijzonder als van bepaald.","het geheel beschouwend, zonder in bijzonderheden te treden; niet op details ingaand; niet specifiek omschreven; (nog) niet gespecificeerd, gespecialiseerd of geconcretiseerd; globaal",exact
algemeen,adjective,"II.1.a/|\Verg. bnw., 1, a). In zulk een ruimen kring, dat alle — of althans de meeste — personen er deel aan hebben; met deelneming van, door of bij allen, met eenparigheid.","van, bij of voor alle mensen, hetzij alle mensen zonder uitzondering, hetzij alle of de meeste personen binnen een bepaalde groep",exact
algemeen,adjective,"II.1.b/|\Verg. bnw., 1, b). In toepassing op alle voorkomende omstandigheden of gelegenheden, in alle gevallen.",voor alle specifieke gevallen geldig,exact
algemeen,adjective,"9)/|\Van zaken in den zin van: zeer veel voorkomend, niets bijzonders zijnd.",overal en/of veel voorkomend; wijdverspreid; wijdverbreid,exact
algemeen,noun,"1/|\Het geheel van eene zaak, waarover men spreekt of schrijft; het begrip van alles wat er toe behoort, in zijn ganschen omvang beschouwd, zonder de bijzonderheden in aanmerking te nemen. Verg. ALGEMEEN, bnw., 1, c). Alleen in de zegswijzen:",het geheel of de meeste gevallen samen,exact
algemeen,noun,"2/|\Collectieve benaming van alle menschen gezamenlijk, hetzij — in volstrekten zin — van het geheele menschelijk geslacht, hetzij — in betrekkelijke opvatting — van alle leden van een staat, gewest of gemeente; beschouwd, niet als eene eenheid, maar als de som van al de bijzondere personen, en in betrekking gedacht tot hunne behoeften en belangen, meeningen en inzichten, enz. Verg. ALGEMEEN, bnw., 1, a, α).",alle mensen samen; de maatschappij,exact
vlinderen,verb,"1/|\Zich bewegen of verplaatsen op de wijze van een vlinder, fladderen. Alleen in litt. taal.",zich bewegen of verplaatsen op de wijze van een vlinder; fladderen,exact
vlinderen,verb,"1.b/|\Oneig., met betr. tot de wijze waarop men zich in het leven, in de maatschappij of bij geestelijke bezigheden beweegt: ongestadig of luchtig van het een tot het ander overgaan, (rond)dartelen.","als een vlinder nergens lang bij blijven, maar ongestadig of luchtig van het een tot het ander overgaan; dartelen",exact
vlinderen,verb,3/|\Den vlinderslag gebruiken bij het zwemmen.,zwemmen met de vlinderslag,exact
beitel,noun,"1/|\Eigenlijk. Gereedschap om hout, ijzer of steen te klooven; in het eerste geval voorzien van een houten handvat, en dienende hetzij om te steken of om te schaven.","gereedschap dat bestaat uit een meestal stalen blad met een scherpe, wigvormige snede, en een handvat, en dat gebruikt wordt om door steken, hakken of schaven hout, steen, metaal of een ander hard materiaal te bewerken; ook zonder handvat als onderdeel van een machine",exact
pakhuis,noun,1/|\Eigenlijk.,gebouw waar handelswaren worden opgeslagen; opslagplaats voor koopwaar,exact
kunstenaar,noun,"2/|\Iemand die bekwaamheid bezit in eenig opzicht, of die eene kunst, een bepaalde manier van doen verstaat (zie KUNST, 2) en 3); dus vaak zooveel als: iemand die kennis van zaken heeft, een deskundige. Weinig of niet meer in gebruik.",iemand die zeer kundig is in iets,exact
kunstenaar,noun,"5/|\Iemand die het vermogen bezit om kunstwerken te scheppen, iemand die met goed gevolg een der schoone kunsten beoefent, een artiest. Thans de gewone beteekenis.","iemand die kunst maakt, voor zijn beroep of uit liefhebberij",exact
historicus,noun,)/|\Geschiedkundige.,iemand die doorgaans geschiedenis gestudeerd heeft en voor zijn beroep geschiedkundig onderzoek verricht en daarover vaak ook boeken of artikelen schrijft; geschiedkundige; geschiedschrijver; ook: het beroep van historicus,exact
scherts,noun,"1/|\Het maken van grappen, grappige of speelsche beschouwing of opvatting, gekheid.","het gekscheren; goedbedoelde, speelse spot",exact
scherts,noun,"2/|\Grappig gezegde, grappige opmerking, aardigheid.","het gekscheren; goedbedoelde, speelse spot",related
taxi,noun,"1)/|\Verkorting van taxiauto of een derg. samenst., dat zelf een korte wijze van uitdrukking is voor *taximeterauto of iets derg. Huurrijtuig — gewoonlijk huurauto —, van een taximeter voorzien.",motorvoertuig waarmee passagiers zich naar de gewenste bestemming laten brengen tegen betaling van een ritprijs die doorgaans afhankelijk van de afgelegde afstand op een meter wordt aangegeven; huurvoertuig met chauffeur,exact
saillant,adjective,"2/|\(Fig.) In het oog springend, opvallend.","in het oog springend door zijn bijzondere aard, door een hoge graad van zekere hoedanigheid, door zijn prominente positie, als duidelijke, onbetwistbare uiting enz.; opvallend; de aandacht trekkend; opmerkelijk; treffend; markant",exact
vorsen,verb,"1/|\Met den geest, het geestesoog probeeren te achterhalen of te weten te komen wat in een voorz.-bep. ingeleid door naar aangegeven wordt of wat in den context geïmpliceerd is; met den geest, het geestesoog onderzoek doen, speuren, zoeken (naar iets).","onderzoek doen, voornamelijk met de geest wetenschappelijk onderzoek doen",exact
onderzoek,noun,"1)/|\De stam van Onderzoeken. Eigenlijk: de handeling van te onderzoeken, het aanwenden van pogingen om zich van iets te vergewissen, en ook, met betrekking tot één bepaald onderwerp, in den zin van: de gezamenlijke nasporingen dat onderwerp betreffende.","handeling van het onderzoeken, door een medicus of een paramedicus uitgevoerd, met de bedoeling om tot het in kaart brengen en behandelen van een bepaalde medische aandoening te komen, vaak in een ziekenhuis of dokterspraktijk of andere gezondheidspraktijk uitgevoerd",exact
onderzoek,noun,"—/|\In toepassing op gerechtelijke nasporingen, van welken aard ook.",nasporing ingesteld door justitie of door de politie,exact
dorst,noun,1/|\De lichamelijke behoefte aan drinken.,gevoel van behoefte aan drinken,exact
dorst,noun,1/|\De lichamelijke behoefte aan drinken.,behoefte aan water,broader
dorst,noun,3/|\In verschillende toepassingen op sterke begeerten.,hevig verlangen; onverzadigbare begeerte,exact
bos,noun,"4/|\Bij uitbreiding, in 't algemeen. Een zeker aantal voorwerpen, van welke soort ook, tot een meest onregelmatig langwerpigen bundel bijeengebonden.","bundel van gelijksoortige, dunne, langwerpige voorwerpen",exact
bos,noun,"1/|\Eigenlijk. — a In 't algemeen. Eene vrij groote uitgestrektheid gronds, met opgaande boomen begroeid (veelal min of meer kunstmatig onderhouden of ook aangelegd en met wegen doorsneden). In de hedendaagsche taal onderscheiden zoowel van struikgewas en kreupelhout (heesters en lagere boomen als berken, elzen en hazelaars) als van woud, dat thans alleen in de hoogere schrijftaal gebruikt wordt, als benaming van zeer groote, meestal in den vreemde gelegen streken, vanouds en van nature dicht met hooge boomen begroeid en in ongerepten staat gebleven, waaraan dus het bijdenkbeeld van woestheid eigen is.","terrein van een zekere uitgestrektheid dat dicht begroeid is met bomen; ook: de begroeiing, het geboomte daarvan en dan vaak zonder lidwoord",exact
mangrove,noun,"1/|\Wortelboom. Zie verder Dl. XXVI, 2319.","boom of struik die in de tropen en subtropen in ondiep water aan de kust, in rivierdelta's e.d. voorkomt, zich kenmerkt door zijn vele ademwortels of luchtwortels en waarvan de voornaamste soorten tot de familie van de Rhizophoraceae behoren; wortelboom",exact
mangrove,noun,"2/|\(Sub)tropisch boschtype, gekenmerkt door een vegetatie die bestaat uit boomen met luchtwortels; vaak als vloedbosch aangetroffen op beschutte, slibrijke plaatsen.","type bos in de tropen en subtropen dat zich bevindt langs een lage kust of bij een rivierdelta, bij vloed onderloopt, beschut en slibrijk is, een zoute bodem heeft en zich kenmerkt door een vegetatie die bestaat uit bomen en struiken met ademwortels of luchtwortels",exact
kruid,noun,1/|\Benaming voor planten met niet-houtigen stengel.,plant met een niet-houtachtige stengel; kruidachtige plant,exact
kruid,noun,"1.d/|\Als collectief in den zin van: de gezamenlijke kruiden, al wat er (in 't algemeen, of b.v. in zekere streek) aan kruidachtige planten is. Soms zelfs min of meer als stofnaam voor een deel daarvan.",al wat er aan kruidachtige planten ergens groeit,exact
kruid,noun,6/|\Tal van kruiden (in de bet. 1) worden voor geneeskundige doeleinden gebezigd.,geneeskrachtige of heilzame plant; ook: geneesmiddel dat gemaakt is van geneeskrachtige of heilzame planten,exact
kruid,noun,"7/|\Het gebruik van verschillende geurige of prikkelende kruiden bij de bereiding van spijzen enz. (verg. boven bij 4), heeft het woord de bet. verschaft van: specerij, kruiderij. Uiteraard wordt kruid in dezen zin gewoonlijk als collectief of stofnaam gebruikt; het mv. geeft in den regel te kennen dat er van verschillende soorten sprake is. Verg. VERDAM 3, 2187 volg. Nog thans wel hier en daar in deze bet. gebruikelijk, inzonderheid voor de kruiderijen die bij de slacht te pas komen.",plant of plantendeel dat bij het bereiden van voedsel gebruikt wordt om een speciale smaak of geur aan het gerecht te geven; specerij; keukenkruid,exact
klonteren,verb,"1/|\Van vloeistoffen, weeke stoffen, of kleine deeltjes eener vaste stof. Een of meer klonters vormen, tot een klonter of klonters worden.",tot een klont worden door stolling; stollen,exact
klonteren,verb,"1/|\Van vloeistoffen, weeke stoffen, of kleine deeltjes eener vaste stof. Een of meer klonters vormen, tot een klonter of klonters worden.",aan elkaar gaan kleven door het stollen van een tussengelegen vloeistof of brij,exact
klonteren,verb,"1/|\Van vloeistoffen, weeke stoffen, of kleine deeltjes eener vaste stof. Een of meer klonters vormen, tot een klonter of klonters worden.",zich samenvoegen of zich aan elkaar hechten als door klontering,exact
klonteren,verb,"1/|\Van vloeistoffen, weeke stoffen, of kleine deeltjes eener vaste stof. Een of meer klonters vormen, tot een klonter of klonters worden.",klonten vormen door onvoldoende menging of door stolling,exact
mes,noun,"1/|\In 't algemeen. Een werktuig om te snijden, gewoonlijk van staal of ijzer, soms van been, met of zonder punt, aan een of aan twee kanten geslepen, bevestigd aan een heft.",voorwerp dat bestaat uit een heft en een lemmet dat aan één of twee zijdes scherp is en dat vooral gebruikt wordt om mee te snijden of te steken,exact
mes,noun,"2/|\Genoemd als een voorwerp dat men tot allerlei gebruik bij zich draagt (verg. ook onder 5); thans in beperkter toepassing dan vroeger, toen men b.v. geene tafelmessen had, maar bij het eten een mes gebruikte dat men bij zich droeg.",voorwerp dat bestaat uit een heft en een lemmet dat aan één of twee zijdes scherp is en dat vooral gebruikt wordt om voedsel mee te snijden en op de vork te schuiven; stuk eetgerei,exact
mes,noun,"5/|\Gebruikt als een voorwerp om iemand mede te dooden, te wonden.",specifiek als wapen,exact
koopman,noun,"1/|\Iemand die koopt en verkoopt en daarvan zijn beroep maakt, die den handel als beroep uitoefent. In de algemeene taal het gewone gebruik; zie voor een speciaal wettelijke en juridische opvatting de bet. 2).","man die voor zijn beroep goederen aankoopt om ze met winst door te verkopen, vaak op grote schaal door import, export of andere vormen van groothandel; handelaar",exact
koopman,noun,"1.c/|\In toepassing op en als aanspreekbenaming voor iemand die, met name ten plattenlande, met koopwaar van huis tot huis gaat, veelal hetzelfde als: (mars)kramer, of als: straatventer, leurder.","man die voor zijn beroep als rondtrekkend handelaar waren aan particulieren te koop aanbiedt op openbare markten, langs de openbare weg of in de huis-aan-huisverkoop; marktkoopman; venter",exact
kruidenier,noun,"2/|\Iemand die kruiden of specerijen en aanverwante artikelen verkoopt, oorspronkelijk zoowel voor geneeskundig als voor keukengebruik, zoodat ook de apothekers onder de kruideniers gerekend konden worden; vaak dan ook zooveel als: drogist. Deze bet. is in het Mnl. de gewone. Vervolgens zijn de kruideniers ook allerlei koloniale waren en waren voor huishoudelijk gebruik gaan verkoopen, terwijl daarentegen de handel in geneesmiddelen op den duur van hun vak is afgescheiden. Naar de tegenwoordige opvatting is een kruidenier iemand die in 't klein specerijen, koloniale waren en dergelijke keukenbehoeften, alsmede grutterswaren verkoopt; want ook de kleinhandel in grutterswaren, vroeger gewoonlijk door afzonderlijke grutters uitgeoefend, gaat meer en meer in handen van de kruideniers over.","iemand die voor zijn beroep een winkel uitbaat waar kruidenierswaren zoals suiker, koffie, rijst, zeep, tandpasta, sigaretten, kruiden en specerijen, worden verkocht; uitbater van een kruidenierswinkel",exact
pak,noun,A/|\Iets dat bijeengepakt of ingepakt is.,"iets wat ingepakt of bijeengepakt is en zo een geheel vormt, en dat vaak bestaat uit gelijksoortige zaken, maar soms ook uit ongelijksoortige zaken en soms ook uit een enkel exemplaar ergens van; enige gelijke of verschillende voorwerpen die bij elkaar gebonden, in elkaar gerold of met iets omwonden zijn, zodat zij een geheel vormen; in een geheel ingepakte of verpakte voorwerpen",exact
pak,noun,"A.1/|\Een of meerdere zaken, van gelijken of verschillenden aard, die bij elkaar gebonden, opgerold of met iets omwikkeld zijn, zoodat zij een geheel vormen; bundel.","samenhangend of bijeengevoegd geheel van meestal concrete, gelijksoortige stoffen, zoals stro of sneeuw, of voorwerpen, bijvoorbeeld papieren, kaarten of stenen, zonder dat die verpakt, ingepakt of omwonden zijn; hoeveelheid gelijksoortige voorwerpen bij elkaar",exact
pak,noun,"A.1.b/|\Inzonderheid in toepassing op zaken die ter verzending gereed gemaakt zijn, en daartoe in papier, doek enz. werden gepakt, om tegen nat en vuil beveiligd te zijn.","verpakking van iets, meestal van een bepaald product, bijvoorbeeld koffie, melk of suiker, in een afgepaste hoeveelheid, vaak gemaakt van karton",narrower
pak,noun,A.2/|\Een pak wordt dikwils aan mensch of dier als een last opgelegd.,zaak die op een persoon of zaak is geladen is om gedragen of vervoerd te worden en die meestal zwaar is; last,exact
pak,noun,"A.4/|\Een bijeengevoegd geheel, zonder dat er van eigenlijk inpakken sprake is.",grote hoeveelheid; flinke hoeveelheid; stel,exact
pak,noun,"A.5.c/|\In toepassing op een stel kleederen; oorspronkelijk: de bijeengepakte kleedingstukken die men op reis, als bagage, medeneemt, en vandaar: een geheel stel bovenkleederen, b.v. jas, vest en broek.","kleding die als een geheel gedragen wordt, meestal voor een bepaalde gelegenheid of activiteit of bij het vervullen van een bepaalde functie",exact
pak,noun,"A.5.c/|\In toepassing op een stel kleederen; oorspronkelijk: de bijeengepakte kleedingstukken die men op reis, als bagage, medeneemt, en vandaar: een geheel stel bovenkleederen, b.v. jas, vest en broek.","kostuum dat bij formele gelegenheden gedragen wordt, meestal door mannen, en dat vaak bestaat uit een broek en een bijbehorend jasje",related
wild,noun,1/|\(Exemplaar van) de in het wild levende dieren.,de in het wild levende dieren waarop al dan niet gejaagd wordt,exact
wild,noun,"3/|\(In aansl. bij de bet. 2) De gedoode dieren of het vleesch ervan, beschouwd als markt- en handelswaar, als (toebereid) voedsel e.d.; (een stuk) wildbraad. Soms ook in beperktere opvatting, t.w. met uitsl. van gevogelte. Zoo goed als steeds als coll. en stofnaam.",gedode wilde dieren bestemd om gegeten te worden; het vlees van wilde dieren,exact
wild,adjective,I.1/|\Van dieren: in tegenstelling met gedomesticeerde dieren nog levend in of deel uitmakend van de vrije natuur; in het wild levend; ongetemd; niet tam.,in tegenstelling met gedomesticeerde dieren nog levend in of deel uitmakend van de vrije natuur; in het wild levend; ongetemd; niet tam,exact
wild,adjective,"I.2/|\Van planten: in de vrije natuur voorkomend, in het wild groeiend; niet door den mensch geplant, geteeld of veredeld; niet gekweekt; niet tam. Vervolgens ook in toep. waarin de oppositie wild-tam een ander aspect betreft dan dat der groeiplaats, t.w. de vruchtbaarheid van de plant of de eetbaarheid der vruchten; zie hiervoor verder ook bij b).","in de vrije natuur voorkomend; in het wild groeiend; niet door de mens geplant, geteeld of veredeld; niet tam",exact
wild,adjective,"I.2.b.α/|\In toep. waarbij wild een gelijkenis met een niet-verwante tamme plant aangeeft, of een oppositie met een verwante tamme variant, waarbij de oppositie er dan in bestaat dat de genoemde wilde plant (van oorsprong) een niet-gekweekte variëteit is.",voortgebracht door wilde dieren of planten,exact
wild,adjective,"I.3/|\Van menschen: (nog) in den natuurstaat levend; van wie de levenswijze (nog) niet door civilisatie en cultuur (i.c. die van den spreker) gewijzigd of bepaald is; primitief, ongeciviliseerd, onbeschaafd, onontwikkeld (t.w. vanuit het standpunt van den spreker gezien). Dikwijls ook met ongunstige bijgedachte (zie bij a)). Inz. in attrib. gebr. en meestal in toep. op bewoners van verre, vrijwel onbekende en onontgonnen gebieden. De grens tusschen a en b) is niet steeds even duidelijk. Voor het zelfst. gebr. zie WILDE.","(nog) in de natuurstaat levend; van wie de levenswijze (nog) niet door civilisatie en cultuur (i.c. die van de spreker) gewijzigd of bepaald is; primitief, ongeciviliseerd, onontwikkeld (t.w. vanuit het standpunt van de spreker gezien)",exact
wild,adjective,"I.4/|\Van bep. gebieden, streken, stukken grond e.d., of van de natuur ervan: (nog) niet door den invloed van den mensch gewijzigd of gekenmerkt; (nog) in den oorspronkelijken, natuurlijken staat verkeerend.","(nog) niet door de invloed van de mens gewijzigd of gekenmerkt; (nog) in de oorspronkelijke, natuurlijke staat verkerend; ongerept",exact
wild,adjective,"II.10/|\In toep. waarbij het hoofdaccent gelegd wordt op het afwezig zijn van bep. reguleerende, bindende of ordenende elementen: zonder specifieke regels of ordening; ongeregeld, op ongeregelde wijze, regelloos; niet door eenige reguleering geleid of bepaald; niet aan eenige vaste ordening of organisatie onderworpen; soms ook: ongecontroleerd, op ongecontroleerde wijze. Vaak in toep. waarbij het ontbreken van regels, afspraken e.d. in tegenstelling is met wat vereischt is of verwacht zou mogen worden. Voor toep. op sociaal-maatschappelijk of moreel-ethisch vlak, zie men ook nog de bet. 15).",niet beregeld; buiten de officiële kanalen om; zonder specifieke regels of ordening,exact
wild,adjective,"II.12/|\(In aansl. bij de vorige bet.) Van zaken die zich ergens op organische wijze vormen of gevormd hebben: zich op zoodanige plaats of wijze ontwikkelend of ontwikkeld hebbend, dat niet beantwoord wordt aan de regels of eischen van het systeem waarin het door wild gekarakteriseerde te situeeren is; inz.: niet thuishoorend op de plaats waar het genoemde zich bevindt; groeiend, gevormd op een plaats waar het genoemde niet hoort of verwacht wordt. In de aanh. in eenige specifieke verbindingen.","niet thuishorend op de plaats waar het genoemde zich bevindt; groeiend, gevormd op een plaats waar het genoemde niet hoort of verwacht wordt",exact
wild,adjective,"II.14/|\In aansl. bij de vorige bet., van pers. (meton. ook van zaken, zie a, β)), in toep. waarbij inz. het ontbreken van de mogelijkheid tot zelfcontrôle of -beheersching aangegeven wordt. Eig.: niet meer in staat tot gewoon denken of handelen; buiten zichzelf; (als) gek, (als) dol.","niet kalm en al dan niet heftig bewegend of gepaard gaand met heftige bewegingen, zowel in negatieve als in positieve zin; onbeheerst, onbezonnen of uitbundig van karakter of in een momentane handeling; onbeteugeld; ongecontroleerd; onstuimig; hartstochtelijk; ook sterker: buiten zichzelf; dol; woest; ruw",exact
