lemma,pos,sense_source,sense_target,semantic_relationship
раст,noun,"увећавање износа, количине нечега, пораст:",процес повећавања,narrower
раставити,verb,"уопште раздвојити на саставне делове, разграничити делове целине; разлучити",поделити или повезати цртицом,related
раставити,verb,"раширити, размаћи",Раздвојити што је састављено.,related
раставити,verb,"растати се, одвојити се.","учинити дисјунктним, одвојеним или неповезаним",related
раставити,verb,развести се (о мужу и жени).,Раздвојити што је састављено.,related
расти,verb,"постајати већи, виши, напредовати, развијати се (о младим људским бићима и животињама).","Повећавати величину природним процесом; о жвој твари, као што су биљке и животиње.",exact
расти,verb,"изграђивати се, сазревати.",Имати корене у нечему.,related
растурити,verb,"упропастити; уништити, разорити.",Уништити потпуно.,exact
растурити,verb,"расути, разбацати",Разместити на раштркан начин.,broader
растворити,verb,"раширити, раскрилити, отворити, расклопити; раскопчати.",Променити из склопљеног или скупљеног стања у отворено.,narrower
растворити,verb,помешати са другом материјом (обично течношћу) правећи раствор.,узроковати да се нешто претвори у отопину,exact
растворити,verb,"помешати се с другом материјом (обично течношћу) чинећи раствор, отопити се.",узроковати да се нешто претвори у отопину,exact
расути,verb,"разбацити на све стране, распршити, расејати.",Разместити на раштркан начин.,related
расути,verb,нештедице утрошити на разне ствари.,Трошити неопрезно и лакомислено.,exact
разбибрига,noun,"забава, увесељавање.",активност која пријатно заокупља нечије слободно време,exact
разбибрига,noun,"оно што служи за разоноду, забаву, што пружа задовољство.",Забава која изазива пријатна интересовања и одвлачи пажњу од брига и непријатности.,exact
разбистрити,verb,"учинити бистрим, прозирним; учинити сјајним, испунити сјајем, живошћу.","Учинити јасним, светлим, прозрачним.",exact
разбистрити,verb,"објаснити, разјаснити, рашчистити.",Ослободити конфузије или двосмислености; учинити јасним.,exact
разбистрити,verb,"ослободити се смркнутости, намргођености, постати ведрији",Ослободити конфузије или двосмислености; учинити јасним.,narrower
раздвојити,verb,"раставити на делове, у групе, поделити; прецепити, предвојити.",Учинити да се нешто одвоји или растави,related
раздвојити,verb,"усмерити на разне стране, размаћи.",Раздвојити што је састављено.,related
раздвојити,verb,"поделити се на делове, на групе, подвојити се; упутити се различитим правцима, растати се.",Учинити да се нешто одвоји или растави,related
разговарати,verb,"обраћати се речима (један другоме), говорити, причати; расправљати о нечем, саветовати се, договарати се.","Размењивати мисли, причати са неким.",broader
разговарати,verb,разговарати (1).,"Размењивати мисли, причати са неким.",narrower
разговор,noun,"међусобни говор, причање двају или више лица; усмена размена мишљења, расправљање.",Говор који се користи за неформалну размену погледа.,related
разместити,verb,"поставити на разна места, распоредити.",променити редослед или позиције нечега,exact
разместити,verb,"сместити се на разна места, распоредити се.",Поставити војску или оружје у борбену формацију.,related
разред,noun,ученици који прате такав програм (уопште или они који наставу слушају заједно).,Тело ученика које заједно подучавају.,exact
разред,noun,"уопште категорија у некој подели, разликовању напоредних, равноправних појмова, врста уопште.",Колекција ствари које деле исте атрибуте.,exact
разред,noun,"у зоолошкој и ботаничкој класификацији систематска категорија у оквиру кола, типа живих бића, која се даље дели на редове, класа:",Таксономска група која се састоји од једног или више редова.,exact
разумети,verb,"схватити, схватати смисао, значење",Знати и разумети природу или значење некога или нечега.,exact
разумети,verb,"моћи пратити, поимати нечији језик, говор:",Схватати неки језик.,exact
разумети,verb,"познавати што, разабирати се, бити вешт у чему",Знати и разумети природу или значење некога или нечега.,related
разумети,verb,"схватити, схватати један другог; ускладити или имати усклађене односе с неким.",Схватати неки језик.,broader
развити,verb,"ослободити везе, омота и сл., размотати завијено, одмотати, одвити:",Поравнати или раширити ваљком.,related
развити,verb,"покренути, ангажовати; постићи:",Припремати за будући задатак или каријеру.,related
развити,verb,распоредити за борбу:,Поставити војску или оружје у борбену формацију.,exact
реакција,noun,"деловање једних материја, твари на друге или деловање физичких утицаја (топлоте, електричне струје, светлости и сл.) при чему настају нове материје.",процес у коме једна или више супстанци делују једне на друге стварајући нову супстанцу,exact
реакција,noun,"деловање, активност неког живог организма или његова органа изазвана спољним или унутарњим органским утицајем на организам",Телесна реакција до које долази услед неког стимуланса или агенса.,exact
реакција,noun,психо-физиолошки одговор на неки спољни или унутрашњи надражај.,поступање против неког другог начина рада који се вама не свиђа,related
ребро,noun,"једна од дванаест пари танких и извијених костију, везаних на једној страни за кичму, а на другој, непосредно и посредно, за грудну кост, те с тим својим ослонцима чине грудни кош:","Дугачке, витке, закривљене кости које чине ребарни кош. Код већине животиња ребра окружују торакс притом штитећи плућа, срце и  органе прсног коша. Човек има 12 пари ребара (односно 24 ребра). Првих је седам хрскавично повезано са стернумом.",exact
ребро,noun,један од дебљих огранака продужене лисне дршке биљака:,ребролики део који подупире или ојачава животињу или биљку,narrower
ребро,noun,"оно што је налик на ребро (1) (део неке направе, машине, одсечени део меса и сл.).","део биљке или животиње који наликује на ребро (као главна жила код листа, или очврсла вена у крилу инсекта)",narrower
речник,noun,"књига у којој су речи једног језика изложене азбучним (абецедним) редом, с тумачењима њихових значења или с преводом на страни језик; додатак уз књигу где су азбучним (абецедним) редом побележене и протумачене стране или покрајинске речи и изрази:",приручник који садржи речи (у алфабетском поретку) са њиховим значењима,exact
речник,noun,"језичка изражајна средства, речи, лексика (једног писца, личности, средине и сл.):",усвојене речи неког говорника језика,exact
редак,adjective,који се јавља у већим временским размацима;,онај који није широко заступљен,related
редак,adjective,"кога или чега нема довољно, у коме или чему се оскудева.",онај чији се недостатак у погледу броја или количине у односу на потражњу осећа,exact
реквизит,noun,"део спортске опреме (дрес лопта, рекет итд.).",оруђе које се користи у спорту.,exact
репродукција,noun,"стварање потомства, множење, размножавање, расплођавање.",Процес стварања потомака.,exact
реса,noun,"дугуљаста, обично висећа цваст неких биљака (слична класу), маца","Дугуљаста, обично висећа цваст неких биљака.",exact
реса,noun,доњи део човечјег уха,део спољашњег ува,exact
решити,verb,"одредити исход нечега, пресудити, окончати.",Довести до краја.,exact
решити,verb,"дати правилан одговор, одгонетнути:",наћи решење за нешто (проблем или питање),exact
решити,verb,"рашчистити, расправити.",Средити или исправити; о тешкоћама или проблемима,related
решити,verb,"ослободити се, отарасити се:",Довести до краја.,exact
ревизија,noun,"преглед рада, контрола, проверавање стања у предузећима, установама, организацијама.",чин измене који укључује суштинске промене,narrower
ревизија,noun,"измена, преинака, преправка, преиспитивање (закона, неких погледа, учења и сл.).",чин прерађивања нечега,narrower
ревизија,noun,"обнова, поновно разматрање (о судском процесу).",нешто сто је написано поново,narrower
револуција,noun,"коренита, темељна промена, преврат у друштвено-економским односима, брзи преображај једне преживеле друштвено-економске формације у другу (обично напреднију) насилним путем:",Свргавање владе од стране поданика.,broader
револуција,noun,"коренит преображај, преокрет у некој области живота и рада (схватању, психи, култури итд.).",драматичне и далекосежне промене у начину размишлаxања и понашања,broader
резултирати,verb,"наста(ја)ти као резултат, последица нечега, произићи, произлазити, проистећи, проистицати.",Завршити на одређени начин или у одређеном стању.,related
резултирати,verb,"бити узрок нечему, условити, условљавати нешто, довести, доводити до нечега.",Учинити могућим.,related
риба,noun,животиња из разреда риба;,"Било која од разноврсних, углавном хладнокрвних водених кичмењака, који имају крљушти и дишу на шкрге.",exact
риба,noun,рибље месо; јело од рибе.,месо рибе које се користи у исхрани,exact
римски,adjective,који се односи на Рим и Римљане:,који се односи на древни Рим и његове људе,broader
римски,adjective,римокатолички:,који се тиче Рима и његових људи,related
родити,verb,"донети на свет (дете), породити се (о жени).",Донети на свет новорођенче.,exact
родити,verb,"изазвати појаву, настајање, постојање (нечега), створити, произвести, изградити.","створити уметничке предмете, као музику, слике, поезију, плес итд.",broader
рука,noun,"један од горњих удова човечјег тела, екстремитета од рамена до врхова прстију.",Човеков горњи уд који почиње од рамена.,exact
рука,noun,"крајњи део тога екстремитета, од зглоба или шаке до врхова прстију.",Екстремитет горњих удова.,narrower
рукопис,noun,начин писања слова руком с карактеристичним особинама,Активност писања руком.,related
рукопис,noun,"оно што је написано руком или писаћом машином, обично ради штампања, објављивања, текст писан руком или писаћом машином.",Материјал који треба да се штампа; искључиво графички материјал.,exact
сабрати,verb,"сабрати, покупити са земље плодове.",Прикупити заједно.,narrower
сабрати,verb,"скупити уједно додајући један износ другоме, збројити",Извршити операцију сабирања.,exact
сачувати,verb,"пазећи, мотрећи, старајући се очувати до извесног времена, до краја, обезбедити, осигурати",Сачувати или резервисати за личну или специјалну употребу.,related
садржај,noun,"суштина, бит, језгро нечега.",Оно о чему се неко саопштење ради.,related
садржај,noun,"оно што се излаже, описује где; главна мисао, кратак извод неког књижевног или научног дела:",Нешто (особа или предмет или призор) што уметник или фотограф изабере да графички представи.,related
сагласност,noun,"особина, стање онога што је сагласно с чим, склад, подударност.","Склад људских мишљења, поступака или карактера.",exact
сагласност,noun,"пристанак, одобрење.",Слагање са изјавом или предлогом да се нешто ради.,exact
салата,noun,"назив за више биљних подврста из пор. главочика које се, пресне и зачињене уљем, сирћетом и сољу, једу уз нека јела:",Нека од многих биљака из рода Лацтуца.,broader
салата,noun,"јело, кувано или пресно припремљено на сличан начин:",Мешана храна било сложена на тањиру или промешана и послужена са преливом; обично се састоји од зелениша или га садржи.,exact
састав,noun,"грађа, материја од које је нешто начињено или настало.",Конструисани објекат; комплексна конструкција или ентитет.,broader
састав,noun,"склоп, целина.",поредак делова у односу један према другом,narrower
састав,noun,"спој, додир двају предмета, место где се спајају два предмета.",Облик или начин на који се ствари приближавају и успоставља се веза.,related
састав,noun,"писмени рад, спис, чланак.",Стваралачко или креативно писање.,exact
саставити,verb,"сјединити, ставити једно уз друго, спојити нешто што је одељено",Стиснути једно уз друго.,exact
саставити,verb,начинити нешто од појединих делова.,направити састављањем из делова,exact
саставити,verb,начинити што написмено.,написати правни документ,broader
саставити,verb,састати се.,скупити заједно од постојећих ствари,related
савет,noun,"мишљење, препорука шта и како треба радити или како поступити у одређеном случају.",Упутство или савет по питању одлуке или тока радње,broader
савет,noun,скуп лица која о нечему већају,Тело које служи у административном својству.,related
савијача,noun,"пита од савијених листова теста, гужвара, гибаница.","танко, филовано тесто које је уролано и печено",exact
савити,verb,"учинити кривим, искривити, згрбити.",Обликовати кривину.,exact
савити,verb,"скврчити, згрчити.",Не изврћи колено кад радиш ову вежбу,related
савити,verb,"заокренувши поћи, скренути.",простирати се у кривинама и завојима,related
савити,verb,"спустити се, сићи.",простирати се у кривинама и завојима,related
сценариј,noun,књижевни текст с елементима драмске радње на основу кога се гради филм.,писана верзија позоришног комада или другог драмског састава; користи се за припрему за извођење,related
сценариј,noun,"план извођења позоришног комада, опис драмске радње.",нацрт или синопсис комада (или другог кxижевног дела),exact
сфера,noun,"простор који се налази у границама деловања или утицаја чега, круг деловања, област, подручје какве активности.",предмет проучавања,related
сфера,noun,"друштвена средина, круг особа везаних међу собом заједничким положајем, интересима, занимањем и сл.",Одређено окружење у животу.,exact
сигурност,noun,"стање, особина онога који је сигуран, онога што је сигурно, у коме некоме или нечему не прети опасност, одсутност опасности, безбедност:",Стање у коме је неко сигуран да неки узрок неће изазвати штетне ефекте под дефинисаним условима.,exact
сигурност,noun,поуздање.,"Стање у коме је неко сигуран, уверен у нешто.",exact
сијати,verb,"испуштати, одавати из себе светло, одашиљати зраке, светлети (о светлосним изворима и осветљеним телима).","Светлети сјајно, као звезда или светло.",exact
сијати,verb,"одликовати се каквом особином, врлином",Бити истакнут или уважен.,related
сила,noun,"узрок промене стања једне материје, оно што покреће материју из стања мировања у кретање или што мења величину и смер кретања материје",У физици дејство које производи промену у физичкој величини.,related
сила,noun,"војска, војне јединице (често с атрибутом: оружана).",јединица која је део неког рода војске,exact
сила,noun,телесна или физичка снага човека и животиње; способност за рад,Физичка снага.,exact
сила,noun,"енергија као покретач механичког кретања, снага:",Чин примене силе да нешто погони.,related
сила,noun,"снага, ауторитет, способност, моћ деловања на кога.","Неко ко поседује или примењује силу, утицај или ауторитет.",exact
систем,noun,"утврђен ред, поредак основан на планском распореду и међусобној повезаности делова неке целине",Група независних али међусобно повезаних елемената који чине јединствену целину.,exact
систем,noun,"скуп принципа, метода, начина у примени, остваривању чега.",Укупност метода или правила који управљају понашањем.,related
систем,noun,"скуп каквих елемената, јединица здружених према заједничким карактеристикама",Организована структура за уређивање и класификовање.,related
склонити,verb,"померити, макнути, одстранити","Уклонити нешто конкретно, нпр. дизањем, гурањем, уклањањем, или уклонити нешто апстрактно.",exact
