lemma,pos,sense_source,sense_target,semantic_relationship
средство,noun,"лекови, медицински препарати и уопште предмети потребни за лечење.",Супстанца која изазива неки ефекат или врши неки утицај.,narrower
стајати,verb,"чувати се у неизмењеном стању, остајати на своме месту.",Не кварити се нити трулити.,exact
стајати,verb,"бити у усправном, непомичном положају, бити на ногама (о човеку, животињи).",Бити у усправном положају.,exact
стајати,verb,"пристајати, приличити, одговарати спољашности (лицу, стасу), доликовати.",Бити праве величине или облика; пристајати исправно или у складу са жељама.,exact
стакло,noun,"хомогена, хемијски постојана материја, потпуно или у некој мери прозиран, тврд, крт производ, начињен расхлађивањем растопине кварцног песка и неких додатака, који се употребљава за израду прозора, посуђа и многих других предмета:",Ломљиво прозирно тело са неправилном атомском структуром.,related
стакло,noun,"стаклен суд, боца","Стаклена или пластична посуда, цилиндричног облика са уским вратом и без дршке.",narrower
стан,noun,једна или више соба с нуспросторијама за становање.,скуп просторија обично на једном спрату стамбене куће,exact
стан,noun,"(стално) боравиште, опстанак",Чин становања на једном месту.,related
стање,noun,"опште прилике, околности, положај у којем се неко или нешто налази.",Начин на који нешто постоји у односу на своје главне атрибуте.,related
стање,noun,"облик, појава у којима се ко или што налази, јавља.",Стање у неком одређеном тренутку.,related
становати,verb,бити у стану код некога или у истој кући с неким.,Бити станар; привремено боравити.,exact
становати,verb,"имати стан, живети, налазити се у неком месту, крају, земљи.",Начинити од места свој дом.,related
став,noun,положај тела.,Позиција или устројство тела и његових удова.,exact
став,noun,"изглед, држање својствено каквом расположењу.","Сложено психичко стање које укључује веровања, осећања, вредности и склоности да се поступа на одређени начин.",exact
став,noun,"одељак неког текста (који се обично почиње новим редом), пасус, ставак, ставка.",један од неколико посебних одељака текста намењен да издвоји идеје; почеци су често обележени новим увученим ретком,related
став,noun,одељак музичког комада.,"заокружени одељак музичког комада, симфоније или сонате",exact
ставити,verb,"унети у склоп, садржај нечега; додати, унети писмено, написати:",Ставити или убацити у нешто.,narrower
ставити,verb,довести у нарочито стање:,Ставити улог.,related
стегнути,verb,"обухвативши, ухвативши нешто притиснути, стиснути.",Држати чврсто,exact
стегнути,verb,чврсто притиснути уз тело.,Доћи или бити у блиском контакту.,related
степен,noun,"јединица мере температуре (ваздуха, воде, тела).",Температурна јединица на спецификованој скали.,exact
степен,noun,"стање, стадиј(ум), фаза.","Специфична позиција која се може идентификовати у континууму, низу и посебно процесу.",related
степен,noun,"звање, ранг",Позиција у друђтвеној хијерархији.,exact
степен,noun,"стање, ниво.","Озбиљност нечега (нпр, злочин или опекотина).",exact
стил,noun,карактеристичан начин писменог и усменог изражавања,Стил којим се изражавате писмено.,broader
стил,noun,"скуп карактеристичних црта, обележја материјалне културе (у ликовној уметности, архитектури, у намештају, одевању и др.) једне епохе или једне нације",Одређена врста изгледа.,related
стил,noun,"карактеристична црта, обележје, облик рада, живота, игре, спорта итд.",начин рада или понашања,related
стиснути,verb,чврсто стегнути држећи у руци,Држати чврсто,exact
стиснути,verb,приљубивши једно уз друго притиснути.,Стиснути једно уз друго.,exact
стиснути,verb,"снажно, чврсто дохватити руком, зграбити, шчепати.",Чврсто стиснути међу прстима.,broader
стопа,noun,ноге у ужем смислу,отисак стопала или ципеле на површини,related
стопа,noun,"отисак ноге, стопала на каквој површини, траг.",отисак стопала или ципеле на површини,exact
страна,noun,"појединац или колектив који се бори за нешто (пред судом, у рату, у утакмици",Особа која је укључена у неки законски поступак.,exact
страна,noun,гранична линија неке површине или гранична површина нечега (рачунајући од средине).,Спољња површина неког објекта.,exact
страна,noun,једна од бочних површина,Површина која представља део спољашњости неког објекта.,exact
страна,noun,простор који се простире у неком правцу и сам такав правац.,место унутар зоне које се идентификује као релативно у односу на центар,related
страна,noun,"оно што чини карактеристику, битну особеност нечега, особина, својство, каквоћа, квалитет",Одређена карактеристика или елемент у проблему.,exact
странка,noun,"политичка организација с одређеним програмом о економским и друштвеним односима, партија (1а):",Организација чији је циљ прибављање политичке моћи.,exact
странка,noun,"појединац или колектив који се бори за нешто (пред судом, у рату, у утакмици), страна (10).",Особа која је укључена у неки законски поступак.,exact
струја,noun,"ток, кретање водене масе површинских (више или мање дубоких) слојева мора, океана у одређеном правцу:","стабилни ток, природно проузрокован",narrower
струја,noun,"ток, кретање електричне енергије у проводнику:",енергија коју ослобађа проток електричног набоја кроз проводник,exact
стрвинар,noun,"птица грабљивица, јаког, повијеног горњег дела кљуна, снажних и оштрих канџи, која се храни стрвином, суп беличасти",Мали најчешће бели лешинар Африке и јужне Европе.,broader
стрвинар,noun,стрвождерци.,Нека од разноврсних дневних птица грабљивица која има голу главу и слабе канђе а храни се углавном цркотинама.,broader
стуб,noun,"у грађевинарству дрвени, метални, камени или зидани окомити подупирач најчешће ваљкастог облика који преноси терет надграђен на чврсту подлогу.","У архитектури, високи ваљкасти објекат, вертикално постављен који подупире неку структуру.",exact
стуб,noun,"дугачка греда која, учвршћена у чему, стоји окомито, бандера (за електричне, телефонске водове, за вешање заставе и сл.), дирек.",Дрвени или метални потпорањ који је чврсто постављен у усправни положај.,exact
ствар,noun,"сваки предмет, производ било чега, било шта неживо што материјално или физички постоји.",Нека људска творевина.,broader
ствар,noun,"све што се ради или чини, све што се замишља или осећа (рад, поступак, дело, догађај, вест итд.).",Нека акција.,broader
ствар,noun,"стање, ситуација, околности, прилике, услови карактеристични за оно што се дешава.",Специјална ситуација.,exact
стваран,adjective,"који постоји, који је постојао у истини, истински, збиљски.","који постоји у стварности, узет из живота",exact
створити,verb,"учинити радом да нешто постане чега пре није било, израдити, произвести.",Учинити или изазвати да нешто постане.,exact
створити,verb,"произвести књижевно, уметничко, музичко дело.","створити уметничке предмете, као музику, слике, поезију, плес итд.",narrower
створити,verb,"у вези са неким категоријама именица које значе радњу или резултат радње значи: направити, извршити; извести, извући, донети; остварити; стећи и сл. ",понашати се на такав начин да се неко или нешто стекне,broader
створити,verb,"пронаћи, открити, измислити.",Замислити неки план или идеју и начин њиховог остварења.,related
створити,verb,"ненадано, неочекивано се појавити, искрснути.",Учинити или изазвати да нешто постане.,narrower
створити,verb,"претворити се, прометнути се у нешто друго, постати неко или нешто друго.",понашати се на такав начин да се неко или нешто стекне,related
сукоб,noun,"опречност, противуречност, размимоилажење супротних гледишта, надлежности, интереса, спор; препирка, свађа.",Борба међу ривалима.,related
сукоб,noun,"непријатељски, оружани судар, бој, битка, рат.",Чин којим се супротстављене групе конфронтирају.,narrower
супа,noun,"течно јело од искуваног меса и разне зелени, са зачинима;","Течна храна, посебно од меса или рибе или поврћа, која често садржи комаде чврсте хране.",exact
супа,noun,танки резанци који се стављају у такво јело.,ретка супа од меса или рибе или бујон од поврћа,related
суседство,noun,"близина с неким или нечим по месту становања, по месту седења или налажења",Регија у окружењу или у близини.,related
сузити,verb,"лучити сузе, влажити се сузама; проливати, ронити сузе од бола, жалости, невоље и сл., плакати.",напунити сузама или проливати сузе,exact
сузити,verb,"учинити уским или ужим, стеснити; смањити:",Умањити нешто по величини; смањити физички.,exact
сузити,verb,"свести на мању меру, ограничити (област делатности, власти).",Умањити нешто по величини; смањити физички.,exact
свеобухватан,adjective,"који обухвата све, који складно уклапа све делове у јединствену целину; који ништа не занемарује и не превиђа, усмерен у свим правцима, свестран.",који обухвата све,exact
свеобухватан,adjective,који прожима свакога; својствен свима,широког опсега,narrower
свеска,noun,"неколико табака писаће хартије повезаних уједно, вежбанка: ~",књига са празнима странама за прављење забелешки,exact
свеска,noun,поједини број часописа или књиге која излази у деловима; засебно повезан део књиге,Један из серије која се периодично издаје.,exact
свеска,noun,"појединачна књига, годиште часописа и сл. у каквој збирци или библиотеци, библиотечка јединица.",део штампаног рада,related
свет,noun,"свеукупност свих форми материје, свега што постоји; земаљска кугла са свим оним што на њој постоји:",Све што негде постоји.,exact
свет,noun,"целокупна стварност, све што постоји и материјално и духовно као објекат сазнања.",Нечије целокупно искуство које одређује како му ствари изгледају.,related
свет,noun,"људи, народ",Људи уопште.,exact
свет,noun,"група људи везаних нечим заједничким (истим занимањем, опредељењем и сл.).",Људи уопште; посебно истакнута група људи са неким заједничким интересом.,exact
светац,noun,онај кога је црква после његове смрти прогласила светим због његових заслуга за веру.,особа која је умрла и проглашена за свеца процесом канонизације,exact
светац,noun,"празник, благдан.",Дан када се слави неки светац.,exact
светло,noun,"видело, светлост; сјај.",визуелни ефекат осветљавања на предметима или сценама као што се приказује на сликама,broader
светло,noun,"светиљка, светлосни извор.",торањ са светиљком који упозорава пролазеће бродове на плићаке,broader
светлост,noun,"рачење које потиче из атома, има разне таласне дужине и видљиво је само у малом интервалу таласних дужина.",Електромагнетно зрачење које производи визуелни осећај (у физици).,exact
светлост,noun,сјајност; блесак.,визуелни ефекат осветљавања на предметима или сценама као што се приказује на сликама,broader
светлост,noun,осветљеност која омогућава да предмети буду видљиви.,"када има пуно светла, степен видљивости је велики",exact
свирати,verb,"производити тонове на неком музичком инструменту, бити вичан томе или се бавити тиме као занимањем",Изводити музику на музичком инструменту.,exact
свирати,verb,"изводити неки музички комад, мелодију или композицију.",Изводити музику на инструменту.,exact
свирати,verb,"пиштањем давати какав знак (пиштаљком, сиреном и сл.):",Правити велику буку.,related
тачка,noun,"један од основних елемената геометрије, геометријска творевина без димензија",Геометријски елемент који има положај али не и димензије.,exact
тачка,noun,оно што својим изгледом личи на тај знак.,веома мали кружни облик,exact
тачка,noun,"одређени део простора, место; положај, позиција, средиште",Прецизно место негде; просторно ограничено место.,exact
тачка,noun,"одељак текста означен редним бројем и њиме обухваћена садржина, одредба, пропис; редним бројем означен елеменат неког програма:",Одређени део који може да се одвоји унутар групе ствари које могу да се поброје на списку.,narrower
талас,noun,"уздигнути део водене масе (изазван обично ветром), гребен на површини воде која се љуља, гиба, вал; сличан део неке друге материје, масе и сл. која се гиба.",Један у низу гребена који се крећу површином течности (посебно преко неке велике водене масе).,exact
талас,noun,"уопште појава ширења каквог побуђеног стања у некој средини или физичком пољу, отклон (померање, згуснуће и др.) од нормалног стања, односно равнотежног положаја, валовито кретање (уопште):",Прогресивно ометање које се преноси без померања самог средства (физика).,exact
талог,noun,"нерастворени, гушћи слој који се излучује из какве текуће материје и скупља на дну и на зидовима посуде, јаме, корита и сл.; накупљена трошна материја, нанос.",Седимент који се слегао на дну течности.,exact
талог,noun,"оно што остане од нечега, после нечега, остаци, трагови.",Твар која остане када се нешто уклони.,exact
тама,noun,"одсуство светлости, мрак, простор без светлости.",одсуство светла или осветљења,exact
тама,noun,"заосталост, незнање, непросвећеност, необавештеност, неупућеност.",одсуство моралних или духовних вредности,related
танак,adjective,"који је мале дебљине, који се јавља у плитком слоју, чији је попречни пресек малог обима;",Релативно малог простирања од једне до дурге супротне површине.,exact
танак,adjective,"звонак, висок; пискав (о гласу)","За звук, посебно глас.",exact
тапкати,verb,"кретати се, корачати обично лаганим и ситним корацима производећи тупе шумове тап(а)-тап(а); ходати, ићи, поравнавати земљу лако ударајући табанима; газити с ноге на ногу у ограниченом простору, топтати.",Производити лагане ритмичке ударце по површини.,related
театар,noun,"место, зграда где се изводе позоришни, казалишни комади, позориште, казалиште.",Зграда у којој се могу организовати позоришне или филмске представе.,exact
теглити,verb,"радити без одмора тешке послове, ринтати, диринџити, издирати",Тешко радити.,exact
теглити,verb,"истезати се, развлачити се","Вући, као против нечега што пружа отпор.",exact
тегљач,noun,"брод за тегљење, вучу других пловних објеката, реморкер.",Снажан мали чамац направљен да вуче или гура веће бродове.,exact
тегљач,noun,"уопште возило које тегли, вуче друга возила која су без властитог погона.",Самоходно возило погодно за вучу.,exact
тегоба,noun,"физичка нелагодност, мучнина, мука",лак али често сталан телесни поремећај или болест,related
тегоба,noun,"трпљење; мука, невоља.",Нешто што узрокује или укључује патњу.,exact
тело,noun,"човечји или животињски организам, схваћен у својој целовитости (као морфолошка и функционална целина).","Целокупна физичка структура једног организма, посебно животиње или човека.",exact
тело,noun,"мртав човечји организам, леш.","Целокупна физичка структура једног организма, посебно животиње или човека.",related
тело,noun,"удружење, скуп, организација, служба, установа с одређеном наменом, функцијом у јавном, друштвеном и политичком животу:",Група људи који су повезани неком заједничком везом или занимањем и посматрају се као целина.,exact
тема,noun,"предмет, основна, главна мисао (расправе, говора, уметничког дела и сл.).",Уједињујућа идеја која се стално јавља у књижевном или уметничком делу.,exact
тема,noun,"мотив музичке композиције, музичког дела који мелодијски, хармонијски и ритмички представља целину и служи као основа за варијације",След нота које образују препознатљиву секвенцу.,exact
