lemma,pos,sense_source,sense_target,semantic_relationship
царство,noun,царевина.,земља којом управља цар или царица,exact
цена,noun,"вредност чега (робе, рада и сл.) изражена у новцу или чему другом",Својство поседовања материјалне вредности: обично се исказује новчаним износом који би нешто донело да се прода.,exact
цена,noun,"важност, вредност, значење.",Висока вредност нечега.,broader
ценити,verb,"одмеравати, одређивати, утврђивати цену или вредност нечему.",Одредити цену.,broader
ценити,verb,"стварати одређени суд о некоме или нечему, просуђивати, (пр)оцењивати.",Проценити да је нешто могуће.,broader
ценити,verb,ценкати се.,Одредити цену.,narrower
центар,noun,"у геометријској фигури (кругу, лопти) тачка која је од свих тачака обима или површине подједнако удаљена",тачка једнако удаљена од крајева линије или завршетака лика,exact
центар,noun,"средина, средиште, средњи део града који се обично налази у средини градског простора:",Зона која је приближно централна унутар неког већег подручја.,exact
центар,noun,"место где је сконцентрисана каква активност, руководство, управа; град или насеље које има административни, културни, индустријски и сл. значај за какву област или земљу; највиши орган (органи) какве активности:",Зграда посвећена посебној активности.,related
центар,noun,"оно што је најглавније, око чега се све разврстава, скупља.",Најпробранији или најсадржајнији или најважнији део неке идеје или искуства.,exact
центар,noun,у буржоаском парламенту партија која стоји између левице и деснице.,Политички умерене особе; центраши.,exact
центиметар,noun,стоти део метра.,јединица за дужину која износи једну стотину метра,exact
центиметар,noun,кројачка врпца за мерење дужине с назначеним центиметрима.,Мерни инструмент који се састоји од уске траке од метала или тканине на којој су означени инчи или центиметри и служи за мерење дужине.,narrower
цеваница,noun,"кост ноге од колена до глежња, голен, гњат",унутрашња дебља кост људске ноге од колена до глежња кнее анд анкле,exact
цеваница,noun,"надлактица, рамењача.",део меса са доњег дела ноге,related
циклус,noun,скуп појава које се развијају и понављају по једном утврђеном реду у једном временском раздобљу:,интервал у току кога се понавља секвенција догађаја,related
циклус,noun,"скуп радња, уметничких дела, песама, научних дисциплина повезаних међу собом сродношћу садржаја, главном идејом, главним лицем или ауторством и сл.:",серија песама које повезује иста тема,broader
црква,noun,"зграда у којој се врше верски обреди, храм, богомоља.",Место за јавно богослужење (посебно хришћанско).,exact
црква,noun,служба у цркви.,Служба која се обавља у цркви.,exact
црта,noun,"гранична, међашна линија (стварна или замишљена) која дели, одваја што од чега.",Просторна локација коју дефинише стварно или замишљено једнодимзенионално ширење.,related
црта,noun,"оно што је изразито, обележје, особина, особеност.",Карактеристично својство које дефинише очигледну индивидуалну природу нечега.,exact
цртати,verb,"правити, вући црте, линије.",Остављати или цртати по површини.,exact
цртати,verb,правити цртеж:,"Направити цртеж нечега; представити цртањем, оловком, кредом итд. на површини.",exact
црвенперка,noun,врста рибе црвених пераја,Врста рибе црвених пераја.,exact
црвенперка,noun,мала птица црвенкастог перја из пор. дроздова,велики батокљунац који живи у четинарским шумама,related
чинилац,noun,"оно што условљава постојање чега, узрок или услов, покретачка снага, фактор.",Било шта што узрочно доприноси резултату.,exact
чинилац,noun,број који се множи с неким другим бројем.,Било који од бројева или симбола који чине производ када се међусобно помноже.,exact
чинити,verb,"радом (физичким или умним) деловати тако да нешто постане друкчије правити, израђивати, стварати, творити.","Учинити да се нешто деси, не мора бити с намером.",broader
чинити,verb,"вршити какву радњу, бавити се каквом активношћу, бити заузет, забављен чим, радити",Поступати тако да то доведе то настајања нечега.,related
чинити,verb,поступати према коме или чему.,Изводити неку акцију.,related
чинити,verb,"износити, сачињавати.",Формирати или бити састав нечега.,related
чист,adjective,"који је без прљавштине, без мрља, који није упрљан, уредан;",Без прљавштине или нечистоће; онај који има навику да буде чист,exact
чист,adjective,"који пази на чистоћу, уредан, педантан:","онај који је без недостатака, неправилности и нечистоће",related
чист,adjective,"морално беспрекоран, који не садржи у себи никакве лажи, преваре, поштен, частан.",Користи се за особе и њихово понашање; који нема мана; безгрешан.,broader
читати,verb,с разумевањем пратити оно што је написано или наштампано на страном језику.,Интерпретирати нешто што је написано или наштампано.,narrower
читати,verb,"изговарати гласно оно што је написано или наштампано, држећи текст у рукама или говорећи напамет, декламовати, рецитовати:","Гледати, тумачити и изговарати наглас нешто што је написано или одштампано",exact
чизма,noun,"врста обуће, обично кожне, која сеже до колена или преко колена.",Обућа која покрива цело стопало и потколеницу. ,exact
члан,noun,"припадник неког друштва, удружења, организације, народа и сл.:",Једна од особа које чине социјалну групу (посебно особе које су приступиле некој организацији).,exact
члан,noun,"одељак, поглавље неког текста (закона, уредбе, правилника) који говори само о једној ствари или развија само једну мисао;","Посебна секција законског документа, какви су статути, уговори или тестаменти.",broader
члан,noun,део веће целине.,Било шта што припада скупу или класи.,related
члан,noun,"врста речи несамосталног значења која у неким језицима даје посебну смисаону или граматичку вредност, речи уз коју се налази:",детерминатор који одређује специфичност референције именичке синтагме,exact
чланак,noun,"краћи састав о каквом питању из политике, науке, књижевности и сл.",Нефикционална проза која чини независан део публикације.,exact
чланак,noun,"зглавак, зглоб (на нози или руци), обично глежањ.","Зглоб који спаја стопало и потколеничну кост, тарсус.",broader
чопор,noun,"скуп животиња, крдо.",Група животиња које лове.,broader
чопор,noun,"велики број, мноштво, гомила.",Гомила у покрету.,related
човек,noun,"друштвено биће које мисли, говори и располаже способношћу да ствара оруђа и да се њима служи у процесу друштвенога рада.",Генеричко корошћење речи за реферисање било ког људског бића.,broader
човек,noun,"зрео, одрастао мушкарац.",Одрасла мушка особа (насупрот жени).,exact
човек,noun,"муж, супруг.","Мушка особа која игра значајну улогу (муж, љубавник или момак) у животу одређене жене.",exact
чути,verb,"опазити, опажати слухом, примити, примати звукове чулом слуха.",Осетити звук путем чула слуха.,exact
чути,verb,"моћи опажати звукове, имати дар, способност слуха.",Чути и разумети.,related
чувар,noun,онај који чува:,Пазитељ који је задужен да будно мотри.,exact
чувар,noun,"заштитник, бранилац.",Особа која се брина о људима и њиховој својини.,related
фамилија,noun,"породица, обитељ.",Људи који потичу од истог претка.,narrower
фамилија,noun,"скуп сродних биљних или животињских врста, породица.",Таксономска група која садржи један или више родова.,exact
фаун,noun,"ниже божанство у староримској митологији, добри дух шума и ливада, заштитник пастира и стоке, сатир.",у римској митологији древно сеоско божанство; у грчкој митологији му одговара бог Пан,exact
фигура,noun,"лик човека или животиње у сликарству или скулптури, кипарству; слика, цртеж.",репрезентација особе (посебно у облику скулптуре),related
фигура,noun,"облик људског тела, стас, раст.",Разна имена за тело људског бића.,exact
фигура,noun,"обрис, контура; облик уопште; распоред предмета, појава у неком поретку или реду.","Комбинација тачака, правих и равни које формирају виђив и опипљив облик.",broader
фигура,noun,"нарочита употреба речи која им даје особиту изражајност, сликовит израз.",Нешто у уметничком делу чија је намера да постигне одређени ефекат.,exact
филе,noun,"месни део на хрптењачи, кичми животиње; печеница",меко месо у пределу крста са обе стране кичменог стуба,exact
фокус,noun,"тачка у којој се секу светлосни зраци после одбијања од издубљеног огледала или после преламања кроз сочиво, жижа.",тачка сабирања светлости (или другог исијавања) или тачка из које се расипа,exact
фокус,noun,"средиште, жариште, центар.",Концентрација пажње или енергије на нешто.,related
фонд,noun,"новчана и сл. средства прикупљена у неку сврху, заклада:",резерва новца остављена на страну за неку сврху,exact
фонд,noun,имовина у новцу и др. вредностима.,Имовина коју поседује једна страна (повереник) зарад друге (опуномоћеника).,broader
фортисимо,noun,динамична ознака за веома снажно извођење тонова.,динамичка ознака за врло снажно извођење тонова,exact
фортисимо,noun,"још виши глас него форте, врло јако, снажно певање, свирање, снажан глас.","још виши глас него форте, врло јако, снажно певање или свирање",exact
фронт,noun,"у рату подручје, линија на којој се води борба међу двема војскама;",Линија на којој се срећу супротстављене војске.,exact
фронт,noun,гранично подручје између хладне и топле струје.,Атмосферски феномен који се ствара на граници између две различите масе ваздуха.,exact
функција,noun,"вршење неке радње или службе; дужност, посао, служба.",Акције или активности које су додељене или се захтевају од особе или групе.,exact
функција,noun,"сврха, намена, циљ.",За шта се нешто користи.,exact
функција,noun,специфичан рад органа и рад организма уопште.,Органски процес који се одиграва у телу.,exact
хаљина,noun,одећа женска или мушка која се носи поврх рубља.,једноделна одећа за жене; има сукњу и блузу,broader
хаљина,noun,мушко одело састављено од више делова; сви делови женске одеће за једну прилику.,одећа посебног стила или за посебну прилику,exact
хашиш,noun,источњачка опојна дрога.,Биљка јаког мириса од чијег се осушеног лишћа прави много халуцинантних дрога; сировина за тканину и ужад.,narrower
хашиш,noun,индијска конопља,Прецишћени екстракт индијске конопље; користи се као халуциноген.,broader
патити,verb,"имати какву болест, боловати; трпети јак физички бол, мучити се.",Не осецати се добро или удобно.,exact
патити,verb,"осећати морални, душевни бол, патњу.",Бити подвргнут (емоционалном болу).,exact
патријаршија,noun,подручје којим управља патријарх.,Јурисдикција патријарха.,related
патријаршија,noun,зграда у којој се налази та управа.,Зграда у којој се налази црквена управа на чијем је челу патријарх.,exact
пепељуга,noun,женска особа пепелом упрљана; запостављена девојка или жена.,млада девојка коју спашавају од зле маћехе и злих сестара добра вила и принц,broader
пепељуга,noun,"врста еје, еја ливадарка",Смеђа европска еја.,exact
пепељуга,noun,дивља лобода,Честа европска коровска биљка.,exact
пешак,noun,војник који служи у пешадији.,војник који се бори на ногама с малим оружјем,exact
пешак,noun,"фигура у шаху, пион, пијурац:","најслабија фигура у шаху, креће се само унапред, а избацује противника само са стране",exact
песма,noun,"низ речи или људских гласова изговорених вишим и нижим тоновима различита трајања, сложеним у мелодрамску целину.",Кратка музичка композиција са речима.,related
песма,noun,"песничка творевина у стиховима, понајвише лирско (може се удесити и за певање).",Композиција написана у метричком облику чиме се добијају ритмички редови.,exact
певање,noun,гл. им. од певати.,чин извођења вокалне музике,exact
певање,noun,садржајно заокружен део или одломак каквог великог спева или епа:,већа целина дуге песме,related
пијукавац,noun,врста птице из реда пијукавки:,Нека од многобројних приобалних птица чврсте грађе које имају раван кљун и велика зашиљена крила.,exact
пијукавац,noun,"биљка из пор. уснатица, мртва коприва","Биљка из породице уснатица, мртва коприва.",exact
пилав,noun,густо кувани пиринач с месом пилећим или овчјим.,"пиринач и пилетина кувани заједно, са или без других састојака, зачињено по жељи",broader
писање,noun,гл. им. од писати (се).,Активност уобличавања нечега у писани облик.,exact
писање,noun,рад на књижевном пољу.,чин стварања писаних дела,exact
писати,verb,"бележити на папиру, хартији или др. слова, бројке, цифре итд.",Остављати или цртати по површини.,related
писати,verb,"стварати, састављати какав текст, књижевно дело.",Производити литерарно дело.,broader
писати,verb,"обраћати се коме писмено, писмом јављати, саопштавати, слати писмо.",Пренети или изразити у писаном облику.,exact
пискав,adjective,"врло висок, танак, пиштав, крештав (о гласу, звуку).","За звук, посебно глас.",exact
пити,verb,уносити кроз уста у свој организам какву течност и гутати је:,Узимати течност.,exact
пити,verb,"имати склоност пићу, проводити време пијући жестока пића, бити алкохоличар, опијати се.",Пити велике количине алкохолних пића; бити алкохоличар.,exact
пиво,noun,"пиће које се прави од јечма, хмеља, квасца и воде.","општи назив за алкохолна пића са укусом хмеља, добијена ферментисањем неке житарице (или мешавине житарица)",exact
пиво,noun,пиће уопште.,општи назив за пиво добијено са врха при ферментацији квасца; у неким америчким државама (по закону) пиво са више од 4% алкохола,broader
план,noun,"цртеж, нацрт који у одређеном мерилу, размеру приказује на равној површини какво место, предео, грађевину и сл., пројек(а)т:",Шема устројства.,narrower
план,noun,замисао о радњама које треба извршити да се постигне жељени циљ.,Низ корака које треба учинити или циљева које треба постићи.,exact
племе,noun,"заједница људи у првобитном, преткласном друштвеном уређењу повезаних родовским везама, заједничким језиком и територијом.",друштвена група (обично пре појаве писма),exact
племе,noun,"род, обитељ, породица.",Група људи који су крвно повезани или преко брака.,exact
пљескавица,noun,испржено на жару млевено и спљескано месо.,"Испржено на жару млевено, зачињено и спљескано месо.",exact
плоча,noun,"нарочито удешен плоснати, танки комад од разног материјала за различите сврхе.",Равно парче материјала направљено за специјалну намену.,exact
плоча,noun,"тврде, покретљиве коштане љуске које заштићују тело неких животиња (риба, гуштера, змија).",патолошке промене у виду плочастих површина на телу или у њему.,related
пловити,verb,"кретати се по површини воде у одређеном правцу помоћу нарочитих направа (о чамцу, броду, лађи).",Кретати се са клиским покретима.,exact
пловити,verb,пливати (1б),Остајати на течној површини; не тонути.,exact
побити,verb,"лишити живота, убити једно за другим.",Убити велик број људи без разлике.,exact
побити,verb,"оповрћи чију тврдњу, доказати супротно од онога што други тврди.",Доказати да је нешто погрешно.,exact
почетак,noun,"први, уводни део чега;",Чин почињања нечега.,exact
почетак,noun,"полазна тачка, исходиште.","Место где нешто почине, где настаје.",exact
почетак,noun,"извор, узрок.",Са чиме нешто почиње.,exact
поделити,verb,"раставити на делове, раздвојити.",Учинити да се нешто подели или одвоји.,exact
поделити,verb,извршити деобу давши свакоме део.,Разделити на мале комаде.,narrower
