lemma,pos,sense_source,sense_target,semantic_relationship
склонити,verb,"сместити на сигурно, заклоњено место; ставити на одређено место (ради бољег чувања), спремити.",Обезбедити склониште.,exact
склонити,verb,"померити се, помаћи се с каквог места.","Уклонити нешто конкретно, нпр. дизањем, гурањем, уклањањем, или уклонити нешто апстрактно.",related
склонити,verb,"отићи на какво сигурно место, уклонити се.",Обезбедити склониште.,exact
склоност,noun,"расположење, воља, спремност за нешто.","Ментални став, посебно такав који даје предност једној алтернативи над другом.",related
склоност,noun,"наклоност према некоме, симпатија, љубав.",Осећај задовољства или ужитка.,related
скок,noun,"брзо премештање тела кроз ваздух с једног места на друго уз одбијање, одбацивање ногама с места на коме се стоји:",Чин скакања; одвајање тела од земље.,exact
скок,noun,прелаз из једног стања у друго без постепених развојних фаза.,Нагли прелазак.,related
скуп,noun,више или мање особа на истом месту.,Група људи заједно на једном месту.,exact
скуп,noun,један од основних појмова на којем се оснива у последње време математика:,апстрактан збир бројева и симбола,related
скупити,verb,"сабрати на једно место, сазвати; стерати.",Прикупити заједно.,exact
скупити,verb,"стиснути, стегнути (уста, обрве, рамена).",Стиснути једно уз друго.,exact
скупити,verb,сабрати се на једном месту,Прикупити заједно.,exact
слаб,adjective,"који је мале физичке снаге, који није јаког, чврстог телесног састава; болешљив, слабуњав (о човеку и животињи); који је изнемогао, онемоћао од болести, исцрпености.",који има мало физичке снаге или здравља,exact
слаб,adjective,"мален по интензитету, по снази испољавања, који није довољно јасан, изражајан.","Који није влик по количини, броју или степену.",exact
славити,verb,"хваљењем уздизати коме или чему вредност, стварати славу, прослављати.",славити врлине своје деце,broader
славити,verb,"одржавати част, весеље приликом какве свечаности или каквог важног догађаја.",Имати прославу.,exact
славити,verb,"бити чувен, на гласу, познат по чему.",причати о чему са задовољством,related
слика,noun,"производ сликарства, уметнички израђен у бојама на платну, хартији, дрвету, стаклу и сл.: ~ масним бојама на платну, ~ сувим бојама.<B>",Графичка уметност која се састоји од уметничке композиције добијене наношењем боје на неку површину.,exact
слика,noun,фотографија или филмски снимак.,"Визуелна репрезентација објекта, сцене, особе или апстракције, произведена на некој површини.",related
слика,noun,опис чега у књижевном делу или усменом причању,Графички или жив вербални опис.,narrower
слика,noun,представа.,ситуација која се третира као осмотрив предмет,related
сликати,verb,"стварати сликарско дело, правити слике у боји или цртежом",Правити слику.,exact
сликати,verb,"снимати фотографским апаратом, фотографисати.",Снимати на фотографском филму.,exact
сликати,verb,фотографисати се.,Правити слику.,exact
сликати,verb,"показивати се, појављивати се, причињавати се у машти.",Снимати на фотографском филму.,broader
сликовит,adjective,"који се представља сликом, исказује помоћу слика.",који се односи на слике или се састоји од слика,exact
сликовит,adjective,"који је пун слика, живописан, изразит, пластичан (о језику, стилу).",(употребљено у значењу речи или текста) који није дослван; који користи метафоре,exact
слобода,noun,"могућност испољавања своје воље у границама природних и друштвених закона, стање у коме човек није ограничен у одлучивању о себи, о својој судбини",имунитет од произвољне демонстрације власти: политичка независност,broader
слобода,noun,"лична независност, самосталност, која није ограничена никаквим обавезама, могућност поступања по својој вољи",Стање слободе; моћ деловања или говора или мишљења без ограда. наметнутих споља,exact
слог,noun,реч или део речи од једног самогласника самог или с једним или више сугласника који се осећа као изговорна целина.,јединица говорног језика већа од фонеме,exact
слог,noun,сложена слова за штампање неког текста; отисак слова (у штампарији).,мали метални блок који носи испупчено слово на једном крају; даје штампано слово када се замасти и притисне на папир,exact
слово,noun,"писмени знак у писму, азбуци, који обично одговара одређеном гласу:",Уобичајени карактер алфабета који се користи за представљање говора.,exact
слово,noun,"типографски знак одређеног облика и величине, који се употребљава у штампању каквог текста.",мали метални блок који носи испупчено слово на једном крају; даје штампано слово када се замасти и притисне на папир,broader
сложити,verb,"положити, ставити на једно место више предмета у одређеном реду, на одређен начин.",Сложити у амбалажу.,broader
сложити,verb,"припремити слог, поређати слова за штампање према рукопису.",обликовати штампани материјал у тражени формат,exact
сложити,verb,"саставити, смислити, створити.",ређање речи текста тако да буду у складу,broader
сложити,verb,"довести у склад, сагласност, подударност, ускладити.",Учинити да се слаже или сагласи.,exact
сложити,verb,"скупити се, саставити се, здружити се стварајући какав ред, облик, целину.",Сложити у амбалажу.,exact
сложити,verb,"спустити се, покрити (какву површину)",обликовати штампани материјал у тражени формат,exact
случај,noun,"стање, ситуација, околности, прилике у којима се што догађа.",посебан сплет околности,exact
слушати,verb,"примати слухом што, пратити слухом нечији говор, излагање.",ослушкивати са намером,broader
слушати,verb,"придржавати се чијих савета, наредаба, заповести, покоравати се, потчињавати се коме.",Бити послушан некоме.,exact
служба,noun,"рад за плату (обично у непроизводним делатностима), вршење јавне дужности.",Посао у некој организацији.,exact
служба,noun,"нарочита грана, област, врста рада, занимања:",Временски период проведен у војној служби.,related
служба,noun,"богослужење, црквени, верски обред.",Чин јавног вероисповедања.,related
служити,verb,"бити слуга, радити код некога кућне и друге послове за плату, радити, вршити разне послове испуњавајући чију вољу, наредбу, заповест, дворити.",Радити за некога или бити некоме слуга.,exact
служити,verb,"доносити јело и пиће (у угоститељској радњи и сл.), послуживати.",Обезбедити (обично храну али може и нешто друго).,exact
служити,verb,"бринути се на корист, напредак чега, радити у чију корист.","Бити у служби, бити слуга, као слуга народа, институције или идеја.",related
служити,verb,"вршити, обављати оно чему је што намењено, за што је одређено (о органима тела, о оруђима и сл.).","Служити сврси, улози или функцији.",related
служити,verb,"бити од користи, користити, бити добар за нешто.",бити од користи,exact
служити,verb,вршити неки црквени обред.,вршити у службеном својству неку религиозну церемонију,exact
служити,verb,"узимати (за столом) јело, пиће.",Обезбедити (обично храну али може и нешто друго).,exact
смеса,noun,"мешавина обично добивена заједничким топљењем двају или више метала, легура.",свака материја која се може јести а добијена је машавином разних састојака,narrower
смешати,verb,"мешајући саставити уједно, спојити нешто разноврсно (гасовито, течно житко, сипко) или састављено од више делова.",Смешати у једну целину.,exact
смешати,verb,"спојити, здружити нешто што је разноврсно, створити јединствену масу од разноврсних делова.",Комбиновати у једно.,exact
смешати,verb,"спојити се, здружити се (о нечему разноврсном).",Смешати у једну целину.,exact
смешати,verb,помешати се једно с другим (о разним јединкама).,Комбиновати у једно.,exact
сместити,verb,"поставити што на какво место, наћи место чему.",Поставити у неки положај.,related
сместити,verb,"дати, наћи коме просторију за преноћиште или лежај у болници.",Обезбедити смештај за некога.,exact
сместити,verb,ући у што.,Обезбедити смештај за некога.,related
сметња,noun,"оно што смета, што стоји на путу да се нешто оствари, препрека, запрека; тешкоћа",Нешто што спречава или је оптерећујуће.,exact
сметња,noun,оно што смета нормалном раду (нпр. шумови на радију и сл.).,Електрична или акустична активност која може да омете комуникацију.,broader
смирити,verb,"учинити да престане сукоб, свађа, успоставити мир међу завађенима; угушити немир, умирити, средити свађу, кавгу.",наћи заједнички језик,exact
смирити,verb,"смањити степен интензитета нечега, утишати, ублажити (о болу, о каквом осећању).",Утицати да се неко осећа боље.,broader
смирити,verb,"постати миран, престати показивати узбуђење, узнемиреност (о лицу).",наћи заједнички језик,related
смислити,verb,"схватити, домислити се, доћи на мисао",Начинити планове за нешто.,related
смислити,verb,"измислити оно што не постоји, мишљењем створити.",Замислити неку идеју.,exact
смислити,verb,помислити (на нешто).,Начинити планове за нешто.,related
смоква,noun,"биљна врста и њен плод, који се употребљава као храна у свежем и осушеном стању.",Неко дрво из тропског рода Фицус.производи затворени плод у облику крушке који који постаје меснат и јестив када сазри.,exact
смутити,verb,"изазвати смутњу, неред, узбунити; пореметити, нарушити.",изазивати збуњеност и немогућност да се рационално размишља,exact
смутити,verb,"изазвати узбуђеност, узрујаност, пометеност, збрку, довести у стање збуњености, пометености.",узроковати да се неко збуни или емоционално помете,exact
смутити,verb,"доћи у стање збрке, пометености.",изазивати збуњеност и немогућност да се рационално размишља,exact
снага,noun,"способност физичког и друштвеног рада, јачина, моћ, сила;",Својство некога ко је физички или ментално јак.,exact
снага,noun,"војне јединице, оружани одреди, војна сила, војска.",јединица која је део неког рода војске,exact
снимити,verb,"начинити снимак, фотографисати, сликати.",Снимати на фотографском филму.,exact
снимити,verb,направити филм.,Направити филм или фотографију нечега.,exact
снизити,verb,спустити се,Смањити тон музичке ноте.,exact
снизити,verb,смањити се.,Довести нешто или некога у нижи положај.,exact
сочиво,noun,махунаста биљка из пор. лепирњача с храњивим семењем,Евроазијска биљка која се гаји због јестивог пљоснатог семена које се кува као грашак.,exact
сочиво,noun,плодови махунастих јестивих биљака.,Евроазијска биљка која се гаји због јестивог пљоснатог семена које се кува као грашак.,broader
сочиво,noun,врста конвексног или конкавног стакла које сабира или расипа зраке светла.,прозрачни оптички уређај који се користи да сакупља или расејава светло и формира слике,narrower
сочиво,noun,део ока кроз који се светлост прелама пре него што падне на мрежњачу,Биконвексно прозирно тело смештено иза дужице у оку.,exact
спадати,verb,убрајати се.,Бити класификован са нечим другим.,exact
спадати,verb,"бити у складу с чим, одговарати, доликовати",Бити на правом месту или ситуацији.,related
спавати,verb,бити у стању сна.,Налазити се у стању сна.,exact
спавати,verb,имати сексуалне односе (с киме).,Имати сексуални однос са неким.,exact
спекулирати,verb,"размишљати, разматрати, теоретисати.<B>","Веровати у нешто, посебно на несигурним основама.",related
спекулирати,verb,"бавити се спекулацијом (2), шпекулирати.",Причати на беспослен или необавезан начин са елементом сумње или без довољно разлога да се дође до закључка.,exact
спис,noun,"написан (службени) акт, документ","(право) правни акт који издаје суд, судски службеник",broader
спој,noun,"две или више разних ствари или појмова састављених у једну целину, оно што је састављено у једну целину",(Хемија) Супстанција која се добија хемијским спајањем два или више елемената или састојака у прописаном односу према тежини.,broader
спој,noun,"место где се две ствари спајају, сједињују.",Облик или начин на који се ствари приближавају и успоставља се веза.,related
спој,noun,"материја која се добија хемијским спајањем двају или више различитих елемената, једињење.",Једињење описано у категоријама центарлног атома за који су други атоми везани или усклађени.,exact
спољашњи,adjective,"који је споља, спољни, вањски",који се дешава или је смештено изван неких граница или изван неке површи,exact
спољашњи,adjective,спољни (2).,који има поркело или се развија споља,related
спремиште,noun,"нарочито уређено место за чување робе (оружја, машина, књига и сл.), складиште, стовариште, магазин",место где ствари могу да се оставе на чување,exact
спремиште,noun,"место где се уопште нешто прикупља, сабира, задржава",електронски меморијски уређај,related
спровести,verb,"учинити да неко приспе до одређеног места (обично показујући му пут, правећи му друштво, пратећи га), отпратити.",Послати од једне особе или места на друго.,exact
спровести,verb,"отпремити (некога, нешто) уз оружану пратњу.",Послати од једне особе или места на друго.,narrower
срамота,noun,"стање, положај који изазива презир, понижење; увреда.",стање обешчашћења,broader
срамота,noun,"дубоко, јако осећање срама",болан осећај који произлази из свести о недовољности или кривици,exact
срамота,noun,"нечастан, срамотан чин.",Сраман догађај.,exact
срце,noun,централни мишићасти орган који регулише крвоток у телу човека (и већине животиња) и који се налази на левој страни грудне дупље,шупљи мишични орган смештен између стернума и плућа; његове ритмичке контракције покрећу крвоток,exact
срце,noun,"духовно и емотивно расположење; љубавно осећање, љубав",Наклоност или тежња одређене врсте.,related
срце,noun,"средишно место (државе, покрајине, области), средиште, центар.",Зона која је приближно централна унутар неког већег подручја.,exact
срце,noun,"оно што је најбитније, најважније, срж, суштина.",Најпробранији или најсадржајнији или најважнији део неке идеје или искуства.,exact
средина,noun,"тачка подједнако удаљена од крајева; место (више или мање) удаљено од крајева чега, средиште, центар",тачка једнако удаљена од крајева линије или завршетака лика,exact
средина,noun,социјално-животне околности и услови у којима протиче живот човека.,Стање окружења у коме се одвија ситуација.,narrower
средиште,noun,"средишњи део, средина чега.",Зона која је приближно централна унутар неког већег подручја.,related
средиште,noun,"место у којему је усредсређена каква активност, руководство, власт; онај који је носилац активности, који је најглавнији, око кога се све окупља.",Концентрација пажње или енергије на нешто.,related
средиште,noun,тачка од које су све тачке круга или сфере кугле једнако удаљене.,тачка једнако удаљена од крајева линије или завршетака лика,exact
средити,verb,"сложити по неком реду (по годинама, величини и сл.)",Довести у исправан или систематичан поредак.,broader
средити,verb,доћи у ред; довести у ред (мисли).,Поправити заменом дела или састављањем одвојеног или сломљеног.,related
средити,verb,"доћи к себи, смирити се, умирити се.",Довести у исправан или систематичан поредак.,related
средство,noun,"начин, поступак у раду који се употребљава и примењује да се нешто постигне.",Како се добија неки резултат или постиже неки циљ.,exact
средство,noun,"оруђе (инструменат, предмет, разне направе, справе и сл.) неопходно потребно да се нешто оствари.",Инструменат који се користи да би се постигао неки циљ.,exact
